rank,yearRank,candidateRank,year,title,authors,venue,publicationDate,citationCount,influentialCitationCount,importanceScore,category,methodTags,keywordTags,keyIdea,strengths,limitations,url,semanticScholarUrl,openAccessPdf,githubUrl,doi,arxiv,pubmed,corpusId,fieldsOfStudy,publicationTypes,sourceQueries,queryHitCount,importanceReasons,abstract
1158,43,79,2018,Do stocks outperform Treasury bills?,H. Bessembinder,Journal of Financial Economics,2018-05-28,205,18,175.435,Asset Pricing and Return Predictability,metadata-ranked,stock-prediction,The majority of common stocks that have appeared in the Center for Research in Security Prices (CRSP) database since 1926 have lifetime buy-and-hold returns less than one-month Treasuries.,high citation signal (205); influential citation signal (18); recognized finance/AI venue,"Return predictability can disappear after transaction costs, crowding, and multiple-testing correction.; Citation impact can favor well-known anomalies even when live performance later weakens.; Metadata cannot verify whether data-snooping controls were adequate.",https://doi.org/10.1016/J.JFINECO.2018.06.004,https://www.semanticscholar.org/paper/6eb9a6c27e6fb719d2acd5b11715bf0d703617a2,,,10.1016/J.JFINECO.2018.06.004,,,157380559,Business; Economics,,securities market; stock returns,2,citations=205; influential=18; recognized finance/AI venue; open PDF metadata; trade term matches=4; query hits=2,"The majority of common stocks that have appeared in the Center for Research in Security Prices (CRSP) database since 1926 have lifetime buy-and-hold returns less than one-month Treasuries. When stated in terms of lifetime dollar wealth creation, the best-performing 4% of listed companies explain the net gain for the entire US stock market since 1926, as other stocks collectively matched Treasury bills. These results highlight the important role of positive skewness in the distribution of individual stock returns, attributable to skewness in monthly returns and to the effects of compounding. The results help to explain why poorly diversified active strategies most often underperform market averages."
1175,44,80,2018,Institutional Cross-Ownership and Corporate Strategy: The Case of Mergers and Acquisitions,"Chris Brooks, Zhong Chen, Yeqin Zeng",,2018-02-01,203,8,149.76,Market Microstructure and High-Frequency Trading,metadata-ranked,high-frequency,This article provides new evidence on the important role of institutional investors in affecting corporate strategy.,high citation signal (203); open-access PDF metadata,"High-frequency results depend heavily on market access, latency, fees, and order-book reconstruction quality.; Public metadata rarely reveals execution assumptions.; Short-horizon predictability can vanish when capacity and competition are considered.",https://doi.org/10.1016/J.JCORPFIN.2017.11.003,https://www.semanticscholar.org/paper/5433f1723e60167abc2a5041100167eceb03f72a,https://durham-repository.worktribe.com/preview/1318602/26343.pdf,,10.1016/J.JCORPFIN.2017.11.003,,,155769075,Business; Economics,,stock returns,1,citations=203; influential=8; open PDF metadata; trade term matches=1,"This article provides new evidence on the important role of institutional investors in affecting corporate strategy. Institutional cross-ownership between two firms not only increases the probability of them merging, but also affects the outcomes of mergers and acquisitions (M&As). Institutional cross-ownership reduces deal premiums, increases stock payment in M&A transactions, and lowers the completion probabilities of deals with negative acquirer announcement returns. Furthermore, deals with high institutional cross-ownership have lower transaction costs and disclose more transparent financial statement information. The effect of cross-ownership on the total deal synergies and post-deal long-term performance is positive, which can be attributed to independent and non-transient cross-owners. Our findings are robust after mitigating the cross-ownership asymmetry concern. Overall, our results suggest that the growth of institutional cross-holdings in U.S. stock markets may greatly change corporate strategies and decision-making processes."
1189,45,82,2018,The impact of energy prices on clean energy stock prices. A multivariate quantile dependence approach,"J. Reboredo, A. Ugolini",Energy Economics,2018-10-01,201,4,154.314,Market Microstructure and High-Frequency Trading,reinforcement-learning; risk/volatility,reinforcement-trading; high-frequency; risk-volatility,"Abstract We assess the impact of quantile price movements in oil, gas, coal and electricity on the quantiles of clean energy stock returns using a multivariate vine-copula dependence setup.",high citation signal (201),"High-frequency results depend heavily on market access, latency, fees, and order-book reconstruction quality.; Public metadata rarely reveals execution assumptions.; Short-horizon predictability can vanish when capacity and competition are considered.",https://doi.org/10.1016/J.ENECO.2018.10.012,https://www.semanticscholar.org/paper/8a2c928fd27065397c6840d334f2ad04798f52b4,,,10.1016/J.ENECO.2018.10.012,,,158709207,Economics; Environmental Science,,stock returns,1,citations=201; influential=4; investment validation signal; open PDF metadata; title trade matches=2; trade term matches=5,"Abstract We assess the impact of quantile price movements in oil, gas, coal and electricity on the quantiles of clean energy stock returns using a multivariate vine-copula dependence setup. For the period 2009–2016, our evidence shows that oil and electricity prices were major contributors to the dynamics of clean energy stock returns in the USA and the EU, respectively, whereas the other energy prices played a minor role in shaping clean energy stock returns. Furthermore, we find evidence of a symmetric energy price impact, so extreme upward and downward energy price movements had a similar impact on clean energy stock returns. This evidence has potential implications for risk management decision making by energy investors and for policy maker decisions regarding support for clean energy deployment."
1199,46,83,2018,Practical Deep Reinforcement Learning Approach for Stock Trading,"Zhuoran Xiong, Xiao-Yang Liu, Shanli Zhong, Hongyang Yang, A. Elwalid",arXiv.org,2018-11-19,199,17,180.028,Reinforcement Learning and Algorithmic Trading,portfolio; reinforcement-learning,stock-prediction; ai-based-trade; portfolio; reinforcement-trading,Stock trading strategy plays a crucial role in investment companies.,high citation signal (199); influential citation signal (17),"Simulated rewards can diverge from executable trading under slippage, latency, and market impact.; Policies can be brittle during regime shifts or stress periods.; Backtest-only evidence needs live or paper-trading validation.",https://www.semanticscholar.org/paper/412fbb7ffa29aa6b2e172c1f545223baf18f1b6e,https://www.semanticscholar.org/paper/412fbb7ffa29aa6b2e172c1f545223baf18f1b6e,,,,1811.07522,,53714296,Business; Computer Science; Economics; Mathematics,JournalArticle,portfolio optimization stock market; reinforcement learning trading; stock returns; trading strategies stock market,4,citations=199; influential=17; investment validation signal; AI/ML method signal; open PDF metadata; title trade matches=2; trade term matches=5; query hits=4,"Stock trading strategy plays a crucial role in investment companies. However, it is challenging to obtain optimal strategy in the complex and dynamic stock market. We explore the potential of deep reinforcement learning to optimize stock trading strategy and thus maximize investment return. 30 stocks are selected as our trading stocks and their daily prices are used as the training and trading market environment. We train a deep reinforcement learning agent and obtain an adaptive trading strategy. The agent's performance is evaluated and compared with Dow Jones Industrial Average and the traditional min-variance portfolio allocation strategy. The proposed deep reinforcement learning approach is shown to outperform the two baselines in terms of both the Sharpe ratio and cumulative returns."
1234,47,84,2018,Common-Ownership Concentration and Corporate Conduct,Martin C. Schmalz,Annual Review of Financial Economics,2018-05-10,197,4,146.874,Deep Learning and Financial Time Series,survey/review; forecasting; deep-learning,stock-prediction; deep-learning; behavioral-finance,The question of whether and how partial common-ownership links between strategically interacting firms affect firm objectives and behavior has been the subject of theoretical inquiry for decades.,high citation signal (197); open-access PDF metadata,"Deep models can overfit noisy, nonstationary, and low signal-to-noise market data.; Compute-heavy models may be hard to reproduce without code and data access.; Reported gains need robustness checks across regimes and markets.",https://doi.org/10.1146/ANNUREV-FINANCIAL-110217-022747,https://www.semanticscholar.org/paper/0d867a5dde8b8f6abac9c7b84159de19ea24a0e9,https://www.cesifo.org/DocDL/cesifo1_wp6908.pdf,,10.1146/ANNUREV-FINANCIAL-110217-022747,,,168903814,Business; Economics,Review,financial market prediction,1,citations=197; influential=4; survey/benchmark signal; open PDF metadata; trade term matches=2,"The question of whether and how partial common-ownership links between strategically interacting firms affect firm objectives and behavior has been the subject of theoretical inquiry for decades. Since then, the growth of intermediated asset management and consolidation in the asset management sector has led to more pronounced common-ownership links at the level at which corporate control is exercised. Recent empirical research has provided evidence consistent with the literature's prediction that common-ownership concentration (CoOCo) can affect product market outcomes. The resulting antitrust concerns have received worldwide attention. However, because CoOCo can change the objective function of a firm, the potential implications span all fields of economics that involve corporate conduct, including corporate governance, strategy, industrial organization, and financial economics. This article connects the papers establishing the theoretical foundations, reviews the empirical and legal literatures, and discusses challenges and opportunities for future research."
1278,48,88,2018,How investible is Bitcoin? Analyzing the liquidity and transaction costs of Bitcoin markets,"A. H. Dyhrberg, Sean Foley, Jiri Svec",Economics Letters,2018-10-01,192,5,150.864,Market Microstructure and High-Frequency Trading,microstructure; risk/volatility,high-frequency; risk-volatility,We examine the investibility of Bitcoin by exploring the trading dynamics and market microstructure of Bitcoin on three US cryptocurrency exchanges using high frequency intraday data of individual trades and quotes.,high citation signal (192),"High-frequency results depend heavily on market access, latency, fees, and order-book reconstruction quality.; Public metadata rarely reveals execution assumptions.; Short-horizon predictability can vanish when capacity and competition are considered.",https://doi.org/10.1016/J.ECONLET.2018.07.032,https://www.semanticscholar.org/paper/3495ba63e5d1d84d2dc7670744cce75d4e005959,,,10.1016/J.ECONLET.2018.07.032,,,158240258,Business; Economics,,algorithmic trading; market microstructure trading,2,citations=192; influential=5; investment validation signal; open PDF metadata; trade term matches=2; query hits=2,"We examine the investibility of Bitcoin by exploring the trading dynamics and market microstructure of Bitcoin on three US cryptocurrency exchanges using high frequency intraday data of individual trades and quotes. Although all exchanges offer continuous trading, we find that the highest trading activity, highest volatility and lowest spreads coincide with US market trading hours, suggesting that most trades are non-algorithmic and executed by retail investors. We further find that average quoted and effective spreads for Bitcoin are lower than spreads on major equity exchanges, implying that Bitcoin is highly investible for retail size transactions."
1294,49,89,2018,Evaluation of bidirectional LSTM for short-and long-term stock market prediction,"Khaled A. Althelaya, El-Sayed M. El-Alfy, S. Mohammed","International Conference on Information, Communications and Signal Processing",2018-04-03,190,4,153.082,Deep Learning and Financial Time Series,forecasting; deep-learning,stock-prediction; deep-learning; ai-based-trade,Positions Evaluation of bidirectional LSTM for short-and long-term stock market prediction within Deep Learning and Financial Time Series.,high citation signal (190),"Deep models can overfit noisy, nonstationary, and low signal-to-noise market data.; Compute-heavy models may be hard to reproduce without code and data access.; Reported gains need robustness checks across regimes and markets.",https://doi.org/10.1109/IACS.2018.8355458,https://www.semanticscholar.org/paper/22b7e947d1da04e9980bfc6c825ad0fcf3a275da,,,10.1109/IACS.2018.8355458,,,22336446,Business; Computer Science,Conference,deep learning stock prediction; financial market prediction; neural networks stock market; stock market prediction; stock price prediction,5,citations=190; influential=4; open PDF metadata; title trade matches=3; trade term matches=3; query hits=5,
1302,50,90,2018,Quality minus junk,"Clifford S. Asness, Andrea Frazzini, L. Pedersen",Review of accounting studies,2018-11-05,189,9,162.671,"Risk, Volatility, and Forecast Evaluation",survey/review; asset-pricing; risk/volatility,risk-volatility; asset-pricing,We define quality as characteristics that investors should be willing to pay a higher price for.,high citation signal (189); open-access PDF metadata,Risk forecasts can fail under regime breaks and extreme events.; Choice of loss function strongly affects model rankings.; Citation counts do not prove suitability for a specific mandate or risk budget.,https://doi.org/10.2139/SSRN.2312432,https://www.semanticscholar.org/paper/ae40a8167065c89dc9c35baae19cebe454de7bf5,https://link.springer.com/content/pdf/10.1007/s11142-018-9470-2.pdf,,10.2139/SSRN.2312432,,,254987866,Business; Economics,,analyst forecasts stock returns; stock returns,2,citations=189; influential=9; survey/benchmark signal; investment validation signal; open PDF metadata; trade term matches=2; query hits=2,"We define quality as characteristics that investors should be willing to pay a higher price for. Theoretically, we provide a tractable valuation model that shows how stock prices should increase in their quality characteristics: profitability, growth, and safety. Empirically, we find that high-quality stocks do have higher prices on average but not by a large margin. Perhaps because of this puzzlingly modest impact of quality on price, high-quality stocks have high risk-adjusted returns. Indeed, a quality-minus-junk (QMJ) factor that goes long high-quality stocks and shorts low-quality stocks earns significant risk-adjusted returns in the United States and across 24 countries. The price of quality varies over time, reaching a low during the internet bubble, and a low price of quality predicts a high future return of QMJ. Analysts’ price targets and earnings forecasts imply systematic quality-related errors in return and earnings expectations."
1307,51,91,2018,On the determinants of bitcoin returns: A LASSO approach,"Theodore Panagiotidis, T. Stengos, Orestis Vravosinos",Finance Research Letters,2018-12-01,189,3,136.843,"General Finance, Surveys, and Trading Systems",metadata-ranked,stock-prediction,"We examine the significance of twenty-one potential drivers of bitcoin returns for the period 2010 to 2017 (2,533 daily observations).",high citation signal (189); open-access PDF metadata,"Surveys and systems can dominate citations while empirical evidence remains mixed across markets.; Broad claims need careful mapping to data, costs, and investment horizons.; Metadata-driven ranking cannot replace expert reading of full papers and backtests.",https://doi.org/10.1016/J.FRL.2018.03.016,https://www.semanticscholar.org/paper/0aa954fd1cfc4b6e4a3332fdbffad4ad551d9581,https://econpapers.repec.org/scripts/redir.pf?u=http%3A%2F%2Frcea.org%2FRePEc%2Fpdf%2Fwp18-14.pdf;h=repec:rim:rimwps:18-14,,10.1016/J.FRL.2018.03.016,,,158776988,Business; Economics,,stock returns,1,citations=189; influential=3; open PDF metadata; trade term matches=1,"We examine the significance of twenty-one potential drivers of bitcoin returns for the period 2010 to 2017 (2,533 daily observations). Within a LASSO framework, we examine the effects of factors such as stock market returns, exchange rates, gold and oil returns, FED’s and ECB’s rates and internet trends on bitcoin returns for alternate time periods. Search intensity and gold returns emerge as the most important variables for bitcoin returns."
1311,52,92,2018,Predicting the direction of stock markets using optimized neural networks with Google Trends,"Hongping Hu, Li Tang, Shuhua Zhang, Haiyan Wang",Neurocomputing,2018-04-12,188,10,172.889,Deep Learning and Financial Time Series,deep-learning,deep-learning,Positions Predicting the direction of stock markets using optimized neural networks with Google Trends within Deep Learning and Financial Time Series.,high citation signal (188); influential citation signal (10); recognized finance/AI venue,"Deep models can overfit noisy, nonstationary, and low signal-to-noise market data.; Compute-heavy models may be hard to reproduce without code and data access.; Reported gains need robustness checks across regimes and markets.",https://doi.org/10.1016/J.NEUCOM.2018.01.038,https://www.semanticscholar.org/paper/da64cc5cc32e4259d978377b20af20758bfe6c1d,,,10.1016/J.NEUCOM.2018.01.038,,,3965677,Business; Computer Science; Economics; Mathematics,JournalArticle,neural networks stock market; stock market prediction; stock price prediction,3,citations=188; influential=10; recognized finance/AI venue; AI/ML method signal; open PDF metadata; title trade matches=2; trade term matches=2; query hits=3,
1336,53,93,2018,"A hybrid volatility forecasting framework integrating GARCH, artificial neural network, technical analysis and principal components analysis","Werner D. Kristjanpoller, Marcel C. Minutolo",Expert systems with applications,2018-11-01,187,2,163.582,"Risk, Volatility, and Forecast Evaluation",forecasting; deep-learning; risk/volatility,stock-prediction; deep-learning; risk-volatility,"Abstract Measurement, prediction, and modeling of currency price volatility constitutes an important area of research at both the national and corporate level.",high citation signal (187); recognized finance/AI venue,Risk forecasts can fail under regime breaks and extreme events.; Choice of loss function strongly affects model rankings.; Citation counts do not prove suitability for a specific mandate or risk budget.,https://doi.org/10.1016/j.eswa.2018.05.011,https://www.semanticscholar.org/paper/5a7b841fb2b9af7d5619fc92e50c0ee885bb2d98,,,10.1016/j.eswa.2018.05.011,,,49615939,Business; Computer Science; Economics; Mathematics,JournalArticle,financial market prediction,1,citations=187; influential=2; recognized finance/AI venue; investment validation signal; AI/ML method signal; open PDF metadata; title trade matches=4; trade term matches=5,"Abstract Measurement, prediction, and modeling of currency price volatility constitutes an important area of research at both the national and corporate level. Countries attempt to understand currency volatility to set national economic policies and firms to best manage exchange rate risk and leverage assets. A relatively new technological invention that the corporate treasurer has to turn to as part of the overall financial strategy is cryptocurrency. One estimate values the total market capitalization of cryptocurrencies at $557 billion USD at the beginning of 2018. While the overall size of the market for cryptocurrency is significant, our understanding of the behavior of this instrument is only beginning. In this article, we propose a hybrid Artificial Neural Network-Generalized AutoRegressive Conditional Heteroskedasticity (ANN-GARCH) model with preprocessing to forecast the price volatility of bitcoin, the most traded and largest by market capitalization of the cryptocurrencies."
1352,54,95,2018,Investor Relations and Information Assimilation,"Kimball L. Chapman, Gregory S. Miller, H. White",Accounting Review,2018-07-01,185,9,164.203,"Risk, Volatility, and Forecast Evaluation",survey/review; forecasting; risk/volatility,stock-prediction; risk-volatility,This paper examines whether investor relations (IR) officers provide value by facilitating the assimilation of firm information by the market.,high citation signal (185),Risk forecasts can fail under regime breaks and extreme events.; Choice of loss function strongly affects model rankings.; Citation counts do not prove suitability for a specific mandate or risk budget.,https://doi.org/10.2308/ACCR-52200,https://www.semanticscholar.org/paper/1f9caa46dcfad14a353f7e6d9f32506a9f1dfb26,,,10.2308/ACCR-52200,,,45788680,Business; Economics,,price discovery stock market; value investing stock market; volatility forecasting stock market,3,citations=185; influential=9; survey/benchmark signal; investment validation signal; open PDF metadata; trade term matches=3; query hits=3,"This paper examines whether investor relations (IR) officers provide value by facilitating the assimilation of firm information by the market. We find that firms with IR officers have lower stock price volatility, lower analyst forecast dispersion, higher analyst forecast accuracy, and quicker price discovery, consistent with IR officers aiding market participants in their assimilation of firm information. We also show that our findings are stronger for firms with longer-tenured IR officers. Finally, we find that when firms transition from a long-tenured IR officer to a new IR officer, stock price volatility increases, analyst forecasts become more disperse and less accurate, and the price discovery process slows, despite no significant change in the firm's disclosures, media coverage, or performance around the turnover. Collectively, these findings suggest that in-house IR officers, particularly those with greater experience, help facilitate information assimilation by the market, which has positive market effects. JEL Classifications: G14; M40; M41."
1357,55,96,2018,Return and volatility linkages between CO2 emission and clean energy stock prices,"Anupam Dutta, Elie Bouri, Md Hasib Noor",Energy,2018-12-01,185,6,163.209,Portfolio Optimization and Asset Allocation,portfolio; risk/volatility,portfolio; risk-volatility,The emission of CO2 has emerged as one of the key factors behind the significant growth of clean energy sources that are less carbon-intensive than conventional energy bases.,high citation signal (185),"Allocation gains can be dominated by estimation error, turnover, short-sale constraints, and benchmark choice.; Backtests may hide capacity and liquidity limits.; Metadata cannot confirm implementation details such as costs, leverage, or rebalancing rules.",https://doi.org/10.1016/J.ENERGY.2018.09.055,https://www.semanticscholar.org/paper/5393caf7bd5cc18577f7f8cf61d813fd2fb4997c,,,10.1016/J.ENERGY.2018.09.055,,,115596269,Economics; Environmental Science,,asset pricing stock returns; equity returns; factor investing equity; stock returns,4,citations=185; influential=6; investment validation signal; open PDF metadata; title trade matches=2; trade term matches=7; query hits=4,"The emission of CO2 has emerged as one of the key factors behind the significant growth of clean energy sources that are less carbon-intensive than conventional energy bases. However, investigating the link between the carbon emission market and the market of clean energy stocks remains extremely understudied. Accordingly, this study examines daily return and volatility linkages between the European Union Allowance (EUA) prices and clean energy stock returns. Employing the bivariate VAR-GARCH approach, we document that variations in the EUA prices affect the renewable energy stock returns positively, though the association is usually found to be statistically insignificant. Our findings further indicate a significant volatility linkage between emission and European clean energy price indexes. Such findings, however, do not hold for the US market, suggesting that emission return and volatility shocks are country- or region-specific. Further results show that the average correlations between emission and stock prices is very low and hence portfolio diversification benefits seem to be attainable if investors hold assets in the EUA and clean energy equity markets."
