rank,yearRank,candidateRank,year,title,authors,venue,publicationDate,citationCount,influentialCitationCount,importanceScore,category,methodTags,keywordTags,keyIdea,strengths,limitations,url,semanticScholarUrl,openAccessPdf,githubUrl,doi,arxiv,pubmed,corpusId,fieldsOfStudy,publicationTypes,sourceQueries,queryHitCount,importanceReasons,abstract
7,1,1,2006,Investor Sentiment and the Cross-Section of Stock Returns,"Malcolm P. Baker, Malcolm P. Baker, Jeffrey Wurgler, Jeffrey Wurgler",,2006-08-01,5404,762,294.013,"Sentiment, News, and Alternative Data",asset-pricing; sentiment/text,sentiment-altdata; asset-pricing; behavioral-finance,"Positions Investor Sentiment and the Cross-Section of Stock Returns within Sentiment, News, and Alternative Data.","high citation signal (5,404); influential citation signal (762); open-access PDF metadata",Timestamp alignment and look-ahead bias are critical for text and alternative-data studies.; Sentiment signals can decay quickly as information becomes crowded.; Data licensing and coverage bias can limit reproducibility.,https://doi.org/10.1111/J.1540-6261.2006.00885.X,https://www.semanticscholar.org/paper/aab58756ddec2840f2a3e8d42bfdcaa3877ae037,http://papers.nber.org/papers/w10449.pdf,,10.1111/J.1540-6261.2006.00885.X,,,3103043,Economics,,investor sentiment stock returns; stock returns,2,citations=5404; influential=762; open PDF metadata; title trade matches=3; trade term matches=3; query hits=2,
57,2,2,2006,Asymmetric Dynamics in the Correlations of Global Equity and Bond Returns,"Lorenzo Cappiello, Robert F. Engle, K. Sheppard",Social Science Research Network,2006-09-21,1700,181,244.513,"Sentiment, News, and Alternative Data",reinforcement-learning; sentiment/text; risk/volatility,stock-prediction; reinforcement-trading; sentiment-altdata; risk-volatility,"This paper proposes a new generalized autoregressive conditionally heteroskedastic (GARCH) process, the asymmetric generalized dynamic conditional correlation (AG-DCC) model.","high citation signal (1,700); influential citation signal (181); open-access PDF metadata",Timestamp alignment and look-ahead bias are critical for text and alternative-data studies.; Sentiment signals can decay quickly as information becomes crowded.; Data licensing and coverage bias can limit reproducibility.,https://doi.org/10.1093/JJFINEC/NBL005,https://www.semanticscholar.org/paper/ca2b80247d941e9680ad5e94c82ee671b43b8a35,https://www.econstor.eu/bitstream/10419/152638/1/ecbwp0204.pdf,,10.1093/JJFINEC/NBL005,,,268259748,Economics,,equity returns,1,citations=1700; influential=181; investment validation signal; open PDF metadata; trade term matches=2,"This paper proposes a new generalized autoregressive conditionally heteroskedastic (GARCH) process, the asymmetric generalized dynamic conditional correlation (AG-DCC) model. The AG-DCC process extends previous specifications along two dimensions: it allows for series-specific news impact and smoothing parameters and permits conditional asymmetries in correlation dynamics. The AG-DCC specification is well suited to examine correlation dynamics among different asset classes and investigate the presence of asymmetric responses in conditional variances and correlations to negative returns. We employ the AG-DCC model to analyze the behavior of international equities and government bonds. While equity returns show strong evidence of asymmetries in conditional volatility, little is found for bond returns. However, both equities and bonds exhibit asymmetries in conditional correlations, with equities responding stronger than bonds to joint bad news. The article also finds that, during periods of financial turmoil, equity market volatilities show important linkages, and conditional equity correlations among regional groups increase dramatically. Furthermore, in January 1999 with the introduction of the euro, we document significant evidence of a structural break in correlation although not in volatility. The introduction of a fixed exchange rate regime leads to near-perfect correlation among bond returns within the European Monetary Union (EMU) countries, which is not surprising when considering the harmonization in monetary policy. However, the increase in return correlation is not restricted to bond returns in EMU countries: equity return correlation both within and outside the EMU also increases. Copyright 2006, Oxford University Press."
115,3,3,2006,"Real-Time Price Discovery in Global Stock, Bond and Foreign Exchange Markets","Torben G. Andersen, Tim Bollerslev, F. Diebold, Clara Vega",,2006-09-01,1081,89,223.702,"General Finance, Surveys, and Trading Systems",metadata-ranked,stock-prediction,"Positions Real-Time Price Discovery in Global Stock, Bond and Foreign Exchange Markets within General Finance, Surveys, and Trading Systems.","high citation signal (1,081); influential citation signal (89); open-access PDF metadata","Surveys and systems can dominate citations while empirical evidence remains mixed across markets.; Broad claims need careful mapping to data, costs, and investment horizons.; Metadata-driven ranking cannot replace expert reading of full papers and backtests.",https://doi.org/10.1016/J.JINTECO.2007.02.004,https://www.semanticscholar.org/paper/701ec4658bd50c33c102a02aec8a176a2d1bed69,http://www.federalreserve.gov/pubs/ifdp/2006/871/ifdp871.pdf,,10.1016/J.JINTECO.2007.02.004,,,15473433,Business; Economics,,equity returns; price discovery stock market; stock returns,3,citations=1081; influential=89; open PDF metadata; title trade matches=1; trade term matches=1; query hits=3,
122,4,4,2006,Corporate Social Performance and Stock Returns: UK Evidence from Disaggregate Measures,"Stephen Brammer, Chris Brooks, Stephen. Pavelin",,2006-10-19,1047,59,217.323,Asset Pricing and Return Predictability,metadata-ranked,asset-pricing,Positions Corporate Social Performance and Stock Returns: UK Evidence from Disaggregate Measures within Asset Pricing and Return Predictability.,"high citation signal (1,047); influential citation signal (59); open-access PDF metadata","Return predictability can disappear after transaction costs, crowding, and multiple-testing correction.; Citation impact can favor well-known anomalies even when live performance later weakens.; Metadata cannot verify whether data-snooping controls were adequate.",https://doi.org/10.1111/J.1755-053X.2006.TB00149.X,https://www.semanticscholar.org/paper/d3c0a4c577d2b81f3a2d40c34605f636d2207df2,https://centaur.reading.ac.uk/20507/1/20507.pdf,,10.1111/J.1755-053X.2006.TB00149.X,,,53399394,Business; Economics,,stock returns,1,citations=1047; influential=59; open PDF metadata; title trade matches=2; trade term matches=2,
143,5,5,2006,Oil price risk and emerging stock markets,"S. Basher, Perry Sadorsky",,2006-12-01,964,80,221.709,"Risk, Volatility, and Forecast Evaluation",risk/volatility,risk-volatility,"Positions Oil price risk and emerging stock markets within Risk, Volatility, and Forecast Evaluation.",high citation signal (964); influential citation signal (80),Risk forecasts can fail under regime breaks and extreme events.; Choice of loss function strongly affects model rankings.; Citation counts do not prove suitability for a specific mandate or risk budget.,https://doi.org/10.1016/J.GFJ.2006.04.001,https://www.semanticscholar.org/paper/147939d8a0b21c9ceaf67bbd04bad2d5a7c5643d,,,10.1016/J.GFJ.2006.04.001,,,54072688,Economics,,stock returns,1,citations=964; influential=80; investment validation signal; open PDF metadata; title trade matches=1; trade term matches=1,
149,6,6,2006,Investor Overconfidence and Trading Volume,"M. Statman, Steven Thorley, Keith P. Vorkink",,2006-12-01,933,43,207.447,"General Finance, Surveys, and Trading Systems",metadata-ranked,stock-prediction,"Positions Investor Overconfidence and Trading Volume within General Finance, Surveys, and Trading Systems.",high citation signal (933); influential citation signal (43),"Surveys and systems can dominate citations while empirical evidence remains mixed across markets.; Broad claims need careful mapping to data, costs, and investment horizons.; Metadata-driven ranking cannot replace expert reading of full papers and backtests.",https://doi.org/10.1093/RFS/HHJ032,https://www.semanticscholar.org/paper/9dc180f92b73bfa7bf9112d5ba54980afc93fb88,,,10.1093/RFS/HHJ032,,,153652115,Business; Economics,,securities market,1,citations=933; influential=43; open PDF metadata; title trade matches=1; trade term matches=1,
165,7,7,2006,Does Weak Governance Cause Weak Stock Returns? An Examination of Firm Operating Performance and Investors' Expectations,"J. Core, W. Guay, T. Rusticus",,2006-04-01,900,45,213.278,Asset Pricing and Return Predictability,metadata-ranked,asset-pricing,Positions Does Weak Governance Cause Weak Stock Returns? An Examination of Firm Operating Performance and Investors' Expectations within Asset Pricing and Return Predictability.,high citation signal (900); influential citation signal (45); open-access PDF metadata,"Return predictability can disappear after transaction costs, crowding, and multiple-testing correction.; Citation impact can favor well-known anomalies even when live performance later weakens.; Metadata cannot verify whether data-snooping controls were adequate.",https://doi.org/10.1111/J.1540-6261.2006.00851.X,https://www.semanticscholar.org/paper/29b4a16758f1d58d056f786d7788e935b84bad10,https://repository.upenn.edu/bitstreams/2bfc6adb-1fd0-4d89-a6e5-7d853c988be4/download,,10.1111/J.1540-6261.2006.00851.X,,,3292420,Business; Economics,,analyst forecasts stock returns; earnings announcements stock returns; stock returns,3,citations=900; influential=45; open PDF metadata; title trade matches=2; trade term matches=2; query hits=3,
168,8,8,2006,Efficient Tests of Stock Return Predictability,"J. Campbell, Motohiro Yogo",,2006-07-01,892,129,224.626,Asset Pricing and Return Predictability,forecasting; asset-pricing,stock-prediction,Positions Efficient Tests of Stock Return Predictability within Asset Pricing and Return Predictability.,high citation signal (892); influential citation signal (129); open-access PDF metadata,"Return predictability can disappear after transaction costs, crowding, and multiple-testing correction.; Citation impact can favor well-known anomalies even when live performance later weakens.; Metadata cannot verify whether data-snooping controls were adequate.",https://doi.org/10.1016/J.JFINECO.2005.05.008,https://www.semanticscholar.org/paper/4230baa62bf70361e96430e48a22986f131e3f64,http://papers.nber.org/papers/w10026.pdf,,10.1016/J.JFINECO.2005.05.008,,,216558984,Business; Economics; Mathematics,,stock returns,1,citations=892; influential=129; open PDF metadata; title trade matches=2; trade term matches=2,
184,9,9,2006,"Customer Satisfaction and Stock Prices: High Returns, Low Risk:","C. Fornell, Sunil Mithas, Forrest V. Morgeson, M. S. Krishnan",,2006-03-30,859,40,216.643,"Risk, Volatility, and Forecast Evaluation",risk/volatility,risk-volatility,"Positions Customer Satisfaction and Stock Prices: High Returns, Low Risk: within Risk, Volatility, and Forecast Evaluation.",high citation signal (859); influential citation signal (40),Risk forecasts can fail under regime breaks and extreme events.; Choice of loss function strongly affects model rankings.; Citation counts do not prove suitability for a specific mandate or risk budget.,https://doi.org/10.1509/JMKG.2006.70.1.3,https://www.semanticscholar.org/paper/a6cf6fe55d0f2cb41fee3f99323f0683f90b89c6,,,10.1509/JMKG.2006.70.1.3,,,1757432,Business; Economics,,asset pricing stock returns; equity returns; stock returns; value investing stock market,4,citations=859; influential=40; investment validation signal; open PDF metadata; title trade matches=2; trade term matches=2; query hits=4,
186,10,10,2006,Industry Concentration and Average Stock Returns,"Kewei Hou, David T. Robinson, David T. Robinson",,2006-08-01,857,77,216.595,Asset Pricing and Return Predictability,metadata-ranked,asset-pricing,Positions Industry Concentration and Average Stock Returns within Asset Pricing and Return Predictability.,high citation signal (857); influential citation signal (77),"Return predictability can disappear after transaction costs, crowding, and multiple-testing correction.; Citation impact can favor well-known anomalies even when live performance later weakens.; Metadata cannot verify whether data-snooping controls were adequate.",https://doi.org/10.2139/SSRN.479726,https://www.semanticscholar.org/paper/d31ffbd6e2adbeeb2a3c76cdabc48eba036a33de,,,10.2139/SSRN.479726,,,13900214,Economics,,stock returns,1,citations=857; influential=77; open PDF metadata; title trade matches=2; trade term matches=2,
191,11,11,2006,The Copula-GARCH model of conditional dependencies: An international stock market application,"Eric Jondeau, Michael Rockinger",,2006-08-01,841,48,206.673,"Risk, Volatility, and Forecast Evaluation",risk/volatility,stock-prediction; risk-volatility,"Positions The Copula-GARCH model of conditional dependencies: An international stock market application within Risk, Volatility, and Forecast Evaluation.",high citation signal (841); influential citation signal (48); open-access PDF metadata,Risk forecasts can fail under regime breaks and extreme events.; Choice of loss function strongly affects model rankings.; Citation counts do not prove suitability for a specific mandate or risk budget.,https://doi.org/10.1016/J.JIMONFIN.2006.04.007,https://www.semanticscholar.org/paper/7bd72f171dfeb60c8d47e41a6d49007b517bb22a,http://www.hec.unil.ch/ejondeau/Publications/cJIMF2006.pdf,,10.1016/J.JIMONFIN.2006.04.007,,,7326957,Business; Economics; Mathematics,,stock returns,1,citations=841; influential=48; open PDF metadata; title trade matches=1; trade term matches=1,
195,12,12,2006,A liquidity-augmented capital asset pricing model,Weimin Liu,,2006-12-01,837,133,230.652,Market Microstructure and High-Frequency Trading,asset-pricing; microstructure,high-frequency; asset-pricing,Positions A liquidity-augmented capital asset pricing model within Market Microstructure and High-Frequency Trading.,high citation signal (837); influential citation signal (133),"High-frequency results depend heavily on market access, latency, fees, and order-book reconstruction quality.; Public metadata rarely reveals execution assumptions.; Short-horizon predictability can vanish when capacity and competition are considered.",https://doi.org/10.1016/J.JFINECO.2005.10.001,https://www.semanticscholar.org/paper/0e3dc9778a8ce9ed1371aa658cc59c4b06ea1190,,,10.1016/J.JFINECO.2005.10.001,,,154217872,Economics,,asset pricing stock returns; capital markets investment; market anomalies stock returns; risk premium stock returns; stock returns,5,citations=837; influential=133; investment validation signal; open PDF metadata; title trade matches=1; trade term matches=1; query hits=5,
205,13,13,2006,Stock Price Synchronicity and Analyst Coverage in Emerging Markets,"Kalok Chan, A. Hameed",,2006-04-01,819,89,217.602,"General Finance, Surveys, and Trading Systems",metadata-ranked,stock-prediction,"Positions Stock Price Synchronicity and Analyst Coverage in Emerging Markets within General Finance, Surveys, and Trading Systems.",high citation signal (819); influential citation signal (89),"Surveys and systems can dominate citations while empirical evidence remains mixed across markets.; Broad claims need careful mapping to data, costs, and investment horizons.; Metadata-driven ranking cannot replace expert reading of full papers and backtests.",https://doi.org/10.1016/J.JFINECO.2005.03.010,https://www.semanticscholar.org/paper/79440b4de1c90b43a3e517884adceff461e7f98a,,,10.1016/J.JFINECO.2005.03.010,,,26777780,Business; Economics,,analyst forecasts stock returns; securities market; stock returns,3,citations=819; influential=89; open PDF metadata; title trade matches=1; trade term matches=1; query hits=3,
247,14,14,2006,Does Corporate Headquarters Location Matter for Stock Returns,"Christo A. Pirinsky, Qinghai Wang",,2006-08-01,742,50,209.481,Asset Pricing and Return Predictability,metadata-ranked,asset-pricing,Positions Does Corporate Headquarters Location Matter for Stock Returns within Asset Pricing and Return Predictability.,high citation signal (742); influential citation signal (50); open-access PDF metadata,"Return predictability can disappear after transaction costs, crowding, and multiple-testing correction.; Citation impact can favor well-known anomalies even when live performance later weakens.; Metadata cannot verify whether data-snooping controls were adequate.",https://doi.org/10.2139/SSRN.733483,https://www.semanticscholar.org/paper/8422490b8b608430966be873683e994eaab0812b,https://onlinelibrary.wiley.com/doi/pdfdirect/10.1111/j.1540-6261.2006.00895.x,,10.2139/SSRN.733483,,,154446706,Business; Economics; Geography,,equity returns; stock returns,2,citations=742; influential=50; open PDF metadata; title trade matches=2; trade term matches=2; query hits=2,
320,15,15,2006,Comparing the Post–Earnings Announcement Drift for Surprises Calculated from Analyst and Time Series Forecasts,"J. Livnat, Richard R. Mendenhall",,2006-03-01,611,56,204.771,"General Finance, Surveys, and Trading Systems",metadata-ranked,stock-prediction,"Positions Comparing the Post–Earnings Announcement Drift for Surprises Calculated from Analyst and Time Series Forecasts within General Finance, Surveys, and Trading Systems.",high citation signal (611); influential citation signal (56),"Surveys and systems can dominate citations while empirical evidence remains mixed across markets.; Broad claims need careful mapping to data, costs, and investment horizons.; Metadata-driven ranking cannot replace expert reading of full papers and backtests.",https://doi.org/10.1111/J.1475-679X.2006.00196.X,https://www.semanticscholar.org/paper/5f503b733198bc83dce5f4c31f4d8e64e7a9432c,,,10.1111/J.1475-679X.2006.00196.X,,,154521341,Business; Economics,,analyst forecasts stock returns; earnings announcements stock returns; stock returns,3,citations=611; influential=56; open PDF metadata; title trade matches=1; trade term matches=1; query hits=3,
352,16,16,2006,"Hedging, Familiarity and Portfolio Choice","M. Massa, A. Simonov",,2006-07-01,568,39,200.21,Portfolio Optimization and Asset Allocation,portfolio,portfolio,"Positions Hedging, Familiarity and Portfolio Choice within Portfolio Optimization and Asset Allocation.",high citation signal (568); influential citation signal (39); open-access PDF metadata,"Allocation gains can be dominated by estimation error, turnover, short-sale constraints, and benchmark choice.; Backtests may hide capacity and liquidity limits.; Metadata cannot confirm implementation details such as costs, leverage, or rebalancing rules.",https://doi.org/10.1093/RFS/HHJ013,https://www.semanticscholar.org/paper/af817166874f69cdba695e841784b2c2e5da85e0,https://academic.oup.com/rfs/article-pdf/19/2/633/24421784/hhj013.pdf,,10.1093/RFS/HHJ013,,,54798228,Business; Economics,,stock returns,1,citations=568; influential=39; investment validation signal; open PDF metadata; title trade matches=1; trade term matches=1,
353,17,17,2006,"Reconciling the Return Predictability Evidence In-Sample Forecasts, Out-of-Sample Forecasts, and Parameter Instability","Martin Lettau, Martin Lettau, Martin Lettau, S. V. Nieuwerburgh, S. V. Nieuwerburgh, S. V. Nieuwerburgh",,2006-12-03,566,17,188.953,"Risk, Volatility, and Forecast Evaluation",forecasting; asset-pricing,stock-prediction,"Positions Reconciling the Return Predictability Evidence In-Sample Forecasts, Out-of-Sample Forecasts, and Parameter Instability within Risk, Volatility, and Forecast Evaluation.",high citation signal (566); influential citation signal (17); open-access PDF metadata,Risk forecasts can fail under regime breaks and extreme events.; Choice of loss function strongly affects model rankings.; Citation counts do not prove suitability for a specific mandate or risk budget.,https://doi.org/10.2139/SSRN.895842,https://www.semanticscholar.org/paper/4952aa36b2b0b8df1fd10640ee0d21e51a031ce5,http://papers.nber.org/papers/w12109.pdf,,10.2139/SSRN.895842,,,9529513,Economics,,stock returns,1,citations=566; influential=17; investment validation signal; open PDF metadata; title trade matches=1; trade term matches=1,
366,18,18,2006,"Individual Preferences, Monetary Gambles, and Stock Market Participation: A Case for Narrow Framing","N. Barberis, N. Barberis, Ming Huang, Richard H. Thaler, Richard H. Thaler",,2006-07-10,556,40,195.086,"General Finance, Surveys, and Trading Systems",metadata-ranked,stock-prediction,"Positions Individual Preferences, Monetary Gambles, and Stock Market Participation: A Case for Narrow Framing within General Finance, Surveys, and Trading Systems.",high citation signal (556); influential citation signal (40),"Surveys and systems can dominate citations while empirical evidence remains mixed across markets.; Broad claims need careful mapping to data, costs, and investment horizons.; Metadata-driven ranking cannot replace expert reading of full papers and backtests.",https://doi.org/10.1257/AER.96.4.1069,https://www.semanticscholar.org/paper/9935464bfb115bd7401a5411155a8043ab81aa98,,,10.1257/AER.96.4.1069,,,16524520,Economics,,stock market prediction,1,citations=556; influential=40; open PDF metadata; title trade matches=1; trade term matches=1,
370,19,19,2006,Earnings Quality and Stock Returns,"Konan Chan, Konan Chan, Louis K. C. Chan, Narasimhan Jegadeesh, Josef Lakonishok, Josef Lakonishok",,2006-05-01,554,50,201.063,Asset Pricing and Return Predictability,metadata-ranked,asset-pricing,Positions Earnings Quality and Stock Returns within Asset Pricing and Return Predictability.,high citation signal (554); influential citation signal (50); open-access PDF metadata,"Return predictability can disappear after transaction costs, crowding, and multiple-testing correction.; Citation impact can favor well-known anomalies even when live performance later weakens.; Metadata cannot verify whether data-snooping controls were adequate.",https://doi.org/10.1086/500669,https://www.semanticscholar.org/paper/1f8d20690b280af829d06a2d3c21f984526a5ae5,http://papers.nber.org/papers/w8308.pdf,,10.1086/500669,,,39811725,Business; Economics,,stock returns,1,citations=554; influential=50; open PDF metadata; title trade matches=2; trade term matches=2,
377,20,20,2006,"The relation between corporate financing activities, analysts’ forecasts and stock returns","M. Bradshaw, Scott A. Richardson, Richard G. Sloan",,2006-05-25,549,52,203.402,Asset Pricing and Return Predictability,metadata-ranked,asset-pricing,"Positions The relation between corporate financing activities, analysts’ forecasts and stock returns within Asset Pricing and Return Predictability.",high citation signal (549); influential citation signal (52),"Return predictability can disappear after transaction costs, crowding, and multiple-testing correction.; Citation impact can favor well-known anomalies even when live performance later weakens.; Metadata cannot verify whether data-snooping controls were adequate.",https://doi.org/10.1016/J.JACCECO.2006.03.004,https://www.semanticscholar.org/paper/8b1566dabdc3025fe8f4efade07a12e610385e99,,,10.1016/J.JACCECO.2006.03.004,,,145816826,Business; Economics,,analyst forecasts stock returns; stock returns,2,citations=549; influential=52; open PDF metadata; title trade matches=2; trade term matches=2; query hits=2,
426,21,21,2006,The impact of the SARS outbreak on Taiwanese hotel stock performance: An event-study approach,"Ming-Hsiang Chen, S. Jang, W. Kim",International Journal of Hospitality Management,2006-03-23,511,15,178.059,"General Finance, Surveys, and Trading Systems",metadata-ranked,stock-prediction,The severe acute respiratory syndrome (SARS) outbreak in 2003 weakened the Taiwanese economy.,high citation signal (511); influential citation signal (15); open-access PDF metadata,"Surveys and systems can dominate citations while empirical evidence remains mixed across markets.; Broad claims need careful mapping to data, costs, and investment horizons.; Metadata-driven ranking cannot replace expert reading of full papers and backtests.",https://doi.org/10.1016/j.ijhm.2005.11.004,https://www.semanticscholar.org/paper/c1cc3da2a8081fba39bd1f62bf65bc16b8d2a2a6,https://europepmc.org/articles/pmc7116915?pdf=render,,10.1016/j.ijhm.2005.11.004,,32287849,153372002,Business; Environmental Science; Medicine,JournalArticle,stock returns,1,citations=511; influential=15; open PDF metadata; trade term matches=1,"The severe acute respiratory syndrome (SARS) outbreak in 2003 weakened the Taiwanese economy. The tourism industry suffered the most, experiencing the highest stock price decline (approximately 29 percent) within a month of the SARS outbreak. This research examined the effect of the SARS epidemic on Taiwanese hotel stock price movements using an event-study approach. Seven publicly traded hotel companies experienced steep declines in earnings and stock price during the SARS outbreak period. On and after the day of the SARS outbreak, Taiwanese hotel stocks showed significantly negative cumulative mean abnormal returns, indicating a significant impact of the SARS outbreak on hotel stock performance. Empirical findings could be used to prepare businesses for the similar epidemics, such as a deadly bird-flu epidemic."
