rank,yearRank,candidateRank,year,title,authors,venue,publicationDate,citationCount,influentialCitationCount,importanceScore,category,methodTags,keywordTags,keyIdea,strengths,limitations,url,semanticScholarUrl,openAccessPdf,githubUrl,doi,arxiv,pubmed,corpusId,fieldsOfStudy,publicationTypes,sourceQueries,queryHitCount,importanceReasons,abstract
9,1,1,2000,Asset Pricing at the Millennium,J. Campbell,Journal of Finance,2000-05-01,3861,446,293.133,Portfolio Optimization and Asset Allocation,portfolio; asset-pricing; risk/volatility,portfolio; risk-volatility; asset-pricing; behavioral-finance,This paper surveys the field of asset pricing.,"high citation signal (3,861); influential citation signal (446); recognized finance/AI venue; open-access PDF metadata","Allocation gains can be dominated by estimation error, turnover, short-sale constraints, and benchmark choice.; Backtests may hide capacity and liquidity limits.; Metadata cannot confirm implementation details such as costs, leverage, or rebalancing rules.",https://doi.org/10.1111/0022-1082.00260,https://www.semanticscholar.org/paper/e20a66dae3fe8496eb76cb94d3f1d48bf85fe804,http://papers.nber.org/papers/w7589.pdf,,10.1111/0022-1082.00260,,,154405680,Economics,Review,asset pricing stock returns; stock returns,2,citations=3861; influential=446; recognized finance/AI venue; investment validation signal; open PDF metadata; title trade matches=1; trade term matches=6; query hits=2,"This paper surveys the field of asset pricing. The emphasis is on the interplay between theory and empirical work, and on the tradeoff between risk and return. Modern research seeks to understand the behavior of the stochastic discount factor (SDF) that prices all assets in the economy. The behavior of the term structure of real interest rates restricts the conditional mean of the SDF, while patterns of risk premia restrict its conditional volatility and factor structure. Stylized facts about interest rates, aggregate stock prices, and cross-sectional patterns in stock returns have stimulated new research on optimal portfolio choice, intertemporal equilibrium models, and behavioral finance."
14,2,2,2000,Trading is Hazardous to Your Wealth: The Common Stock Investment Performance of Individual Investors,"B. Barber, T. Odean",,2000-04-12,3039,349,264.443,"General Finance, Surveys, and Trading Systems",metadata-ranked,stock-prediction,"Positions Trading is Hazardous to Your Wealth: The Common Stock Investment Performance of Individual Investors within General Finance, Surveys, and Trading Systems.","high citation signal (3,039); influential citation signal (349); open-access PDF metadata","Surveys and systems can dominate citations while empirical evidence remains mixed across markets.; Broad claims need careful mapping to data, costs, and investment horizons.; Metadata-driven ranking cannot replace expert reading of full papers and backtests.",https://doi.org/10.2139/SSRN.219228,https://www.semanticscholar.org/paper/5afc41fd45e6eeca0353faf04176355065b0c6f5,http://www.ifa.com/Media/Images/PDF%20files/tradingHazardous.pdf,,10.2139/SSRN.219228,,,154973050,Business; Economics,,stock returns; value investing stock market,2,citations=3039; influential=349; open PDF metadata; title trade matches=1; trade term matches=1; query hits=2,
29,3,3,2000,Foreign Speculators and Emerging Equity Markets,"G. Bekaert, Campbell R. Harvey, Campbell R. Harvey",,2000-04-01,2035,163,248.01,"General Finance, Surveys, and Trading Systems",metadata-ranked,stock-prediction,"Positions Foreign Speculators and Emerging Equity Markets within General Finance, Surveys, and Trading Systems.","high citation signal (2,035); influential citation signal (163); open-access PDF metadata","Surveys and systems can dominate citations while empirical evidence remains mixed across markets.; Broad claims need careful mapping to data, costs, and investment horizons.; Metadata-driven ranking cannot replace expert reading of full papers and backtests.",https://doi.org/10.2139/SSRN.61988,https://www.semanticscholar.org/paper/f6f712c28cc634724a17164069f4cc2f686d17eb,http://deepblue.lib.umich.edu/bitstream/2027.42/39469/3/wp79.pdf,,10.2139/SSRN.61988,,,13838017,Economics,,capital markets investment; equity returns,2,citations=2035; influential=163; open PDF metadata; title trade matches=2; trade term matches=2; query hits=2,
36,4,4,2000,The Dark Side of Internal Capital Markets: Divisional Rent-Seeking and Inefficient Investment,"D. Scharfstein, Jeremy C. Stein",,2000-12-01,1745,103,236.253,"General Finance, Surveys, and Trading Systems",metadata-ranked,stock-prediction,"Positions The Dark Side of Internal Capital Markets: Divisional Rent-Seeking and Inefficient Investment within General Finance, Surveys, and Trading Systems.","high citation signal (1,745); influential citation signal (103); open-access PDF metadata","Surveys and systems can dominate citations while empirical evidence remains mixed across markets.; Broad claims need careful mapping to data, costs, and investment horizons.; Metadata-driven ranking cannot replace expert reading of full papers and backtests.",https://doi.org/10.1111/0022-1082.00299,https://www.semanticscholar.org/paper/db871c12a0be0f0ea5f7aecf7dc811ceb41850d5,http://web.mit.edu/jcstein/www/newdarkjof.pdf,,10.1111/0022-1082.00299,,,2289455,Business; Economics,,capital markets investment,1,citations=1745; influential=103; open PDF metadata; title trade matches=2; trade term matches=2,
39,5,5,2000,"Mutual Fund Performance: An Empirical Decomposition into Stock-Picking Talent, Style, Transactions Costs, and Expenses",Russ Wermers,,2000-08-01,1715,141,243.232,"General Finance, Surveys, and Trading Systems",metadata-ranked,stock-prediction,"Positions Mutual Fund Performance: An Empirical Decomposition into Stock-Picking Talent, Style, Transactions Costs, and Expenses within General Finance, Surveys, and Trading Systems.","high citation signal (1,715); influential citation signal (141)","Surveys and systems can dominate citations while empirical evidence remains mixed across markets.; Broad claims need careful mapping to data, costs, and investment horizons.; Metadata-driven ranking cannot replace expert reading of full papers and backtests.",https://doi.org/10.1111/0022-1082.00263,https://www.semanticscholar.org/paper/65f768de9ee541da519d00f77c8e56d0731fb10b,,,10.1111/0022-1082.00263,,,33321826,Business; Economics,,fund performance stock market; mutual fund performance stocks; stock returns,3,citations=1715; influential=141; open PDF metadata; title trade matches=2; trade term matches=2; query hits=3,
47,6,6,2000,Managerial Decisions and Long-Term Stock Price Performance,"Mark Mitchell, Erik Stafford",,2000-07-01,1607,113,232.727,"General Finance, Surveys, and Trading Systems",metadata-ranked,stock-prediction,"Positions Managerial Decisions and Long-Term Stock Price Performance within General Finance, Surveys, and Trading Systems.","high citation signal (1,607); influential citation signal (113)","Surveys and systems can dominate citations while empirical evidence remains mixed across markets.; Broad claims need careful mapping to data, costs, and investment horizons.; Metadata-driven ranking cannot replace expert reading of full papers and backtests.",https://doi.org/10.2139/SSRN.94137,https://www.semanticscholar.org/paper/336a539fd6f35467acc14ab8cd518b2a86112417,,,10.2139/SSRN.94137,,,8035923,Business; Economics,,stock returns,1,citations=1607; influential=113; open PDF metadata; title trade matches=1; trade term matches=1,
48,7,7,2000,Price Momentum and Trading Volume,"Charles M.C. Lee, Bhaskaran Swaminathan",,2000-10-01,1592,113,238.521,Asset Pricing and Return Predictability,metadata-ranked,asset-pricing,Positions Price Momentum and Trading Volume within Asset Pricing and Return Predictability.,"high citation signal (1,592); influential citation signal (113)","Return predictability can disappear after transaction costs, crowding, and multiple-testing correction.; Citation impact can favor well-known anomalies even when live performance later weakens.; Metadata cannot verify whether data-snooping controls were adequate.",https://doi.org/10.2139/SSRN.92589,https://www.semanticscholar.org/paper/424132ab7046d5b7afb78b226725ebb6c7aed4ba,,,10.2139/SSRN.92589,,,9362431,Business; Economics,,financial market prediction; securities market; stock market prediction; stock price prediction; stock returns; trading strategies stock market,6,citations=1592; influential=113; open PDF metadata; title trade matches=1; trade term matches=1; query hits=6,
57,8,8,2000,"Stock Market Liberalization, Economic Reform, and Emerging Market Equity Prices",P. Henry,,2000-04-01,1414,111,234.666,"General Finance, Surveys, and Trading Systems",metadata-ranked,stock-prediction,"Positions Stock Market Liberalization, Economic Reform, and Emerging Market Equity Prices within General Finance, Surveys, and Trading Systems.","high citation signal (1,414); influential citation signal (111)","Surveys and systems can dominate citations while empirical evidence remains mixed across markets.; Broad claims need careful mapping to data, costs, and investment horizons.; Metadata-driven ranking cannot replace expert reading of full papers and backtests.",https://doi.org/10.1111/0022-1082.00219,https://www.semanticscholar.org/paper/4f05f1da1935739fcd5244af4d3428dd51f5dbc8,,,10.1111/0022-1082.00219,,,154926189,Economics,,asset pricing stock returns; equity returns; stock market prediction; stock price prediction; stock returns,5,citations=1414; influential=111; open PDF metadata; title trade matches=1; trade term matches=1; query hits=5,
69,9,9,2000,An Examination of Herd Behavior in Equity Markets: An International Perspective,"Eric C. Chang, Joseph W. Cheng, Ajay Khorana",,2000-10-01,1265,303,244.198,"General Finance, Surveys, and Trading Systems",metadata-ranked,stock-prediction,"Positions An Examination of Herd Behavior in Equity Markets: An International Perspective within General Finance, Surveys, and Trading Systems.","high citation signal (1,265); influential citation signal (303)","Surveys and systems can dominate citations while empirical evidence remains mixed across markets.; Broad claims need careful mapping to data, costs, and investment horizons.; Metadata-driven ranking cannot replace expert reading of full papers and backtests.",https://doi.org/10.1016/S0378-4266(99)00096-5,https://www.semanticscholar.org/paper/760d6ba9bcdb2cef52122e18d6459b87e45f65d1,,,10.1016/S0378-4266(99)00096-5,,,487896,Business; Economics,,securities market,1,citations=1265; influential=303; open PDF metadata; title trade matches=2; trade term matches=2,
77,10,10,2000,Market Microstructure: A Survey,Ananth Madhavan,,2000-03-16,1140,67,222.946,Market Microstructure and High-Frequency Trading,survey/review; microstructure,high-frequency,Positions Market Microstructure: A Survey within Market Microstructure and High-Frequency Trading.,"high citation signal (1,140); influential citation signal (67)","High-frequency results depend heavily on market access, latency, fees, and order-book reconstruction quality.; Public metadata rarely reveals execution assumptions.; Short-horizon predictability can vanish when capacity and competition are considered.",https://doi.org/10.1016/S1386-4181(00)00007-0,https://www.semanticscholar.org/paper/92c3866089c0bc821190ae15f69bcbe6e546cf38,,,10.1016/S1386-4181(00)00007-0,,,55501333,Business; Economics,Review,market microstructure trading,1,citations=1140; influential=67; survey/benchmark signal; open PDF metadata; title trade matches=1; trade term matches=1,
79,11,11,2000,The Equity Share in New Issues and Aggregate Stock Returns,"Malcolm P. Baker, Malcolm P. Baker, Jeffrey Wurgler, Jeffrey Wurgler",,2000-10-01,1121,142,235.983,"General Finance, Surveys, and Trading Systems",metadata-ranked,stock-prediction,"Positions The Equity Share in New Issues and Aggregate Stock Returns within General Finance, Surveys, and Trading Systems.","high citation signal (1,121); influential citation signal (142); open-access PDF metadata","Surveys and systems can dominate citations while empirical evidence remains mixed across markets.; Broad claims need careful mapping to data, costs, and investment horizons.; Metadata-driven ranking cannot replace expert reading of full papers and backtests.",https://doi.org/10.1111/0022-1082.00285,https://www.semanticscholar.org/paper/14be014490dc773638650618a432fbc7d50a13c5,http://archive.nyu.edu/bitstream/2451/31362/2/equityshare.pdf,,10.1111/0022-1082.00285,,,6390164,Business; Economics,,equity portfolio performance; equity returns; market efficiency stock returns; securities market; stock returns,5,citations=1121; influential=142; open PDF metadata; title trade matches=2; trade term matches=2; query hits=5,
82,12,12,2000,Beyond greed and fear : understanding behavioral finance and the psychology of investing,H. Shefrin,,2000-01-15,1093,66,219.813,Behavioral Finance and Investor Decision-Making,metadata-ranked,behavioral-finance,Positions Beyond greed and fear : understanding behavioral finance and the psychology of investing within Behavioral Finance and Investor Decision-Making.,"high citation signal (1,093); influential citation signal (66)",Behavioral mechanisms can be market-specific and time-varying.; Sentiment proxies may capture several confounded channels.; Trading implementation requires constraints beyond the behavioral explanation.,https://doi.org/10.5860/choice.37-5212,https://www.semanticscholar.org/paper/ca485ad7e4f66b413cfc731c555c07e95ae318e4,,,10.5860/choice.37-5212,,,149530657,Economics; Psychology,,securities market; stock market prediction; stock price prediction,3,citations=1093; influential=66; open PDF metadata; title trade matches=1; trade term matches=1; query hits=3,
117,13,13,2000,Trading activity and expected stock returns,"Tarun Chordia, A. Subrahmanyam, Ravi, Anshuman, Michael Brennan, R. Huang, Craig M. Lewis, Ananth Madhavan, et al.",,,895,45,215.156,"General Finance, Surveys, and Trading Systems",metadata-ranked,stock-prediction,"Positions Trading activity and expected stock returns within General Finance, Surveys, and Trading Systems.",high citation signal (895); influential citation signal (45),"Surveys and systems can dominate citations while empirical evidence remains mixed across markets.; Broad claims need careful mapping to data, costs, and investment horizons.; Metadata-driven ranking cannot replace expert reading of full papers and backtests.",https://doi.org/10.1016/S0304-405X(00)00080-5,https://www.semanticscholar.org/paper/e6958378b25fe28b41cbf966ecb616caaa302524,,,10.1016/S0304-405X(00)00080-5,,,13309536,Economics,,equity returns; stock returns,2,citations=895; influential=45; open PDF metadata; title trade matches=3; trade term matches=3; query hits=2,
130,14,14,2000,Fractional calculus and continuous-time finance,"E. Scalas, R. Gorenflo, F. Mainardi",,2000-01-10,865,9,185.042,Deep Learning and Financial Time Series,metadata-ranked,deep-learning,In this paper we present a rather general phenomenological theory of tick-by-tick dynamics in financial markets.,high citation signal (865); open-access PDF metadata,"Deep models can overfit noisy, nonstationary, and low signal-to-noise market data.; Compute-heavy models may be hard to reproduce without code and data access.; Reported gains need robustness checks across regimes and markets.",https://doi.org/10.1016/S0378-4371(00)00255-7,https://www.semanticscholar.org/paper/42611bb713f50a3f1f05b547c665d064ca8fc6d2,https://arxiv.org/pdf/cond-mat/0001120,,10.1016/S0378-4371(00)00255-7,cond-mat/0001120,,118214815,Business; Economics; Mathematics; Physics,,financial market prediction,1,citations=865; influential=9; open PDF metadata; trade term matches=3,"In this paper we present a rather general phenomenological theory of tick-by-tick dynamics in financial markets. Many well-known aspects, such as the Levy scaling form, follow as particular cases of the theory. The theory fully takes into account the non-Markovian and non-local character of financial time series. Predictions on the long-time behaviour of the waiting-time probability density are presented. Finally, a general scaling form is given, based on the solution of the fractional diffusion equation."
157,15,15,2000,Rational contagion and the globalization of securities markets,"G. Calvo, E. Mendoza",,2000-06-01,808,37,202.234,"General Finance, Surveys, and Trading Systems",metadata-ranked,stock-prediction,"Positions Rational contagion and the globalization of securities markets within General Finance, Surveys, and Trading Systems.",high citation signal (808); influential citation signal (37); open-access PDF metadata,"Surveys and systems can dominate citations while empirical evidence remains mixed across markets.; Broad claims need careful mapping to data, costs, and investment horizons.; Metadata-driven ranking cannot replace expert reading of full papers and backtests.",https://doi.org/10.1016/S0022-1996(99)00038-0,https://www.semanticscholar.org/paper/44c7d5cf7636ba5974326b9341c8a9f18120d0e6,http://public.econ.duke.edu/webfiles//mendozae/PAPER.pdf,,10.1016/S0022-1996(99)00038-0,,,158314379,Economics,,securities market,1,citations=808; influential=37; open PDF metadata; title trade matches=1; trade term matches=1,
164,16,16,2000,The Value of Active Mutual Fund Management: An Examination of the Stockholdings and Trades of Fund Managers,"Hsiu-lang Chen, Narasimhan Jegadeesh, Russ Wermers",Journal of Financial and Quantitative Analysis,2000-07-07,793,55,219.251,"General Finance, Surveys, and Trading Systems",metadata-ranked,stock-prediction,"Positions The Value of Active Mutual Fund Management: An Examination of the Stockholdings and Trades of Fund Managers within General Finance, Surveys, and Trading Systems.",high citation signal (793); influential citation signal (55); recognized finance/AI venue,"Surveys and systems can dominate citations while empirical evidence remains mixed across markets.; Broad claims need careful mapping to data, costs, and investment horizons.; Metadata-driven ranking cannot replace expert reading of full papers and backtests.",https://doi.org/10.2307/2676208,https://www.semanticscholar.org/paper/0139df2576870e79eb5dd2fd08e999e1ae8d8f7c,,,10.2307/2676208,,,2908680,Business; Economics,,mutual fund performance stocks; stock returns,2,citations=793; influential=55; recognized finance/AI venue; open PDF metadata; title trade matches=1; trade term matches=1; query hits=2,
170,17,17,2000,Systemic Risk: A Survey,"O. D. Bandt, Philipp Hartmann, Philipp Hartmann",Social Science Research Network,2000-11-01,780,39,211.177,"Risk, Volatility, and Forecast Evaluation",survey/review; risk/volatility,risk-volatility,"This paper develops a broad concept of systemic risk, the basic economic concept for the understanding of financial crises.",high citation signal (780); influential citation signal (39),Risk forecasts can fail under regime breaks and extreme events.; Choice of loss function strongly affects model rankings.; Citation counts do not prove suitability for a specific mandate or risk budget.,https://doi.org/10.2139/ssrn.258430,https://www.semanticscholar.org/paper/f48bb9f921d1d53f7b4ae7501ec5b074da9a6108,,,10.2139/ssrn.258430,,,167558893,Business; Economics,Review,securities market,1,citations=780; influential=39; survey/benchmark signal; investment validation signal; open PDF metadata; trade term matches=2,"This paper develops a broad concept of systemic risk, the basic economic concept for the understanding of financial crises. It is claimed that any such concept must integrate systemic events in banking and financial markets as well as in the related payment and settlement systems. At the heart of systemic risk are contagion effects, various forms of external effects. The concept also includes simultaneous financial instabilities following aggregate shocks. The quantitative literature on systemic risk, which was evolving swiftly in the last couple of years, is surveyed in the light of this concept. Various rigorous models of bank and payment system contagion have now been developed, although a general theoretical paradigm is still missing. Direct econometric tests of bank contagion effects seem to be mainly limited to the United States. Empirical studies of systemic risk in foreign exchange and security settlement systems appear to be non-existent. Moreover, the literature surveyed reflects the general difficulty to develop empirical tests that can make a clear distinction between contagion in the proper sense and joint crises caused by common shocks, rational revisions of depositor or investor expectations when information is asymmetric ('information-based' contagion) and 'pure' contagion as well as between 'efficient' and 'inefficient' systemic events. JEL Classification: G21, G29, G12, E49"
172,18,18,2000,"Trading Volume: Definitions, Data Analysis, and Implications of Portfolio Theory","Andrew W. Lo, Jiang Wang",,2000-03-01,776,61,216.2,Portfolio Optimization and Asset Allocation,portfolio,portfolio,"Positions Trading Volume: Definitions, Data Analysis, and Implications of Portfolio Theory within Portfolio Optimization and Asset Allocation.",high citation signal (776); influential citation signal (61); open-access PDF metadata,"Allocation gains can be dominated by estimation error, turnover, short-sale constraints, and benchmark choice.; Backtests may hide capacity and liquidity limits.; Metadata cannot confirm implementation details such as costs, leverage, or rebalancing rules.",https://doi.org/10.1093/RFS/13.2.257,https://www.semanticscholar.org/paper/5862c451f29b131a8313a06deada2d94c9154757,http://papers.nber.org/papers/w7625.pdf,,10.1093/RFS/13.2.257,,,15542698,Economics; Mathematics,,equity factor models,1,citations=776; influential=61; investment validation signal; open PDF metadata; title trade matches=2; trade term matches=2,
174,19,19,2000,First Draft : March 1999 This Draft : 25 May 2000 Portfolio Choice and Equity Characteristics : Characterizing the Hedging Demands Induced by Return Predictability,Anthony W. Lynch,,,775,27,205.042,Portfolio Optimization and Asset Allocation,forecasting; portfolio; asset-pricing,stock-prediction; portfolio,Positions First Draft : March 1999 This Draft : 25 May 2000 Portfolio Choice and Equity Characteristics : Characterizing the Hedging Demands Induced by Return Predictability within Portfolio Optimization and Asset Allocation.,high citation signal (775); influential citation signal (27),"Allocation gains can be dominated by estimation error, turnover, short-sale constraints, and benchmark choice.; Backtests may hide capacity and liquidity limits.; Metadata cannot confirm implementation details such as costs, leverage, or rebalancing rules.",https://www.semanticscholar.org/paper/a2652ffbace242eb545f49a32350df85099e431a,https://www.semanticscholar.org/paper/a2652ffbace242eb545f49a32350df85099e431a,,,,,,9588626,Business; Economics,,equity returns,1,citations=775; influential=27; investment validation signal; open PDF metadata; title trade matches=2; trade term matches=2,
185,20,20,2000,Genetic algorithms approach to feature discretization in artificial neural networks for the prediction of stock price index,"Kyoung-jae Kim, Ingoo Han",,2000-08-01,746,19,201.494,Deep Learning and Financial Time Series,forecasting; deep-learning,stock-prediction,Positions Genetic algorithms approach to feature discretization in artificial neural networks for the prediction of stock price index within Deep Learning and Financial Time Series.,high citation signal (746); influential citation signal (19),"Deep models can overfit noisy, nonstationary, and low signal-to-noise market data.; Compute-heavy models may be hard to reproduce without code and data access.; Reported gains need robustness checks across regimes and markets.",https://doi.org/10.1016/S0957-4174(00)00027-0,https://www.semanticscholar.org/paper/760a9643ca6f9ae519af9c33607c9e4bca4bd2c8,,,10.1016/S0957-4174(00)00027-0,,,5224443,Business; Computer Science,,stock price prediction,1,citations=746; influential=19; AI/ML method signal; open PDF metadata; title trade matches=3; trade term matches=3,
186,21,21,2000,Investor Sophistication and Patterns in Stock Returns after Earnings Announcements,"E. Bartov, S. Radhakrishnan, I. Krinsky",,2000-01-21,742,69,216.914,Asset Pricing and Return Predictability,metadata-ranked,asset-pricing,Positions Investor Sophistication and Patterns in Stock Returns after Earnings Announcements within Asset Pricing and Return Predictability.,high citation signal (742); influential citation signal (69),"Return predictability can disappear after transaction costs, crowding, and multiple-testing correction.; Citation impact can favor well-known anomalies even when live performance later weakens.; Metadata cannot verify whether data-snooping controls were adequate.",https://doi.org/10.2308/ACCR.2000.75.1.43,https://www.semanticscholar.org/paper/4e48d6553881e09b7b7b58febeb89bc7bb9361a4,,,10.2308/ACCR.2000.75.1.43,,,154245589,Business; Economics,,earnings announcements stock returns; stock returns,2,citations=742; influential=69; open PDF metadata; title trade matches=3; trade term matches=3; query hits=2,
