rank,yearRank,candidateRank,year,title,authors,venue,publicationDate,citationCount,influentialCitationCount,importanceScore,category,methodTags,keywordTags,keyIdea,strengths,limitations,url,semanticScholarUrl,openAccessPdf,githubUrl,doi,arxiv,pubmed,corpusId,fieldsOfStudy,publicationTypes,sourceQueries,queryHitCount,importanceReasons,abstract
1847,69,124,2018,Modelling and forecasting the stock market volatility of SSE Composite Index using GARCH models,Zhenlong Lin,Future generations computer systems,2018-02-01,139,14,160.629,"Risk, Volatility, and Forecast Evaluation",risk/volatility,stock-prediction; risk-volatility,"Positions Modelling and forecasting the stock market volatility of SSE Composite Index using GARCH models within Risk, Volatility, and Forecast Evaluation.",high citation signal (139); influential citation signal (14),Risk forecasts can fail under regime breaks and extreme events.; Choice of loss function strongly affects model rankings.; Citation counts do not prove suitability for a specific mandate or risk budget.,https://doi.org/10.1016/j.future.2017.08.033,https://www.semanticscholar.org/paper/9fcca1f046dddc77408d30ac89cfba9aa682f04b,,,10.1016/j.future.2017.08.033,,,22648911,Business; Computer Science; Economics; Mathematics,JournalArticle,capital markets investment; volatility forecasting stock market,2,citations=139; influential=14; investment validation signal; open PDF metadata; title trade matches=2; trade term matches=2; query hits=2,
1966,70,132,2018,Stock Price Prediction Using Attention-based Multi-Input LSTM,"Hao Li, Yanyan Shen, Yanmin Zhu",Asian Conference on Machine Learning,2018-11-04,131,5,150.506,Deep Learning and Financial Time Series,forecasting; machine-learning; deep-learning,stock-prediction; machine-learning; deep-learning; ai-based-trade; behavioral-finance,Positions Stock Price Prediction Using Attention-based Multi-Input LSTM within Deep Learning and Financial Time Series.,high citation signal (131),"Deep models can overfit noisy, nonstationary, and low signal-to-noise market data.; Compute-heavy models may be hard to reproduce without code and data access.; Reported gains need robustness checks across regimes and markets.",https://www.semanticscholar.org/paper/26a0bae91fe5ed57f7e08f3373e0bec971e18c38,https://www.semanticscholar.org/paper/26a0bae91fe5ed57f7e08f3373e0bec971e18c38,,,,,,53591822,Computer Science,JournalArticle,neural networks stock market; stock market prediction; stock price prediction,3,citations=131; influential=5; AI/ML method signal; open PDF metadata; title trade matches=3; trade term matches=4; query hits=3,
2019,71,133,2018,Stock Market Prediction via Multi-Source Multiple Instance Learning,"Xi Zhang, Siyu Qu, Jieyun Huang, B. Fang, Philip S. Yu",IEEE Access,2018-09-13,127,7,155.857,"Sentiment, News, and Alternative Data",forecasting; sentiment/text,stock-prediction; sentiment-altdata,Forecasting the stock market movements is an important and challenging task.,high citation signal (127); recognized finance/AI venue; open-access PDF metadata,Timestamp alignment and look-ahead bias are critical for text and alternative-data studies.; Sentiment signals can decay quickly as information becomes crowded.; Data licensing and coverage bias can limit reproducibility.,https://doi.org/10.1109/ACCESS.2018.2869735,https://www.semanticscholar.org/paper/b88d256319abc4b4a39bb942f04e389501f0ca34,https://doi.org/10.1109/access.2018.2869735,,10.1109/ACCESS.2018.2869735,,,52929450,Business; Computer Science,JournalArticle,news sentiment stock market; stock market prediction,2,citations=127; influential=7; recognized finance/AI venue; open PDF metadata; title trade matches=2; trade term matches=3; query hits=2,"Forecasting the stock market movements is an important and challenging task. As the Web information grows, researchers begin to extract effective indicators (e.g., the events and sentiments) from the Web to facilitate the prediction. However, the indicators obtained in previous studies are usually based on only one data source and thus may not fully cover the factors that can affect the stock market movements. In this paper, to improve the prediction for stock market composite index movements, we exploit the consistencies among different data sources, and develop a multi-source multiple instance model that can effectively combine events, sentiments, as well as the quantitative data into a comprehensive framework. To effectively capture the news events, we successfully apply a novel event extraction and representation method. Evaluations on the data from the year 2015 and 2016 demonstrate the effectiveness of our model. In addition, our approach is able to automatically determine the importance of each data source and identify the crucial input information that is considered to drive the movements, making the predictions interpretable."
2068,72,137,2018,The Interaction Between Microblog Sentiment and Stock Returns: An Empirical Examination,"Shuyuan Deng, Zhijian (James) Huang, Atish P. Sinha, Huimin Zhao",MIS Q.,2018-09-01,124,11,148.012,"Sentiment, News, and Alternative Data",sentiment/text,sentiment-altdata,"Positions The Interaction Between Microblog Sentiment and Stock Returns: An Empirical Examination within Sentiment, News, and Alternative Data.",high citation signal (124); influential citation signal (11),Timestamp alignment and look-ahead bias are critical for text and alternative-data studies.; Sentiment signals can decay quickly as information becomes crowded.; Data licensing and coverage bias can limit reproducibility.,https://doi.org/10.25300/misq/2018/14268,https://www.semanticscholar.org/paper/9b307a49ec3a372fc097c67f12d4c25837e78908,,,10.25300/misq/2018/14268,,,52272850,Business; Computer Science; Economics,JournalArticle,stock returns,1,citations=124; influential=11; open PDF metadata; title trade matches=2; trade term matches=2,
2087,73,138,2018,Automated trading systems statistical and machine learning methods and hardware implementation: a survey,"Boming Huang, Y. Huan, Lida Xu, Lirong Zheng, Z. Zou",Enterprise Information Systems,2018-07-12,123,2,139.427,Market Microstructure and High-Frequency Trading,survey/review; machine-learning; microstructure,machine-learning; ai-based-trade; reinforcement-trading; high-frequency,"ABSTRACT Automated trading, which is also known as algorithmic trading, is a method of using a predesigned computer program to submit a large number of trading orders to an exchange.",high citation signal (123); open-access PDF metadata,"High-frequency results depend heavily on market access, latency, fees, and order-book reconstruction quality.; Public metadata rarely reveals execution assumptions.; Short-horizon predictability can vanish when capacity and competition are considered.",https://doi.org/10.1080/17517575.2018.1493145,https://www.semanticscholar.org/paper/4e6da7e6dfe8d029a6652b4af097c94e704bcda4,https://www.tandfonline.com/doi/pdf/10.1080/17517575.2018.1493145?needAccess=true,,10.1080/17517575.2018.1493145,,,57663918,Business; Computer Science,JournalArticle; Review,algorithmic trading,1,citations=123; influential=2; survey/benchmark signal; AI/ML method signal; open PDF metadata; title trade matches=2; trade term matches=4,"ABSTRACT Automated trading, which is also known as algorithmic trading, is a method of using a predesigned computer program to submit a large number of trading orders to an exchange. It is substantially a real-time decision-making system which is under the scope of Enterprise Information System (EIS). With the rapid development of telecommunication and computer technology, the mechanisms underlying automated trading systems have become increasingly diversified. Considerable effort has been exerted by both academia and trading firms towards mining potential factors that may generate significantly higher profits. In this paper, we review studies on trading systems built using various methods and empirically evaluate the methods by grouping them into three types: technical analyses, textual analyses and high-frequency trading. Then, we evaluate the advantages and disadvantages of each method and assess their future prospects."
2110,74,141,2018,Policy uncertainty and international financial markets: the case of Brexit,"A. Belke, I. Dubova, Thomas Osowski",,2018-02-08,121,8,143.45,Reinforcement Learning and Algorithmic Trading,reinforcement-learning,reinforcement-trading,Positions Policy uncertainty and international financial markets: the case of Brexit within Reinforcement Learning and Algorithmic Trading.,high citation signal (121),"Simulated rewards can diverge from executable trading under slippage, latency, and market impact.; Policies can be brittle during regime shifts or stress periods.; Backtest-only evidence needs live or paper-trading validation.",https://doi.org/10.1080/00036846.2018.1436152,https://www.semanticscholar.org/paper/b31fd5591e9c208bedf55786dbcc3d47ca36950e,,,10.1080/00036846.2018.1436152,,,55300278,Economics,,stock returns,1,citations=121; influential=8; open PDF metadata; title trade matches=2; trade term matches=2,
2137,75,144,2018,Stock Market Price Prediction Using LSTM RNN,"Kriti Pawar, Raj Srujan Jalem, V. Tiwari",Advances in Intelligent Systems and Computing,2018-11-20,119,6,148.568,Deep Learning and Financial Time Series,forecasting; deep-learning,stock-prediction; deep-learning; ai-based-trade,Positions Stock Market Price Prediction Using LSTM RNN within Deep Learning and Financial Time Series.,high citation signal (119),"Deep models can overfit noisy, nonstationary, and low signal-to-noise market data.; Compute-heavy models may be hard to reproduce without code and data access.; Reported gains need robustness checks across regimes and markets.",https://doi.org/10.1007/978-981-13-2285-3_58,https://www.semanticscholar.org/paper/b69cb299a339586694d0a3f20d8a23d7b863724f,,,10.1007/978-981-13-2285-3_58,,,158191176,Business; Computer Science,,financial market prediction; machine learning stock market; neural networks stock market; stock market prediction; stock price prediction; support vector machine stock prediction,6,citations=119; influential=6; open PDF metadata; title trade matches=3; trade term matches=3; query hits=6,
2139,76,145,2018,A comprehensive test of the Fama-French five-factor model in emerging markets,J. Foye,Emerging Markets Review,2018-09-22,119,5,139.409,Asset Pricing and Return Predictability,survey/review; asset-pricing,asset-pricing,This paper evaluates whether the new Fama-French five-factor model is able to offer a better description of emerging market equity returns than the three-factor model.,high citation signal (119),"Return predictability can disappear after transaction costs, crowding, and multiple-testing correction.; Citation impact can favor well-known anomalies even when live performance later weakens.; Metadata cannot verify whether data-snooping controls were adequate.",https://doi.org/10.1016/J.EMEMAR.2018.09.002,https://www.semanticscholar.org/paper/210ef1e8ff1ce1ad8bf096553348c6b9e1359a8a,,,10.1016/J.EMEMAR.2018.09.002,,,158076655,Economics,,equity factor models,1,citations=119; influential=5; survey/benchmark signal; open PDF metadata; title trade matches=1; trade term matches=1,"This paper evaluates whether the new Fama-French five-factor model is able to offer a better description of emerging market equity returns than the three-factor model. Using an extensive sample of 18 countries from three different regions, the paper is the first to test the performance of the five-factor model across a broad range of emerging markets. The five-factor model consistently outperforms the three-factor model in Eastern Europe and Latin America. However, a profitability or investment premium cannot be distinguished in the Asian factors and the five-factor model fails to provide an improved description of equity returns in the region."
2153,77,148,2018,The risk-adjusted return potential of integrating ESG strategies into emerging market equities,"M. Sherwood, J. Pollard",,2018-01-02,118,3,135.549,"Risk, Volatility, and Forecast Evaluation",risk/volatility,risk-volatility,"Positions The risk-adjusted return potential of integrating ESG strategies into emerging market equities within Risk, Volatility, and Forecast Evaluation.",high citation signal (118),Risk forecasts can fail under regime breaks and extreme events.; Choice of loss function strongly affects model rankings.; Citation counts do not prove suitability for a specific mandate or risk budget.,https://doi.org/10.1080/20430795.2017.1331118,https://www.semanticscholar.org/paper/adf34a6ec9038b4493f9a857ef1b3b3d025eda82,,,10.1080/20430795.2017.1331118,,,168998100,Business; Economics; Environmental Science,,equity portfolio performance; equity returns,2,citations=118; influential=3; investment validation signal; open PDF metadata; title trade matches=1; trade term matches=1; query hits=2,
2174,78,151,2018,"The Twitter myth revisited: Intraday investor sentiment, Twitter activity and individual-level stock return volatility","Simon Behrendt, Alexander Schmidt",Journal of Banking & Finance,2018-11-01,116,2,135.148,"Sentiment, News, and Alternative Data",forecasting; sentiment/text; microstructure; risk/volatility,stock-prediction; sentiment-altdata; high-frequency; risk-volatility; behavioral-finance,"Taking an intraday perspective, we study the dynamics of individual-level stock return volatility, measured by absolute 5-minute returns, and Twitter sentiment and activity.",high citation signal (116),Timestamp alignment and look-ahead bias are critical for text and alternative-data studies.; Sentiment signals can decay quickly as information becomes crowded.; Data licensing and coverage bias can limit reproducibility.,https://doi.org/10.1016/J.JBANKFIN.2018.09.016,https://www.semanticscholar.org/paper/7fe6293af240627500985a751bfe31c5850350bd,,,10.1016/J.JBANKFIN.2018.09.016,,,158133559,Economics,,investor sentiment stock returns; stock returns,2,citations=116; influential=2; investment validation signal; open PDF metadata; title trade matches=2; trade term matches=3; query hits=2,"Taking an intraday perspective, we study the dynamics of individual-level stock return volatility, measured by absolute 5-minute returns, and Twitter sentiment and activity. After accounting for the intraday periodicity in absolute returns, we discover some statistically significant co-movements of intraday volatility and information from stock-related Tweets for all constituents of the Dow Jones Industrial Average. However, economically, the effects are of negligible magnitude and out-of-sample forecast performance is not improved when including Twitter sentiment and activity as exogenous variables. From a practical point of view, we find that high-frequency Twitter information is not particularly useful for highly active investors with access to such data for intraday volatility assessment and forecasting when considering individual-level stocks."
2177,79,152,2018,"Geopolitical Risks, Returns, and Volatility in Emerging Stock Markets: Evidence from a Panel GARCH Model","Christos Bouras, Christina Christou, Rangan Gupta, T. Suleman",Emerging markets finance & trade,2018-10-04,116,1,129.472,"Risk, Volatility, and Forecast Evaluation",risk/volatility,stock-prediction; risk-volatility,"ABSTRACT In this article, we analyze the role of country-specific and global geopolitical risks (GPRs) on the returns and volatility of 18 emerging market economies over the monthly period of 1998:11 to 2017:06.",high citation signal (116),Risk forecasts can fail under regime breaks and extreme events.; Choice of loss function strongly affects model rankings.; Citation counts do not prove suitability for a specific mandate or risk budget.,https://doi.org/10.1080/1540496X.2018.1507906,https://www.semanticscholar.org/paper/8364ed734f96afb361e63af7ac172660776843d6,,,10.1080/1540496X.2018.1507906,,,158994974,Economics; Political Science,,equity returns; market efficiency stock returns; stock returns,3,citations=116; influential=1; investment validation signal; open PDF metadata; title trade matches=1; trade term matches=4; query hits=3,"ABSTRACT In this article, we analyze the role of country-specific and global geopolitical risks (GPRs) on the returns and volatility of 18 emerging market economies over the monthly period of 1998:11 to 2017:06. For our purpose, we use a panel Generalized Autoregressive Conditional Heteroskedasticity (GARCH) approach, which offers substantial efficiency gains in estimating the conditional variance and covariance processes by accounting for interdependencies and heterogeneity across economies, unlikein a time series-based GARCH model. We find that, while country-specific GPRs do not have an impact on stock returns, and the positive effect on equity market volatility is statistically weak. But when we consider a broad measure of global GPR, though there is still no significant effect on returns, the impact on volatility is both economically and statistically stronger than that obtained under the country-specific GPRs, thus highlighting the dominance of global rather than domestic shocks."
2180,80,153,2018,Reinforcement learning in financial markets - a survey,Thomas G. Fischer,,,115,7,152.691,Reinforcement Learning and Algorithmic Trading,survey/review; reinforcement-learning,reinforcement-trading,Positions Reinforcement learning in financial markets - a survey within Reinforcement Learning and Algorithmic Trading.,high citation signal (115),"Simulated rewards can diverge from executable trading under slippage, latency, and market impact.; Policies can be brittle during regime shifts or stress periods.; Backtest-only evidence needs live or paper-trading validation.",https://www.semanticscholar.org/paper/922864ede84bc49be4ac676951278a9b568b6383,https://www.semanticscholar.org/paper/922864ede84bc49be4ac676951278a9b568b6383,,,,,,169730324,Business; Computer Science; Economics,Review,financial market prediction,1,citations=115; influential=7; survey/benchmark signal; AI/ML method signal; open PDF metadata; title trade matches=3; trade term matches=3,
2187,81,154,2018,Using Twitter trust network for stock market analysis,"Yefeng Ruan, A. Durresi, L. Alfantoukh",Knowledge-Based Systems,2018-04-01,115,5,143.664,"Sentiment, News, and Alternative Data",metadata-ranked,stock-prediction; sentiment-altdata,"Positions Using Twitter trust network for stock market analysis within Sentiment, News, and Alternative Data.",high citation signal (115); recognized finance/AI venue; open-access PDF metadata,Timestamp alignment and look-ahead bias are critical for text and alternative-data studies.; Sentiment signals can decay quickly as information becomes crowded.; Data licensing and coverage bias can limit reproducibility.,https://doi.org/10.1016/J.KNOSYS.2018.01.016,https://www.semanticscholar.org/paper/11c7fcdf0311e96f6e0ebbe58766f8c1a9444f7b,https://www.sciencedirect.com/science/article/am/pii/S0950705118300248,,10.1016/J.KNOSYS.2018.01.016,,,3680493,Business; Computer Science,JournalArticle,stock returns,1,citations=115; influential=5; recognized finance/AI venue; open PDF metadata; title trade matches=1; trade term matches=1,
2191,82,156,2018,The heterogeneous impact of Brexit: Early indications from the FTSE,"Ronald B. Davies, Z. Studnicka",European Economic Review,2018-11-01,114,7,141.501,"General Finance, Surveys, and Trading Systems",survey/review,stock-prediction,The UK’s decision to leave the EU is surrounded by several studies simulating its potential effects.,high citation signal (114); open-access PDF metadata,"Surveys and systems can dominate citations while empirical evidence remains mixed across markets.; Broad claims need careful mapping to data, costs, and investment horizons.; Metadata-driven ranking cannot replace expert reading of full papers and backtests.",https://doi.org/10.1016/J.EUROECOREV.2018.08.003,https://www.semanticscholar.org/paper/106df060891c2d86df9a610308754c7a639c2628,https://www.cesifo.org/DocDL/cesifo1_wp6478.pdf,,10.1016/J.EUROECOREV.2018.08.003,,,55620202,Economics,,stock returns,1,citations=114; influential=7; survey/benchmark signal; open PDF metadata; trade term matches=2,"The UK’s decision to leave the EU is surrounded by several studies simulating its potential effects. Alternatively, we examine expectations embodied in stock returns using a two-part estimation process. While most firms’ prices fell, there was considerable heterogeneity in their relative changes. We show that this heterogeneity can be explained by the firm’s global value chain, with heavily European firms doing relatively worse. For firms with few imported intermediates, this was partially offset by a greater Sterling depreciation. These changes were primarily in the first two days and highly persistent. Understanding these movements gives a better understanding Brexit’s potential effects."
2193,83,158,2018,The ESG Integration Paradox,Michael Cappucci,Journal of Applied Corporate Finance,2018-06-01,114,4,139.921,Reinforcement Learning and Algorithmic Trading,asset-pricing; reinforcement-learning; risk/volatility,reinforcement-trading; risk-volatility; asset-pricing,"Today, most investment managers have something to say about environmental, social and governance (ESG) issues, and written ESG policies are ubiquitous.",high citation signal (114),"Simulated rewards can diverge from executable trading under slippage, latency, and market impact.; Policies can be brittle during regime shifts or stress periods.; Backtest-only evidence needs live or paper-trading validation.",https://doi.org/10.1111/JACF.12296,https://www.semanticscholar.org/paper/e475d316508181f2fa788d957dd0e69fa5012f0c,,,10.1111/JACF.12296,,,169015318,Business; Economics; Environmental Science,,asset pricing stock returns; stock returns,2,citations=114; influential=4; investment validation signal; open PDF metadata; trade term matches=5; query hits=2,"Today, most investment managers have something to say about environmental, social and governance (ESG) issues, and written ESG policies are ubiquitous. Yet, a written policy is not a reliable indicator of a firm's commitment. Actual ESG incorporation practices vary greatly, with most investment managers falling well short of full integration. Only a few firms seem to be using ESG factors to deliver alpha, hence, the paradox. If not implemented wholeheartedly, responsible investing can lead to lower financial returns. So, why have so few investment managers gone all the way? The paradox involves a “valley” of lower returns where portfolios first absorb the costs of ESG integration before the promised benefits materialize. In the early days of ethical investing, the focus was on using negative screens to exclude certain companies for moral or ethical reasons but lower financial returns are inherent to exclusionary screening. Hard exclusions force managers to tradeoff certain risks for others. So, for example, if the market discounts tobacco stock prices to account for changing consumer behavior, eventually tobacco stock prices become attractive again as, indeed, has been the case over the last two decades. Exclusionary screening alone is a self‐limiting strategy. By contrast, ESG strategies range from active ownership and engagement, to positive screening (selecting for certain attributes), to relative weighting (sometimes called “best‐in‐class selection”), to risk factor investing, to full integration. Because the relationship between an asset manager's ESG efforts and its risk‐adjusted performance is not classically linear, asset owners should look for managers that are on the upward slope of the ESG intensity curve and are fully committed to advancing up it."
2198,84,160,2018,Stock Prediction Using Convolutional Neural Network,"Sheng Chen, Hongxiang He",IOP Conference Series: Materials Science and Engineering,2018-11-05,113,8,154.958,Deep Learning and Financial Time Series,forecasting; machine-learning; deep-learning,stock-prediction; machine-learning; deep-learning; ai-based-trade,Stock prediction is a very hot topic in our life.,high citation signal (113); open-access PDF metadata,"Deep models can overfit noisy, nonstationary, and low signal-to-noise market data.; Compute-heavy models may be hard to reproduce without code and data access.; Reported gains need robustness checks across regimes and markets.",https://doi.org/10.1088/1757-899X/435/1/012026,https://www.semanticscholar.org/paper/dba69e77086ca96c5bb6c6915f907be2e3f9d9d5,https://doi.org/10.1088/1757-899x/435/1/012026,,10.1088/1757-899X/435/1/012026,,,69733974,Business; Computer Science; Physics,Conference,deep learning stock prediction; machine learning stock market; neural networks stock market; stock market prediction; stock price prediction,5,citations=113; influential=8; AI/ML method signal; open PDF metadata; title trade matches=2; trade term matches=6; query hits=5,"Stock prediction is a very hot topic in our life. However, in the early time, because of some reasons and the limitation of the device, only a few people had the access to the study. Thanks to the rapid development of science and technology, in recent years more and more people are devoted to the study of the prediction and it becomes easier and easier for us to make stock prediction by using different ways now, including machine learning, deep learning and so on. In this paper, we proposed a deep learning method based on Convolutional Neural Network to predict the stock price movement of Chinese stock market. We set the opening price, high price, low price, closing price and volume of stock deriving from the internet as input of the architecture and then run and test the program. The result has shown that it is a bit reliable to use deep learning method based on Convolutional Neural Network to predict the stockprice movement of China."
