rank,yearRank,candidateRank,year,title,authors,venue,publicationDate,citationCount,influentialCitationCount,importanceScore,category,methodTags,keywordTags,keyIdea,strengths,limitations,url,semanticScholarUrl,openAccessPdf,githubUrl,doi,arxiv,pubmed,corpusId,fieldsOfStudy,publicationTypes,sourceQueries,queryHitCount,importanceReasons,abstract
639,38,38,2003,The Long Memory of the Efficient Market,"F. Lillo, J. Farmer",,2003-11-03,386,37,184.012,Market Microstructure and High-Frequency Trading,microstructure,high-frequency,Abstract For the London Stock Exchange we demonstrate that the signs of orders obey a long-memory process.,high citation signal (386); influential citation signal (37); open-access PDF metadata,"High-frequency results depend heavily on market access, latency, fees, and order-book reconstruction quality.; Public metadata rarely reveals execution assumptions.; Short-horizon predictability can vanish when capacity and competition are considered.",https://doi.org/10.2202/1558-3708.1226,https://www.semanticscholar.org/paper/d144d7492e96c6b4283eb58781c7e2051525c16e,https://arxiv.org/pdf/cond-mat/0311053,,10.2202/1558-3708.1226,cond-mat/0311053,,31214126,Economics; Physics,,stock returns,1,citations=386; influential=37; open PDF metadata; trade term matches=1,"Abstract For the London Stock Exchange we demonstrate that the signs of orders obey a long-memory process. The autocorrelation function decays roughly as a power law with an exponent of 0.6, corresponding to a Hurst exponent H = 0.7. This implies that the signs of future orders are quite predictable from the signs of past orders; all else being equal, this would suggest a very strong market inefficiency. We demonstrate, however, that fluctuations in order signs are compensated for by anti-correlated fluctuations in transaction size and liquidity, which are also long-memory processes that act to make the returns whiter. We show that some institutions display long-range memory and others don’t."
651,39,39,2003,Price Discovery and Trading After Hours,"Michael J. Barclay, T. Hendershott",,2003-10-01,381,52,195.383,"General Finance, Surveys, and Trading Systems",metadata-ranked,stock-prediction,"Positions Price Discovery and Trading After Hours within General Finance, Surveys, and Trading Systems.",high citation signal (381); influential citation signal (52),"Surveys and systems can dominate citations while empirical evidence remains mixed across markets.; Broad claims need careful mapping to data, costs, and investment horizons.; Metadata-driven ranking cannot replace expert reading of full papers and backtests.",https://doi.org/10.1093/RFS/HHG030,https://www.semanticscholar.org/paper/343e22b18fd3f46c9a936b0de50a97dbfd71e802,,,10.1093/RFS/HHG030,,,15197679,Economics,,price discovery stock market; securities market,2,citations=381; influential=52; open PDF metadata; title trade matches=2; trade term matches=2; query hits=2,
689,40,40,2003,Do financial variables help forecasting inflation and real activity in the Euro area,"M. Hallin, M. Forni, M. Lippi, L. Reichlin",,2003-09-01,364,19,175.738,"Risk, Volatility, and Forecast Evaluation",metadata-ranked,risk-volatility,"Positions Do financial variables help forecasting inflation and real activity in the Euro area within Risk, Volatility, and Forecast Evaluation.",high citation signal (364); influential citation signal (19); open-access PDF metadata,Risk forecasts can fail under regime breaks and extreme events.; Choice of loss function strongly affects model rankings.; Citation counts do not prove suitability for a specific mandate or risk budget.,https://doi.org/10.1016/S0304-3932(03)00079-5,https://www.semanticscholar.org/paper/cb6035d4126db320acf1f73c9a36388459851232,https://dipot.ulb.ac.be/dspace/bitstream/2013/2123/1/mh-0072.pdf,,10.1016/S0304-3932(03)00079-5,,,5544376,Economics,,financial time series forecasting,1,citations=364; influential=19; open PDF metadata; title trade matches=1; trade term matches=1,
783,41,41,2003,Technical Analysis in Financial Markets,,,2003-03-03,333,50,198.891,"General Finance, Surveys, and Trading Systems",metadata-ranked,stock-prediction,"Positions Technical Analysis in Financial Markets within General Finance, Surveys, and Trading Systems.",high citation signal (333); influential citation signal (50); open-access PDF metadata,"Surveys and systems can dominate citations while empirical evidence remains mixed across markets.; Broad claims need careful mapping to data, costs, and investment horizons.; Metadata-driven ranking cannot replace expert reading of full papers and backtests.",https://doi.org/10.2139/SSRN.566882,https://www.semanticscholar.org/paper/f1b4a22d6bad9be3c8811599d0bf717be258c77b,https://pure.uva.nl/ws/files/3628639/29183_Thesis.pdf,,10.2139/SSRN.566882,,,151044867,Business; Economics,,asset pricing stock returns; capital markets investment; stock returns; technical analysis stock market; trading strategies stock market; volatility forecasting stock market,6,citations=333; influential=50; open PDF metadata; title trade matches=3; trade term matches=3; query hits=6,
807,42,42,2003,FORECASTING VOLATILITY,"Louis H. Ederington, Wei Guan",,,328,25,182.127,"Risk, Volatility, and Forecast Evaluation",risk/volatility,risk-volatility,"Positions FORECASTING VOLATILITY within Risk, Volatility, and Forecast Evaluation.",high citation signal (328); influential citation signal (25),Risk forecasts can fail under regime breaks and extreme events.; Choice of loss function strongly affects model rankings.; Citation counts do not prove suitability for a specific mandate or risk budget.,https://www.semanticscholar.org/paper/1b17ffddabbcbedeebe12022686e5e531aa1c5fb,https://www.semanticscholar.org/paper/1b17ffddabbcbedeebe12022686e5e531aa1c5fb,,,,,,1882893,Economics,,financial time series forecasting,1,citations=328; influential=25; investment validation signal; open PDF metadata; title trade matches=1; trade term matches=1,
824,43,43,2003,An Analysis of Hedge Fund Performance,"Daniel P. J. Capocci, G. Hübner",,2003-04-15,325,36,188.865,"General Finance, Surveys, and Trading Systems",metadata-ranked,stock-prediction,"Positions An Analysis of Hedge Fund Performance within General Finance, Surveys, and Trading Systems.",high citation signal (325); influential citation signal (36),"Surveys and systems can dominate citations while empirical evidence remains mixed across markets.; Broad claims need careful mapping to data, costs, and investment horizons.; Metadata-driven ranking cannot replace expert reading of full papers and backtests.",https://doi.org/10.1016/J.JEMPFIN.2002.12.002,https://www.semanticscholar.org/paper/fe5ba12678c2b4c987ddc00c7146cb39c5d1d5e6,,,10.1016/J.JEMPFIN.2002.12.002,,,154186763,Business; Economics,,equity factor models; equity returns; factor investing equity; hedge fund performance equity,4,citations=325; influential=36; open PDF metadata; title trade matches=2; trade term matches=2; query hits=4,
845,44,44,2003,Critical Market Crashes,"D. Sornette, D. Sornette",,2003-01-28,320,21,182.246,Reinforcement Learning and Algorithmic Trading,survey/review; forecasting; reinforcement-learning,stock-prediction; ai-based-trade; reinforcement-trading; behavioral-finance,"This review is a partial synthesis of the book ``Why stock market crash'' (Princeton University Press, January 2003), which presents a general theory of financial crashes and of stock market instabilities that his co-workers and the author have developed over the past seven years.",high citation signal (320); influential citation signal (21); open-access PDF metadata,"Simulated rewards can diverge from executable trading under slippage, latency, and market impact.; Policies can be brittle during regime shifts or stress periods.; Backtest-only evidence needs live or paper-trading validation.",https://doi.org/10.1016/S0370-1573(02)00634-8,https://www.semanticscholar.org/paper/c74e2be3d700d9c979a98d929fb4dd0aed3ef3ae,https://arxiv.org/pdf/cond-mat/0301543,,10.1016/S0370-1573(02)00634-8,cond-mat/0301543,,12847333,Business; Economics; Physics,Review,financial market prediction; stock market prediction,2,citations=320; influential=21; survey/benchmark signal; open PDF metadata; trade term matches=4; query hits=2,"This review is a partial synthesis of the book ``Why stock market crash'' (Princeton University Press, January 2003), which presents a general theory of financial crashes and of stock market instabilities that his co-workers and the author have developed over the past seven years. The study of the frequency distribution of drawdowns, or runs of successive losses shows that large financial crashes are ``outliers'': they form a class of their own as can be seen from their statistical signatures. If large financial crashes are ``outliers'', they are special and thus require a special explanation, a specific model, a theory of their own. In addition, their special properties may perhaps be used for their prediction. The main mechanisms leading to positive feedbacks, i.e., self-reinforcement, such as imitative behavior and herding between investors are reviewed with many references provided to the relevant literature outside the confine of Physics. Positive feedbacks provide the fuel for the development of speculative bubbles, preparing the instability for a major crash. We demonstrate several detailed mathematical models of speculative bubbles and crashes. The most important message is the discovery of robust and universal signatures of the approach to crashes. These precursory patterns have been documented for essentially all crashes on developed as well as emergent stock markets, on currency markets, on company stocks, and so on. The concept of an ``anti-bubble'' is also summarized, with two forward predictions on the Japanese stock market starting in 1999 and on the USA stock market still running. We conclude by presenting our view of the organization of financial markets."
909,45,45,2003,Internet-Based Virtual Stock Markets for Business Forecasting,"Martin Spann, B. Skiera",Management Sciences,2003-10-01,303,18,183.997,"General Finance, Surveys, and Trading Systems",metadata-ranked,stock-prediction,"Positions Internet-Based Virtual Stock Markets for Business Forecasting within General Finance, Surveys, and Trading Systems.",high citation signal (303); influential citation signal (18); recognized finance/AI venue; open-access PDF metadata,"Surveys and systems can dominate citations while empirical evidence remains mixed across markets.; Broad claims need careful mapping to data, costs, and investment horizons.; Metadata-driven ranking cannot replace expert reading of full papers and backtests.",https://doi.org/10.1287/mnsc.49.10.1310.17314,https://www.semanticscholar.org/paper/d26a532ac129ec5bc44c59574a5c8470e64f3162,http://www.hsxresearch.com/assets/VSM_Mgmt_Sci.pdf,,10.1287/mnsc.49.10.1310.17314,,,14345860,Business; Computer Science; Economics,JournalArticle,stock market prediction,1,citations=303; influential=18; recognized finance/AI venue; open PDF metadata; title trade matches=2; trade term matches=2,
928,46,46,2003,Investment guarantees : modeling and risk management for equity-linked life insurance,M. Hardy,,2003-02-14,298,35,184.579,"Risk, Volatility, and Forecast Evaluation",risk/volatility,risk-volatility,"Positions Investment guarantees : modeling and risk management for equity-linked life insurance within Risk, Volatility, and Forecast Evaluation.",high citation signal (298); influential citation signal (35),Risk forecasts can fail under regime breaks and extreme events.; Choice of loss function strongly affects model rankings.; Citation counts do not prove suitability for a specific mandate or risk budget.,https://www.semanticscholar.org/paper/fe036100e59c4ba088edbb65791e492975343c76,https://www.semanticscholar.org/paper/fe036100e59c4ba088edbb65791e492975343c76,,,,,,167167206,Business; Economics; Mathematics,Review,investment management equity,1,citations=298; influential=35; investment validation signal; open PDF metadata; title trade matches=1; trade term matches=1,
951,47,47,2003,Do Stock Markets Penalise Environment-Unfriendly Behaviour ? Evidence from India,Shreekant Gupta,,,292,15,167.78,"General Finance, Surveys, and Trading Systems",metadata-ranked,stock-prediction,"Positions Do Stock Markets Penalise Environment-Unfriendly Behaviour ? Evidence from India within General Finance, Surveys, and Trading Systems.",high citation signal (292); influential citation signal (15),"Surveys and systems can dominate citations while empirical evidence remains mixed across markets.; Broad claims need careful mapping to data, costs, and investment horizons.; Metadata-driven ranking cannot replace expert reading of full papers and backtests.",https://www.semanticscholar.org/paper/088b67e82ea4c774d06221a9e6f6910521360f3e,https://www.semanticscholar.org/paper/088b67e82ea4c774d06221a9e6f6910521360f3e,,,,,,18964496,Economics; Environmental Science,,stock returns,1,citations=292; influential=15; open PDF metadata; title trade matches=1; trade term matches=1,
993,48,48,2003,Big Fish in Small Ponds: The Trading Behavior and Price Impact of Foreign Investors in Asian Emerging Equity Markets,Anthony Richards,,2003-12-10,282,36,184.753,Market Microstructure and High-Frequency Trading,metadata-ranked,high-frequency,Positions Big Fish in Small Ponds: The Trading Behavior and Price Impact of Foreign Investors in Asian Emerging Equity Markets within Market Microstructure and High-Frequency Trading.,high citation signal (282); influential citation signal (36),"High-frequency results depend heavily on market access, latency, fees, and order-book reconstruction quality.; Public metadata rarely reveals execution assumptions.; Short-horizon predictability can vanish when capacity and competition are considered.",https://doi.org/10.2139/SSRN.318025,https://www.semanticscholar.org/paper/c8b179bf93d0f74af2144708b7328257c239d184,,,10.2139/SSRN.318025,,,17016305,Business; Economics,,factor investing equity,1,citations=282; influential=36; open PDF metadata; title trade matches=3; trade term matches=3,
999,49,49,2003,Pairwise Preference Learning and Ranking,"Johannes Fürnkranz, Eyke Hüllermeier",European Conference on Machine Learning,2003-09-22,281,22,174.019,Machine Learning for Stock Prediction,machine-learning,machine-learning,Positions Pairwise Preference Learning and Ranking within Machine Learning for Stock Prediction.,high citation signal (281); influential citation signal (22); open-access PDF metadata,"Predictive accuracy may not translate into risk-adjusted returns after costs.; Feature leakage, survivorship bias, and nonstationarity are persistent concerns.; Metadata-driven screening cannot audit the exact train/test split.",https://doi.org/10.1007/978-3-540-39857-8_15,https://www.semanticscholar.org/paper/ea65c0cd0ccbd432f8a9c96a61caa62ce48f4a0b,https://link.springer.com/content/pdf/10.1007%2F978-3-540-39857-8_15.pdf,,10.1007/978-3-540-39857-8_15,,,4735672,Computer Science; Mathematics,JournalArticle; Conference,algorithmic trading,1,citations=281; influential=22; AI/ML method signal; open PDF metadata; trade term matches=1,
1065,50,50,2003,Chapter 15 Anomalies and market efficiency,G. Schwert,,,272,11,166.197,Behavioral Finance and Investor Decision-Making,metadata-ranked,behavioral-finance,Positions Chapter 15 Anomalies and market efficiency within Behavioral Finance and Investor Decision-Making.,high citation signal (272); influential citation signal (11),Behavioral mechanisms can be market-specific and time-varying.; Sentiment proxies may capture several confounded channels.; Trading implementation requires constraints beyond the behavioral explanation.,https://doi.org/10.1016/S1574-0102(03)01024-0,https://www.semanticscholar.org/paper/69b9a65c6589a3e2827bb0c885132b169f7808ba,,,10.1016/S1574-0102(03)01024-0,,,154257465,Economics,,asset pricing stock returns; market anomalies stock returns; market efficiency stock returns; stock returns,4,citations=272; influential=11; open PDF metadata; title trade matches=1; trade term matches=1; query hits=4,
1089,51,51,2003,Can We Learn to Beat the Best Stock,"A. Borodin, Ran El-Yaniv, Vincent Gogan",Neural Information Processing Systems,2003-12-09,268,47,183.28,"General Finance, Surveys, and Trading Systems",deep-learning,stock-prediction,A novel algorithm for actively trading stocks is presented.,high citation signal (268); influential citation signal (47); open-access PDF metadata,"Surveys and systems can dominate citations while empirical evidence remains mixed across markets.; Broad claims need careful mapping to data, costs, and investment horizons.; Metadata-driven ranking cannot replace expert reading of full papers and backtests.",https://doi.org/10.1613/jair.1336,https://www.semanticscholar.org/paper/d349d159ce4ff9afcb8b076188997dcce439ea95,https://jair.org/index.php/jair/article/download/10380/24854,,10.1613/jair.1336,1107.0036,,554439,Business; Computer Science; Economics; Mathematics,JournalArticle; Conference,algorithmic trading,1,citations=268; influential=47; AI/ML method signal; open PDF metadata; trade term matches=1,"A novel algorithm for actively trading stocks is presented. While traditional universal algorithms (and technical trading heuristics) attempt to predict winners or trends, our approach relies on predictable statistical relations between all pairs of stocks in the market. Our empirical results on historical markets provide strong evidence that this type of technical trading can ""beat the market"" and moreover, can beat the best stock in the market. In doing so we utilize a new idea for smoothing critical parameters in the context of expert learning."
1098,52,52,2003,Anomalies: The Law of One Price in Financial Markets,"O. Lamont, R. Thaler",,2003-11-01,267,10,163.572,"General Finance, Surveys, and Trading Systems",metadata-ranked,stock-prediction,"Positions Anomalies: The Law of One Price in Financial Markets within General Finance, Surveys, and Trading Systems.",high citation signal (267); influential citation signal (10); open-access PDF metadata,"Surveys and systems can dominate citations while empirical evidence remains mixed across markets.; Broad claims need careful mapping to data, costs, and investment horizons.; Metadata-driven ranking cannot replace expert reading of full papers and backtests.",https://doi.org/10.1257/089533003772034952,https://www.semanticscholar.org/paper/44d4b89f22cf45427706e1ae5c390b54b506e6a1,https://www.aeaweb.org/articles/pdf/doi/10.1257/089533003772034952,,10.1257/089533003772034952,,,14136767,Economics; Law,,securities market,1,citations=267; influential=10; open PDF metadata; title trade matches=2; trade term matches=2,
1107,53,53,2003,Adding it up: the benefits of investing in sexual and reproductive health care,"S. Singh, Darroch Je, M. Vlassoff, J. Nadeau",,,265,7,155.949,"General Finance, Surveys, and Trading Systems",metadata-ranked,stock-prediction,"Positions Adding it up: the benefits of investing in sexual and reproductive health care within General Finance, Surveys, and Trading Systems.",high citation signal (265),"Surveys and systems can dominate citations while empirical evidence remains mixed across markets.; Broad claims need careful mapping to data, costs, and investment horizons.; Metadata-driven ranking cannot replace expert reading of full papers and backtests.",https://www.semanticscholar.org/paper/565f407b9c0f7e33fbe5d4d49af1d8fb200fc6f9,https://www.semanticscholar.org/paper/565f407b9c0f7e33fbe5d4d49af1d8fb200fc6f9,,,,,,46677167,Economics; Medicine; Political Science,,equity returns,1,citations=265; influential=7; open PDF metadata; title trade matches=1; trade term matches=1,
1154,54,54,2003,"Weather, Stock Returns, and the Impact of Localized Trading Behavior","Tim Loughran, P. Schultz",Journal of Financial and Quantitative Analysis,2003-05-26,258,21,185.525,"General Finance, Surveys, and Trading Systems",metadata-ranked,stock-prediction,"Positions Weather, Stock Returns, and the Impact of Localized Trading Behavior within General Finance, Surveys, and Trading Systems.",high citation signal (258); influential citation signal (21); recognized finance/AI venue,"Surveys and systems can dominate citations while empirical evidence remains mixed across markets.; Broad claims need careful mapping to data, costs, and investment horizons.; Metadata-driven ranking cannot replace expert reading of full papers and backtests.",https://doi.org/10.1017/S0022109000003100,https://www.semanticscholar.org/paper/759b6ea2669bdbcfbd2005f367a344476180707e,,,10.1017/S0022109000003100,,,96483559,Business; Economics,,stock returns,1,citations=258; influential=21; recognized finance/AI venue; open PDF metadata; title trade matches=3; trade term matches=3,
1236,55,55,2003,Can one make any crash prediction in finance using the local Hurst exponent idea,"D. Grech, Z. Mazur",,2003-11-27,245,13,165.064,"General Finance, Surveys, and Trading Systems",forecasting,stock-prediction,We apply the Hurst exponent idea for investigation of DJIA index time-series data.,high citation signal (245); influential citation signal (13); open-access PDF metadata,"Surveys and systems can dominate citations while empirical evidence remains mixed across markets.; Broad claims need careful mapping to data, costs, and investment horizons.; Metadata-driven ranking cannot replace expert reading of full papers and backtests.",https://doi.org/10.1016/j.physa.2004.01.018,https://www.semanticscholar.org/paper/66f88016f7b8b2cbcde3a712bc2cb3aa1943d77c,https://arxiv.org/pdf/cond-mat/0311627,,10.1016/j.physa.2004.01.018,cond-mat/0311627,,17097176,Economics; Mathematics; Physics,,financial market prediction; stock market prediction,2,citations=245; influential=13; open PDF metadata; title trade matches=1; trade term matches=2; query hits=2,"We apply the Hurst exponent idea for investigation of DJIA index time-series data. The behavior of the local Hurst exponent prior to drastic changes in financial series signal is analyzed. The optimal length of the time-window over which this exponent can be calculated in order to make some meaningful predictions is discussed. Our prediction hypothesis is verified with examples of 1929 and 1987 crashes, as well as with more recent phenomena in stock market from the period 1995 to 2003. Some interesting agreements are found."
1256,56,56,2003,Diversification Benefits of Emerging Markets Subject to Portfolio Constraints,"Kai Li, Asani Sarkar, Zhenyu Wang",,2003-06-06,242,8,160.608,Portfolio Optimization and Asset Allocation,portfolio,portfolio,Positions Diversification Benefits of Emerging Markets Subject to Portfolio Constraints within Portfolio Optimization and Asset Allocation.,high citation signal (242),"Allocation gains can be dominated by estimation error, turnover, short-sale constraints, and benchmark choice.; Backtests may hide capacity and liquidity limits.; Metadata cannot confirm implementation details such as costs, leverage, or rebalancing rules.",https://doi.org/10.1016/S0927-5398(02)00027-0,https://www.semanticscholar.org/paper/1f6b449dabe179a26ba4e6d5098c0e52876ff2a7,,,10.1016/S0927-5398(02)00027-0,,,8533576,Business; Economics,,securities market,1,citations=242; influential=8; investment validation signal; open PDF metadata; title trade matches=1; trade term matches=1,
1275,57,57,2003,Predicting Emerging Market Currency Crashes,"Manmohan S. Kumar, U. Moorthy, W. Perraudin",Social Science Research Network,2003-09-01,239,10,162.145,"Risk, Volatility, and Forecast Evaluation",forecasting,risk-volatility,This paper assesses the extent to which crashes in emerging market currencies are predictable using simple logit models based on lagged macroeconomic and financial data.,high citation signal (239); influential citation signal (10); open-access PDF metadata,Risk forecasts can fail under regime breaks and extreme events.; Choice of loss function strongly affects model rankings.; Citation counts do not prove suitability for a specific mandate or risk budget.,https://doi.org/10.1016/S0927-5398(02)00068-3,https://www.semanticscholar.org/paper/705bb665ec1d1bdda8fc4269204de6116fd50c5f,https://www.elibrary.imf.org/downloadpdf/view/journals/001/2002/007/001.2002.issue-007-en.pdf,,10.1016/S0927-5398(02)00068-3,,,153618875,Economics,,financial market prediction,1,citations=239; influential=10; investment validation signal; open PDF metadata; trade term matches=2,"This paper assesses the extent to which crashes in emerging market currencies are predictable using simple logit models based on lagged macroeconomic and financial data. To evaluate our model, we calculate trading strategies in which an investor goes long or short in the currency depending on whether crash probabilities are low or high. When we estimate the model on part of the data and then use the parameter estimates to generate predictions for the remainder of the sample, we find that substantial profits may be made. Furthermore, the model correctly forecasts major crashes even on an out-of-sample basis."
