rank,yearRank,candidateRank,year,title,authors,venue,publicationDate,citationCount,influentialCitationCount,importanceScore,category,methodTags,keywordTags,keyIdea,strengths,limitations,url,semanticScholarUrl,openAccessPdf,githubUrl,doi,arxiv,pubmed,corpusId,fieldsOfStudy,publicationTypes,sourceQueries,queryHitCount,importanceReasons,abstract
579,21,31,2015,The Long-Term Effects of Hedge Fund Activism,"L. Bebchuk, Alon Brav, Wei Jiang",,2015-06-01,333,32,180.796,"General Finance, Surveys, and Trading Systems",metadata-ranked,stock-prediction,"Positions The Long-Term Effects of Hedge Fund Activism within General Finance, Surveys, and Trading Systems.",high citation signal (333); influential citation signal (32); open-access PDF metadata,"Surveys and systems can dominate citations while empirical evidence remains mixed across markets.; Broad claims need careful mapping to data, costs, and investment horizons.; Metadata-driven ranking cannot replace expert reading of full papers and backtests.",https://doi.org/10.2139/SSRN.2291577,https://www.semanticscholar.org/paper/b3904122026827ecb96b855215e16f2b23aba243,http://www.nber.org/papers/w21227.pdf,,10.2139/SSRN.2291577,,,6076725,Business; Economics,,stock returns,1,citations=333; influential=32; open PDF metadata; title trade matches=1; trade term matches=1,
657,22,32,2015,World gold prices and stock returns in China: Insights for hedging and diversification strategies,"Mohamed Arouri, Amine Lahiani, D. K. Nguyen",,,309,27,182.855,Asset Pricing and Return Predictability,metadata-ranked,asset-pricing,Positions World gold prices and stock returns in China: Insights for hedging and diversification strategies within Asset Pricing and Return Predictability.,high citation signal (309); influential citation signal (27); open-access PDF metadata,"Return predictability can disappear after transaction costs, crowding, and multiple-testing correction.; Citation impact can favor well-known anomalies even when live performance later weakens.; Metadata cannot verify whether data-snooping controls were adequate.",https://doi.org/10.1016/J.ECONMOD.2014.10.030,https://www.semanticscholar.org/paper/238eea2b3ef7e8ff792eb303820980ce5602d28e,https://faculty-research.ipag.edu/wp-content/uploads/recherche/WP/IPAG_WP_2014_110.pdf,,10.1016/J.ECONMOD.2014.10.030,,,15442482,Economics,,asset pricing stock returns; stock returns; volatility forecasting stock market,3,citations=309; influential=27; open PDF metadata; title trade matches=2; trade term matches=2; query hits=3,
689,23,33,2015,Testing for Predictability in Conditionally Heteroskedastic Stock Returns,"J. Westerlund, P. Narayan",,2015-03-01,296,23,176.755,Asset Pricing and Return Predictability,forecasting,stock-prediction,Positions Testing for Predictability in Conditionally Heteroskedastic Stock Returns within Asset Pricing and Return Predictability.,high citation signal (296); influential citation signal (23),"Return predictability can disappear after transaction costs, crowding, and multiple-testing correction.; Citation impact can favor well-known anomalies even when live performance later weakens.; Metadata cannot verify whether data-snooping controls were adequate.",https://doi.org/10.1093/JJFINEC/NBU001,https://www.semanticscholar.org/paper/6e81397f6ea440dfac40ed64178a5399c3130fec,,,10.1093/JJFINEC/NBU001,,,154947822,Business; Economics,,stock returns,1,citations=296; influential=23; open PDF metadata; title trade matches=2; trade term matches=2,
727,24,34,2015,"Weather-Induced Mood, Institutional Investors, and Stock Returns","William N. Goetzmann, Dasol Kim, Alok Kumar, Qin Wang",,,284,15,170.171,Asset Pricing and Return Predictability,metadata-ranked,asset-pricing,"Positions Weather-Induced Mood, Institutional Investors, and Stock Returns within Asset Pricing and Return Predictability.",high citation signal (284); influential citation signal (15),"Return predictability can disappear after transaction costs, crowding, and multiple-testing correction.; Citation impact can favor well-known anomalies even when live performance later weakens.; Metadata cannot verify whether data-snooping controls were adequate.",https://doi.org/10.1093/RFS/HHU063,https://www.semanticscholar.org/paper/e52501c3a6a38ad66cc80102ba9ec45ae70917dc,,,10.1093/RFS/HHU063,,,55034468,Economics,Review,stock returns,1,citations=284; influential=15; open PDF metadata; title trade matches=2; trade term matches=2,
733,25,35,2015,Asset Purchase Programmes and Financial Markets: Lessons from the Euro Area,"Carlo Altavilla, Giacomo Carboni, Roberto Motto",Social Science Research Network,2015-11-01,283,48,190.763,"Risk, Volatility, and Forecast Evaluation",risk/volatility,risk-volatility,We evaluate the effects on asset prices of the ECB asset purchase programme (APP) announced in January 2015 and assess its main transmission channels.,high citation signal (283); influential citation signal (48); open-access PDF metadata,Risk forecasts can fail under regime breaks and extreme events.; Choice of loss function strongly affects model rankings.; Citation counts do not prove suitability for a specific mandate or risk budget.,https://doi.org/10.2139/ssrn.2717398,https://www.semanticscholar.org/paper/78fc6a28f2c1dcd77acf8e1d2cc6730c06cdf9df,https://www.econstor.eu/bitstream/10419/154297/1/ecbwp1864.pdf,,10.2139/ssrn.2717398,,,39097686,Economics,,financial market prediction,1,citations=283; influential=48; investment validation signal; open PDF metadata; title trade matches=2; trade term matches=2,"We evaluate the effects on asset prices of the ECB asset purchase programme (APP) announced in January 2015 and assess its main transmission channels. We do so by first extending a term structure model with bond supply effects to account for assets with different types of risk premia. We then derive model-based predictions for cross-asset price movements associated with the transmission channels identified in the model. We finally validate empirically these predictions by means of an event- study methodology, reaching the following conclusions: The impact of the APP on asset prices is sizeable albeit the programme was announced at a time of low financial distress. This may appear puzzling in light of existing literature that finds a large impact of asset purchases only in periods of high financial distress. Consistent with the model, we explain this apparent puzzle by showing how the low financial distress, while indeed weakening certain transmission channels, has reinforced other channels because of its interplay with the asset composition of the programme. Targeting assets at long maturity and spanning the investment-grade space have supported the duration and the credit channels. At the same time, the low degree of financial stress prevailing at announcement of the programme, while weakening the local supply channel, has facilitated spill-overs to non-targeted assets. JEL Classification: E43, E44, E52, E58, E65, G14"
735,26,36,2015,The multi-layer network nature of systemic risk and its implications for the costs of financial crises,"S. Poledna, José Luis Molina-Borboa, Seraf'in Mart'inez-Jaramillo, M. V. D. Leij, S. Thurner",,2015-05-16,283,6,158.52,"Risk, Volatility, and Forecast Evaluation",asset-pricing; risk/volatility,risk-volatility; asset-pricing,The inability to see and quantify systemic financial risk comes at an immense social cost.,high citation signal (283); open-access PDF metadata,Risk forecasts can fail under regime breaks and extreme events.; Choice of loss function strongly affects model rankings.; Citation counts do not prove suitability for a specific mandate or risk budget.,https://doi.org/10.1016/J.JFS.2015.08.001,https://www.semanticscholar.org/paper/c2ec11bdc89c107858fd61e1912828083090801a,http://pure.iiasa.ac.at/id/eprint/11393/1/The%20multilayer%20network%20nature%20of%20systemic%20risk.pdf,,10.1016/J.JFS.2015.08.001,1505.04276,,5737691,Business; Economics,,securities market,1,citations=283; influential=6; investment validation signal; open PDF metadata; trade term matches=1,"The inability to see and quantify systemic financial risk comes at an immense social cost. Systemic risk in the financial system arises to a large extent as a consequence of the interconnectedness of its institutions, which are linked through networks of different types of financial contracts, such as credit, derivatives, foreign exchange, and securities. The interplay of the various exposure networks can be represented as layers in a financial multi-layer network. In this work we quantify the daily contributions to systemic risk from four layers of the Mexican banking system from 2007 to 2013. We show that focusing on a single layer underestimates the total systemic risk by up to 90%. By assigning systemic risk levels to individual banks we study the systemic risk profile of the Mexican banking system on all market layers. This profile can be used to quantify systemic risk on a national level in terms of nation-wide expected systemic losses. We show that market-based systemic risk indicators systematically underestimate expected systemic losses. We find that expected systemic losses are up to a factor of four higher now than before the financial crisis of 2007–2008. We find that systemic risk contributions of individual transactions can be up to a factor of one thousand higher than the corresponding credit risk, which creates huge risks for the public. We find an intriguing non-linear effect whereby the sum of systemic risk of all layers underestimates the total risk. The method presented here is the first objective data-driven quantification of systemic risk on national scales that reveal its true levels."
761,27,38,2015,"Market-Wide Attention, Trading, and Stock Returns",Yu Yuan,,2015-02-24,276,15,172.545,Deep Learning and Financial Time Series,deep-learning,deep-learning; behavioral-finance,"Positions Market-Wide Attention, Trading, and Stock Returns within Deep Learning and Financial Time Series.",high citation signal (276); influential citation signal (15),"Deep models can overfit noisy, nonstationary, and low signal-to-noise market data.; Compute-heavy models may be hard to reproduce without code and data access.; Reported gains need robustness checks across regimes and markets.",https://doi.org/10.1016/J.JFINECO.2015.03.006,https://www.semanticscholar.org/paper/acc7b16d10c2095ba05d40036762f0b63aa5e448,,,10.1016/J.JFINECO.2015.03.006,,,154275365,Business; Economics,,stock returns,1,citations=276; influential=15; open PDF metadata; title trade matches=3; trade term matches=3,
806,28,40,2015,International Evidence on Algorithmic Trading,"Ekkehart Boehmer, Kingsley Y. Fong, Julie Wu",,2015-09-17,268,22,173.981,Reinforcement Learning and Algorithmic Trading,metadata-ranked,reinforcement-trading,Positions International Evidence on Algorithmic Trading within Reinforcement Learning and Algorithmic Trading.,high citation signal (268); influential citation signal (22),"Simulated rewards can diverge from executable trading under slippage, latency, and market impact.; Policies can be brittle during regime shifts or stress periods.; Backtest-only evidence needs live or paper-trading validation.",https://doi.org/10.2139/SSRN.2022034,https://www.semanticscholar.org/paper/2dde378b30aa5acadbfed3ee3483a512f547a6d9,,,10.2139/SSRN.2022034,,,167761226,Business; Economics,,algorithmic trading,1,citations=268; influential=22; open PDF metadata; title trade matches=2; trade term matches=2,
818,29,41,2015,"Global, Local, and Contagious Investor Sentiment this access benefits you. Your story matters",Malcolm P. Baker,,,264,22,173.651,"Sentiment, News, and Alternative Data",sentiment/text,sentiment-altdata; behavioral-finance,"Positions Global, Local, and Contagious Investor Sentiment this access benefits you. Your story matters within Sentiment, News, and Alternative Data.",high citation signal (264); influential citation signal (22),Timestamp alignment and look-ahead bias are critical for text and alternative-data studies.; Sentiment signals can decay quickly as information becomes crowded.; Data licensing and coverage bias can limit reproducibility.,https://www.semanticscholar.org/paper/6f5fa22fcb50dad5be6108942722f0668ed83a4e,https://www.semanticscholar.org/paper/6f5fa22fcb50dad5be6108942722f0668ed83a4e,,,,,,251383988,Economics,,investor sentiment stock returns; stock returns; value investing stock market,3,citations=264; influential=22; open PDF metadata; title trade matches=1; trade term matches=1; query hits=3,
881,30,45,2015,Bank Bias in Europe: Effects on Systemic Risk and Growth,"Sam Langfield, M. Pagano",Social Science Research Network,2015-06-30,250,14,166.473,Reinforcement Learning and Algorithmic Trading,reinforcement-learning; risk/volatility,reinforcement-trading; risk-volatility,Europe’s financial structure has become strongly bank-based–far more so than in other economies.,high citation signal (250); influential citation signal (14); open-access PDF metadata,"Simulated rewards can diverge from executable trading under slippage, latency, and market impact.; Policies can be brittle during regime shifts or stress periods.; Backtest-only evidence needs live or paper-trading validation.",https://doi.org/10.1093/EPOLIC/EIV019,https://www.semanticscholar.org/paper/eb85ae0bb441b48797a20335f15e10734a8cd2d1,http://www.csef.it/WP/wp408.pdf,,10.1093/EPOLIC/EIV019,,,37412229,Economics,,securities market,1,citations=250; influential=14; investment validation signal; open PDF metadata; trade term matches=1,"Europe’s financial structure has become strongly bank-based–far more so than in other economies. We document that an increase in the size of the banking system relative to equity and private bond markets is associated with more systemic risk and lower economic growth, particularly during housing market crises. We argue that these two phenomena arise owing to an amplification mechanism, by which banks overextend and misallocate credit when asset prices rise, and ration it when they drop. The paper concludes by discussing policy solutions to Europe’s ‘bank bias’, which include reducing regulatory favouritism towards banks, while simultaneously supporting the development of securities markets."
885,31,46,2015,Forecasting Stock Returns under Economic Constraints,Butt Man-Kit,,2015-04-01,249,16,171.137,Asset Pricing and Return Predictability,metadata-ranked,asset-pricing,Positions Forecasting Stock Returns under Economic Constraints within Asset Pricing and Return Predictability.,high citation signal (249); influential citation signal (16),"Return predictability can disappear after transaction costs, crowding, and multiple-testing correction.; Citation impact can favor well-known anomalies even when live performance later weakens.; Metadata cannot verify whether data-snooping controls were adequate.",https://doi.org/10.2469/dig.v45.n4.6,https://www.semanticscholar.org/paper/8fea75da5e9b08582c19cc01b6eee1b584ef536c,,,10.2469/dig.v45.n4.6,,,157867556,Business; Economics,,stock returns,1,citations=249; influential=16; open PDF metadata; title trade matches=3; trade term matches=3,
943,32,47,2015,"Do Strict Capital Requirements Raise the Cost of Capital? Bank Regulation, Capital Structure and the Low Risk Anomaly","Malcolm P. Baker, Jeffrey Wurgler",,2015-03-13,237,18,174.612,"Risk, Volatility, and Forecast Evaluation",asset-pricing; risk/volatility,stock-prediction; risk-volatility; asset-pricing,"Traditional capital structure theory predicts that reducing banks' leverage reduces the risk and cost of equity but does not change the weighted average cost of capital, and thus the rates for borrowers.",high citation signal (237); influential citation signal (18); open-access PDF metadata,Risk forecasts can fail under regime breaks and extreme events.; Choice of loss function strongly affects model rankings.; Citation counts do not prove suitability for a specific mandate or risk budget.,https://doi.org/10.1257/AER.P20151092,https://www.semanticscholar.org/paper/eb747c3c025ae436beeded0b3d3fb5832e6b91b3,https://dash.harvard.edu/bitstream/1/16388336/1/baker-m%2cwurgler_do-strict-capital-requirements_AERPP%20v7.pdf,,10.1257/AER.P20151092,,,26321782,Business; Economics,,equity returns; market anomalies stock returns; stock returns,3,citations=237; influential=18; investment validation signal; open PDF metadata; trade term matches=4; query hits=3,"Traditional capital structure theory predicts that reducing banks' leverage reduces the risk and cost of equity but does not change the weighted average cost of capital, and thus the rates for borrowers. We confirm that the equity of better-capitalized banks has lower beta and idiosyncratic risk. However, over the last 40 years, lower risk banks have not had lower costs of equity (lower stock returns), consistent with a stock market anomaly previously documented in other samples. A calibration suggests that a binding ten percentage point increase in Tier 1 capital to risk-weighted assets could double banks' risk premia over Treasury bills."
951,33,49,2015,A hybrid fuzzy time series model based on granular computing for stock price forecasting,"Mu-Yen Chen, Bo-Tsuen Chen",Information Sciences,2015-02-10,236,11,164.086,"General Finance, Surveys, and Trading Systems",metadata-ranked,stock-prediction,"Positions A hybrid fuzzy time series model based on granular computing for stock price forecasting within General Finance, Surveys, and Trading Systems.",high citation signal (236); influential citation signal (11),"Surveys and systems can dominate citations while empirical evidence remains mixed across markets.; Broad claims need careful mapping to data, costs, and investment horizons.; Metadata-driven ranking cannot replace expert reading of full papers and backtests.",https://doi.org/10.1016/j.ins.2014.09.038,https://www.semanticscholar.org/paper/f1aba3862a0cdce6ce7ff2f0c16e989d3860f864,,,10.1016/j.ins.2014.09.038,,,39260423,Business; Computer Science,JournalArticle,stock market prediction; stock price prediction,2,citations=236; influential=11; open PDF metadata; title trade matches=2; trade term matches=2; query hits=2,
970,34,50,2015,Oil price and stock returns of consumers and producers of crude oil,"D. Phan, S. Sharma, P. Narayan",,,232,7,156.035,Asset Pricing and Return Predictability,metadata-ranked,asset-pricing,Positions Oil price and stock returns of consumers and producers of crude oil within Asset Pricing and Return Predictability.,high citation signal (232),"Return predictability can disappear after transaction costs, crowding, and multiple-testing correction.; Citation impact can favor well-known anomalies even when live performance later weakens.; Metadata cannot verify whether data-snooping controls were adequate.",https://doi.org/10.1016/J.INTFIN.2014.11.010,https://www.semanticscholar.org/paper/7b4701fe9f6f9606897d87959d3554f61086b5d4,,,10.1016/J.INTFIN.2014.11.010,,,153814732,Economics,,stock returns,1,citations=232; influential=7; open PDF metadata; title trade matches=2; trade term matches=2,
981,35,51,2015,"Product Market Power and Tax Avoidance: Market Leaders, Mimicking Strategies, and Stock Returns","Thomas R. Kubick, Dan Lynch, Michael A. Mayberry, Thomas C. Omer",,2015-03-01,231,12,162.738,Asset Pricing and Return Predictability,metadata-ranked,asset-pricing,"Positions Product Market Power and Tax Avoidance: Market Leaders, Mimicking Strategies, and Stock Returns within Asset Pricing and Return Predictability.",high citation signal (231); influential citation signal (12),"Return predictability can disappear after transaction costs, crowding, and multiple-testing correction.; Citation impact can favor well-known anomalies even when live performance later weakens.; Metadata cannot verify whether data-snooping controls were adequate.",https://doi.org/10.2308/ACCR-50883,https://www.semanticscholar.org/paper/891444bd9d8e9666d378561f478ceccfd6526874,,,10.2308/ACCR-50883,,,220455682,Business; Economics,,stock returns,1,citations=231; influential=12; open PDF metadata; title trade matches=2; trade term matches=2,
985,36,53,2015,Topic Modeling based Sentiment Analysis on Social Media for Stock Market Prediction,"Thien Hai Nguyen, Kiyoaki Shirai",Annual Meeting of the Association for Computational Linguistics,2015-07-01,230,10,163.304,"Sentiment, News, and Alternative Data",forecasting; sentiment/text,stock-prediction; sentiment-altdata,The goal of this research is to build a model to predict stock price movement using sentiments on social media.,high citation signal (230); influential citation signal (10); open-access PDF metadata,Timestamp alignment and look-ahead bias are critical for text and alternative-data studies.; Sentiment signals can decay quickly as information becomes crowded.; Data licensing and coverage bias can limit reproducibility.,https://doi.org/10.3115/v1/P15-1131,https://www.semanticscholar.org/paper/1ba5630508f1d562c19869462baebbde7e39748d,https://aclanthology.org/P15-1131.pdf,,10.3115/v1/P15-1131,,,2060590,Business; Computer Science,JournalArticle; Conference,stock market prediction; stock price prediction,2,citations=230; influential=10; open PDF metadata; title trade matches=2; trade term matches=3; query hits=2,"The goal of this research is to build a model to predict stock price movement using sentiments on social media. A new feature which captures topics and their sentiments simultaneously is introduced in the prediction model. In addition, a new topic model TSLDA is proposed to obtain this feature. Our method outperformed a model using only historical prices by about 6.07% in accuracy. Furthermore, when comparing to other sentiment analysis methods, the accuracy of our method was also better than LDA and JST based methods by 6.43% and 6.07%. The results show that incorporation of the sentiment information from social media can help to improve the stock prediction."
989,37,54,2015,Gold price volatility: A forecasting approach using the Artificial Neural Network-GARCH model,"Werner D. Kristjanpoller, Marcel C. Minutolo",Expert systems with applications,2015-11-15,229,10,185.208,"Risk, Volatility, and Forecast Evaluation",deep-learning; risk/volatility,deep-learning; risk-volatility,"Positions Gold price volatility: A forecasting approach using the Artificial Neural Network-GARCH model within Risk, Volatility, and Forecast Evaluation.",high citation signal (229); influential citation signal (10); recognized finance/AI venue,Risk forecasts can fail under regime breaks and extreme events.; Choice of loss function strongly affects model rankings.; Citation counts do not prove suitability for a specific mandate or risk budget.,https://doi.org/10.1016/j.eswa.2015.04.058,https://www.semanticscholar.org/paper/00b9738be9f5a6a1fc4acb2afaf6d1c905d6df41,,,10.1016/j.eswa.2015.04.058,,,6407565,Business; Computer Science; Economics,JournalArticle,financial market prediction; neural networks stock market; stock market prediction; stock price prediction; stock return prediction; volatility forecasting stock market,6,citations=229; influential=10; recognized finance/AI venue; investment validation signal; AI/ML method signal; open PDF metadata; title trade matches=2; trade term matches=2; query hits=6,
1019,38,56,2015,The Effects of Twitter Sentiment on Stock Price Returns,"Gabriele Ranco, Darko Aleksovski, Guido Caldarelli, Miha Grcar, I. Mozetič",PLoS ONE,2015-06-08,224,8,159.915,"Sentiment, News, and Alternative Data",sentiment/text,stock-prediction; sentiment-altdata,Social media are increasingly reflecting and influencing behavior of other complex systems.,high citation signal (224); open-access PDF metadata,Timestamp alignment and look-ahead bias are critical for text and alternative-data studies.; Sentiment signals can decay quickly as information becomes crowded.; Data licensing and coverage bias can limit reproducibility.,https://doi.org/10.1371/journal.pone.0138441,https://www.semanticscholar.org/paper/d04aae128064fa2e98a7de280cab9012cce12117,https://journals.plos.org/plosone/article/file?id=10.1371/journal.pone.0138441&type=printable,,10.1371/journal.pone.0138441,1506.02431,26390434,263784660,Business; Computer Science; Economics; Medicine,JournalArticle,financial economics stock market; stock returns,2,citations=224; influential=8; open PDF metadata; title trade matches=1; trade term matches=5; query hits=2,"Social media are increasingly reflecting and influencing behavior of other complex systems. In this paper we investigate the relations between a well-known micro-blogging platform Twitter and financial markets. In particular, we consider, in a period of 15 months, the Twitter volume and sentiment about the 30 stock companies that form the Dow Jones Industrial Average (DJIA) index. We find a relatively low Pearson correlation and Granger causality between the corresponding time series over the entire time period. However, we find a significant dependence between the Twitter sentiment and abnormal returns during the peaks of Twitter volume. This is valid not only for the expected Twitter volume peaks (e.g., quarterly announcements), but also for peaks corresponding to less obvious events. We formalize the procedure by adapting the well-known “event study” from economics and finance to the analysis of Twitter data. The procedure allows to automatically identify events as Twitter volume peaks, to compute the prevailing sentiment (positive or negative) expressed in tweets at these peaks, and finally to apply the “event study” methodology to relate them to stock returns. We show that sentiment polarity of Twitter peaks implies the direction of cumulative abnormal returns. The amount of cumulative abnormal returns is relatively low (about 1–2%), but the dependence is statistically significant for several days after the events."
