rank,yearRank,candidateRank,year,title,authors,venue,publicationDate,citationCount,influentialCitationCount,importanceScore,category,methodTags,keywordTags,keyIdea,strengths,limitations,url,semanticScholarUrl,openAccessPdf,githubUrl,doi,arxiv,pubmed,corpusId,fieldsOfStudy,publicationTypes,sourceQueries,queryHitCount,importanceReasons,abstract
767,21,42,2018,Forecasting stock market crisis events using deep and statistical machine learning techniques,"S. Chatzis, Vasilis Siakoulis, Anastasios Petropoulos, Evangelos Stavroulakis, Nikos E. Vlachogiannakis",Expert systems with applications,2018-12-01,275,13,202.596,Reinforcement Learning and Algorithmic Trading,machine-learning; deep-learning; reinforcement-learning; risk/volatility,stock-prediction; machine-learning; deep-learning; ai-based-trade; reinforcement-trading; risk-volatility,Abstract This work contributes to this ongoing debate on the nature and the characteristics of propagation channels of crash events in international stock markets.,high citation signal (275); influential citation signal (13); recognized finance/AI venue,"Simulated rewards can diverge from executable trading under slippage, latency, and market impact.; Policies can be brittle during regime shifts or stress periods.; Backtest-only evidence needs live or paper-trading validation.",https://doi.org/10.1016/J.ESWA.2018.06.032,https://www.semanticscholar.org/paper/4739cd20cdb4fb88845ee404947173f4a53aed98,,,10.1016/J.ESWA.2018.06.032,,,52113244,Business; Computer Science; Economics,JournalArticle,financial time series forecasting; machine learning stock market; neural networks stock market; stock returns; volatility forecasting stock market,5,citations=275; influential=13; recognized finance/AI venue; survey/benchmark signal; investment validation signal; AI/ML method signal; open PDF metadata; title trade matches=3; trade term matches=6; query hits=5,"Abstract This work contributes to this ongoing debate on the nature and the characteristics of propagation channels of crash events in international stock markets. Specifically, we investigate transmission mechanisms across stock markets along with effects from bond and currency markets. Our approach comprises a solid forecasting mechanism of the probability of a stock market crash event in various time frames. The developed approach combines different machine learning algorithms which are presented with daily stock, bond and currency data from 39 countries that cover a large spectrum of economies. Specifically, we leverage the merits of a series of techniques including Classification Trees, Support Vector Machines, Random Forests, Neural Networks, Extreme Gradient Boosting, and Deep Neural Networks. To the best of our knowledge, this is the first time that Deep Learning and Boosting approaches are considered in the literature as a means of predicting stock market crisis episodes. The independent variables included in our data contain information regarding both the two fundamental linkage channels through which financial contagion can be initiated: returns and volatility. We apply a suite of machine learning algorithms for selecting the most relevant variables out of a large set of proposed ones. Finally, we employ bootstrap sampling for adjusting the imbalanced nature of the available fitting dataset. Our experimental results provide strong evidence that stock market crises tend to exhibit persistence. We also find significant evidence of interdependence and cross-contagion effects among stock, bond and currency markets. Finally, we show that the use of Deep Neural Networks significantly increases the classification accuracy, while offering a robust way to create a global systemic early warning tool that is more efficient and risk-sensitive than the currently established ones. Thus, central banks may use these tools to early adjust their monetary policy, so as to ensure financial stability."
777,22,43,2018,Stock price prediction using support vector regression on daily and up to the minute prices,"B. Henrique, Vinicius Amorim Sobreiro, H. Kimura",Journal of Finance and Data Science,2018-09-01,273,6,190.732,"Risk, Volatility, and Forecast Evaluation",forecasting; machine-learning; risk/volatility,stock-prediction; machine-learning; ai-based-trade; risk-volatility,Abstract The purpose of predictive stock price systems is to provide abnormal returns for financial market operators and serve as a basis for risk management tools.,high citation signal (273); recognized finance/AI venue; open-access PDF metadata,Risk forecasts can fail under regime breaks and extreme events.; Choice of loss function strongly affects model rankings.; Citation counts do not prove suitability for a specific mandate or risk budget.,https://doi.org/10.1016/J.JFDS.2018.04.003,https://www.semanticscholar.org/paper/54845e5242a8ae04b1df1b942367684188ee096f,https://doi.org/10.1016/j.jfds.2018.04.003,,10.1016/J.JFDS.2018.04.003,,,158197588,Business; Computer Science,,algorithmic trading; financial market prediction; machine learning stock market; stock market prediction; stock price prediction; stock returns; support vector machine stock prediction; trading strategies stock market,8,citations=273; influential=6; recognized finance/AI venue; investment validation signal; AI/ML method signal; open PDF metadata; title trade matches=3; trade term matches=8; query hits=8,"Abstract The purpose of predictive stock price systems is to provide abnormal returns for financial market operators and serve as a basis for risk management tools. Although the Efficient Market Hypothesis (EMH) states that it is not possible to anticipate market movements consistently, the use of computationally intensive systems that employ machine learning algorithms is increasingly common in the development of stock trading mechanisms. Several studies, using daily stock prices, have presented predictive system applications trained on fixed periods without considering new model updates. In this context, this study uses a machine learning technique called Support Vector Regression (SVR) to predict stock prices for large and small capitalisations and in three different markets, employing prices with both daily and up-to-the-minute frequencies. Prediction errors are measured, and the model is compared to the random walk model proposed by the EMH. The results suggest that the SVR has predictive power, especially when using a strategy of updating the model periodically. There are also indicative results of increased predictions precision during lower volatility periods."
778,23,44,2018,Monetary Policy and Bank Profitability in a Low Interest Rate Environment,"Carlo Altavilla, Miguel Boucinha, J. Peydró",Economic Policy,2018-10-01,272,33,181.777,Market Microstructure and High-Frequency Trading,reinforcement-learning; microstructure; risk/volatility,reinforcement-trading; high-frequency; risk-volatility,We analyse the impact of standard and non-standard monetary policy measures on bank profitability.,high citation signal (272); influential citation signal (33); open-access PDF metadata,"High-frequency results depend heavily on market access, latency, fees, and order-book reconstruction quality.; Public metadata rarely reveals execution assumptions.; Short-horizon predictability can vanish when capacity and competition are considered.",https://doi.org/10.1093/EPOLIC/EIY013,https://www.semanticscholar.org/paper/7ecf6a6e1257e1b44f14c4fab78d4fd5666e8bb7,https://academic.oup.com/economicpolicy/article-pdf/33/96/531/27012677/eiy013.pdf,,10.1093/EPOLIC/EIY013,,,158381230,Economics,,stock returns,1,citations=272; influential=33; investment validation signal; open PDF metadata; trade term matches=3,"We analyse the impact of standard and non-standard monetary policy measures on bank profitability. For empirical identification, the analysis focuses on the euro area, thereby exploiting substantial bank and country heterogeneity within a monetary union where the central bank has implemented a broad range of unconventional policies, including quantitative easing and negative interest rates. We use both proprietary and commercial data on individual bank balance sheets and financial market prices. Our results show that monetary policy easing – a decrease in short-term interest rates and/or a flattening of the yield curve – is not associated with lower bank profits once we control for the endogeneity of the policy measures to expected macroeconomic and financial conditions. Importantly, our analysis indicates that the main components of bank profitability are asymmetrically affected by accommodative monetary conditions, with a positive impact on loan loss provisions and non-interest income largely offsetting the negative one on net interest income. We also find that a protracted period of low interest rates might have a negative effect on profits that, however, only materialises after a long period of time and tends to be counterbalanced by improved macroeconomic conditions. In addition, while more operationally efficient banks benefit more from monetary policy easing, banks engaging more extensively in maturity transformation experience a higher increase in profitability after a steepening of the yield curve. Finally, we assess the impact of unconventional monetary policies on market-based measures of expected bank profitability and credit risk, by employing an event study analysis using high frequency data, and find that accommodative monetary policies tend to increase bank stock returns and reduce credit risk."
803,24,45,2018,Can economic policy uncertainty predict stock returns? Global evidence,"D. Phan, S. Sharma, V. Tran","Journal of international financial markets, institutions, and money",2018-07-01,269,5,158.25,Reinforcement Learning and Algorithmic Trading,forecasting; reinforcement-learning,stock-prediction; reinforcement-trading,"This paper, using data for 16 countries, tests whether economic policy uncertainty (EPU) predicts stock excess returns.",high citation signal (269),"Simulated rewards can diverge from executable trading under slippage, latency, and market impact.; Policies can be brittle during regime shifts or stress periods.; Backtest-only evidence needs live or paper-trading validation.",https://doi.org/10.1016/J.INTFIN.2018.04.004,https://www.semanticscholar.org/paper/aac3f20412e687b70753369227bfed7c2872277d,,,10.1016/J.INTFIN.2018.04.004,,,158241385,Economics,,stock returns,1,citations=269; influential=5; open PDF metadata; title trade matches=2; trade term matches=5,"This paper, using data for 16 countries, tests whether economic policy uncertainty (EPU) predicts stock excess returns. First, we show that the ability of EPU to forecast stock returns depends not only on the country used, but also on the sectors examined. This indicates that forecasting of returns is country-dependent (sector-dependent), suggesting that EPU is relatively more important for some countries (sectors) than others. Second, we test whether the predictability of EPU is from either or both the cash flow and discount rate channels. Our results support the discount rate channel over the cash flow channel. Third, we use positive and negative EPU shocks to predict stock excess returns and find evidence of asymmetric predictability. Finally, we consider a mean–variance investor and show that such investor has positive utility by following forecasts generated from the EPU-based model. Our results are consistent with a number of robustness tests."
821,25,47,2018,Genetic Algorithm-Optimized Long Short-Term Memory Network for Stock Market Prediction,"Hyejung Chung, K. Shin",Sustainability,2018-10-18,264,17,187.219,Deep Learning and Financial Time Series,forecasting; deep-learning,stock-prediction; deep-learning; ai-based-trade,"With recent advances in computing technology, massive amounts of data and information are being constantly accumulated.",high citation signal (264); influential citation signal (17); open-access PDF metadata,"Deep models can overfit noisy, nonstationary, and low signal-to-noise market data.; Compute-heavy models may be hard to reproduce without code and data access.; Reported gains need robustness checks across regimes and markets.",https://doi.org/10.3390/SU10103765,https://www.semanticscholar.org/paper/28363dcc7216ab000f4f4d3dc46420cfa8117233,https://www.mdpi.com/2071-1050/10/10/3765/pdf,,10.3390/SU10103765,,,55985472,Business; Computer Science,,deep learning stock prediction; financial market prediction; stock market prediction; stock price prediction,4,citations=264; influential=17; survey/benchmark signal; AI/ML method signal; open PDF metadata; title trade matches=2; trade term matches=6; query hits=4,"With recent advances in computing technology, massive amounts of data and information are being constantly accumulated. Especially in the field of finance, we have great opportunities to create useful insights by analyzing that information, because the financial market produces a tremendous amount of real-time data, including transaction records. Accordingly, this study intends to develop a novel stock market prediction model using the available financial data. We adopt deep learning technique because of its excellent learning ability from the massive dataset. In this study, we propose a hybrid approach integrating long short-term memory (LSTM) network and genetic algorithm (GA). Heretofore, trial and error based on heuristics is commonly used to estimate the time window size and architectural factors of LSTM network. This research investigates the temporal property of stock market data by suggesting a systematic method to determine the time window size and topology for the LSTM network using GA. To evaluate the proposed hybrid approach, we have chosen daily Korea Stock Price Index (KOSPI) data. The experimental result demonstrates that the hybrid model of LSTM network and GA outperforms the benchmark model."
822,26,48,2018,Long- and Short-Term Cryptocurrency Volatility Components: A GARCH-MIDAS Analysis,"Christian Conrad, A. Custovic, Eric Ghysels",,2018-05-06,264,2,148.135,"Risk, Volatility, and Forecast Evaluation",risk/volatility,stock-prediction; risk-volatility,We use the GARCH-MIDAS model to extract the long- and short-term volatility components of cryptocurrencies.,high citation signal (264); open-access PDF metadata,Risk forecasts can fail under regime breaks and extreme events.; Choice of loss function strongly affects model rankings.; Citation counts do not prove suitability for a specific mandate or risk budget.,https://doi.org/10.3390/JRFM11020023,https://www.semanticscholar.org/paper/2acf7458d9a3b3c4b1186ddc05bc0e4374cccb6c,https://www.mdpi.com/1911-8074/11/2/23/pdf,,10.3390/JRFM11020023,,,73666443,Business; Economics,,volatility forecasting stock market,1,citations=264; influential=2; investment validation signal; open PDF metadata; trade term matches=4,"We use the GARCH-MIDAS model to extract the long- and short-term volatility components of cryptocurrencies. As potential drivers of Bitcoin volatility, we consider measures of volatility and risk in the US stock market as well as a measure of global economic activity. We find that S&P 500 realized volatility has a negative and highly significant effect on long-term Bitcoin volatility. The finding is atypical for volatility co-movements across financial markets. Moreover, we find that the S&P 500 volatility risk premium has a significantly positive effect on long-term Bitcoin volatility. Finally, we find a strong positive association between the Baltic dry index and long-term Bitcoin volatility. This result shows that Bitcoin volatility is closely linked to global economic activity. Overall, our findings can be used to construct improved forecasts of long-term Bitcoin volatility."
830,27,49,2018,Stock Market Prediction Based on Generative Adversarial Network,"Kang Zhang, G. Zhong, Junyu Dong, Shengke Wang, Yong Wang","International Conference on Identification, Information, and Knowledge in the Internet of Things",,262,15,189.404,Reinforcement Learning and Algorithmic Trading,forecasting; portfolio; machine-learning; deep-learning,stock-prediction; machine-learning; deep-learning; ai-based-trade; portfolio; reinforcement-trading,Abstract Deep learning has recently achieved great success in many areas due to its strong capacity in data process.,high citation signal (262); influential citation signal (15); open-access PDF metadata,"Simulated rewards can diverge from executable trading under slippage, latency, and market impact.; Policies can be brittle during regime shifts or stress periods.; Backtest-only evidence needs live or paper-trading validation.",https://doi.org/10.1016/j.procs.2019.01.256,https://www.semanticscholar.org/paper/a38ec564218733eb3b7e34e2ae327c73ebb41cd3,https://doi.org/10.1016/j.procs.2019.01.256,,10.1016/j.procs.2019.01.256,,,62903780,Business; Computer Science,JournalArticle,deep learning stock prediction; financial market prediction; machine learning stock market; portfolio optimization stock market; stock market prediction; stock price prediction; trading strategies stock market,7,citations=262; influential=15; investment validation signal; AI/ML method signal; open PDF metadata; title trade matches=2; trade term matches=8; query hits=7,"Abstract Deep learning has recently achieved great success in many areas due to its strong capacity in data process. For instance, it has been widely used in financial areas such as stock market prediction, portfolio optimization, financial information processing and trade execution strategies. Stock market prediction is one of the most popular and valuable area in finance. In this paper, we propose a novel architecture of Generative Adversarial Network (GAN) with the Multi-Layer Perceptron (MLP) as the discriminator and the Long Short-Term Memory (LSTM) as the generator for forecasting the closing price of stocks. The generator is built by LSTM to mine the data distributions of stocks from given data in stock market and generate data in the same distributions, whereas the discriminator designed by MLP aims to discriminate the real stock data and generated data. We choose the daily data on S&P 500 Index and several stocks in a wide range of trading days and try to predict the daily closing price. Experimental results show that our novel GAN can get a promising performance in the closing price prediction on the real data compared with other models in machine learning and deep learning."
834,28,50,2018,Asymmetric impacts of oil price uncertainty on Chinese stock returns under different market conditions: Evidence from oil volatility index,"Jihong Xiao, Min Zhou, Fengming Wen, Fenghua Wen",Energy Economics,2018-08-01,262,3,153.996,"Risk, Volatility, and Forecast Evaluation",risk/volatility,risk-volatility,The crude oil volatility index (OVX) is a direct and more accurate measure of oil price uncertainty.,high citation signal (262),Risk forecasts can fail under regime breaks and extreme events.; Choice of loss function strongly affects model rankings.; Citation counts do not prove suitability for a specific mandate or risk budget.,https://doi.org/10.1016/J.ENECO.2018.07.026,https://www.semanticscholar.org/paper/67d6f9ef011713b595bb4823bfa9f2a0e4215db0,,,10.1016/J.ENECO.2018.07.026,,,158255211,Economics,,stock returns,1,citations=262; influential=3; investment validation signal; open PDF metadata; title trade matches=2; trade term matches=2,"The crude oil volatility index (OVX) is a direct and more accurate measure of oil price uncertainty. This paper uses this kind of implied volatility index of oil prices to investigate the impacts of oil price uncertainty on the aggregate and sectoral stock returns in China. This issue is resolved by using a quantile regression, which can provide a more detailed examination under different market conditions. Meanwhile, the asymmetric effects of uncertainty shocks are also examined by using the positive and negative changes of the OVX. Furthermore, we assess whether the reform of March 27, 2013 affected the OVX-stock nexus since this reform was a major step to relax the control of domestic oil prices in China. Our results reveal that OVX changes mainly show significantly negative effects on the aggregate and sectoral stock returns in the bearish market. In particular, these effects depend largely on the positive shocks of the OVX rather than the negative shocks of the OVX. Moreover, the reform of March 27, 2013 decreased the impacts of the positive OVX shocks on Chinese stock returns."
842,29,51,2018,Deep Learning with Gated Recurrent Unit Networks for Financial Sequence Predictions,"Guizhu Shen, QingPing Tan, Haoyu Zhang, P. Zeng, Jianjun Xu",,,260,9,175.656,Deep Learning and Financial Time Series,forecasting; machine-learning; deep-learning,stock-prediction; machine-learning; deep-learning; ai-based-trade,Abstract Gated recurrent unit (GRU) networks perform well in sequence learning tasks and overcome the problems of vanishing and explosion of gradients in traditional recurrent neural networks (RNNs) when learning long-term dependencies.,high citation signal (260); open-access PDF metadata,"Deep models can overfit noisy, nonstationary, and low signal-to-noise market data.; Compute-heavy models may be hard to reproduce without code and data access.; Reported gains need robustness checks across regimes and markets.",https://doi.org/10.1016/J.PROCS.2018.04.298,https://www.semanticscholar.org/paper/48ab5360fa1e3d8c21f99044837a451da2c4224e,https://doi.org/10.1016/j.procs.2018.04.298,,10.1016/J.PROCS.2018.04.298,,,56745612,Business; Computer Science,,deep learning stock prediction; support vector machine stock prediction,2,citations=260; influential=9; survey/benchmark signal; AI/ML method signal; open PDF metadata; title trade matches=1; trade term matches=7; query hits=2,"Abstract Gated recurrent unit (GRU) networks perform well in sequence learning tasks and overcome the problems of vanishing and explosion of gradients in traditional recurrent neural networks (RNNs) when learning long-term dependencies. Although they apply essentially to financial time series predictions, they are seldom used in the field. To fill this void, we propose GRU networks and its improved version for predicting trading signals for stock indexes of the Hang Seng Indexes (HSI), the Deutscher Aktienindex (DAX) and the S&P 500 Index from 1991 to 2017, and compare the GRU-based models with the traditional deep net and the benchmark classifier support vector machine (SVM). Experimental results show that the two GRU models proposed in this paper both obtain higher prediction accuracy on these data sets, and the improved version can effectively improve the learning ability of the model."
847,30,52,2018,Technical Analysis of Stock Trends,"R. Edwards, J. MaGee, W. Bassetti",,2018-07-24,259,6,171.578,Portfolio Optimization and Asset Allocation,survey/review; portfolio; risk/volatility,portfolio; risk-volatility,"ant-The Long-Term Investor's Viewpoint Selection of Stocks to Chart Selection of Stocks to Chart-Continued Choosing and Managing High-Risk Stocks: Tulip Stocks, Internet Sector, and Speculative Frenzies The Probable Moves of Your Stocks Two Touchy Questions Round Lots or Odd Lots?",high citation signal (259),"Allocation gains can be dominated by estimation error, turnover, short-sale constraints, and benchmark choice.; Backtests may hide capacity and liquidity limits.; Metadata cannot confirm implementation details such as costs, leverage, or rebalancing rules.",https://doi.org/10.5860/choice.35-2224,https://www.semanticscholar.org/paper/26bf2982f4361c9a43bebaa24f2ac35c80de3b62,,,10.5860/choice.35-2224,,,153960327,Business; Computer Science; Economics,Review,capital markets investment; risk management portfolio stock; technical analysis stock market; trading strategies stock market,4,citations=259; influential=6; survey/benchmark signal; investment validation signal; open PDF metadata; title trade matches=1; trade term matches=5; query hits=4,"TECHNICAL THEORY The Technical Approach to Trading and Investing Charts The Dow Theory The Dow Theory in Practice The Dow Theory's Defects The Dow Theory in the 20th and 21st Centuries Important Reversal Patterns Important Reversal Patterns-Continued Important Reversal Patterns-The Triangles Important Reversal Patterns-Continued Other Reversal Phenomena Short-Term Phenomena of Potential Importance Consolidation Formations Gaps Support and Resistance Trendlines and Channels Major Trendlines Trading the Averages in the 21st Century Technical Analysis of Commodity Charts Technical Analysis of Commodity Charts, Part 2 A Summary and Some Concluding Comments Technical Analysis and Technology in the 21st Century: The Computer and the Internet, Tools of the Investment/ Information Revolution Advancements in Investment Technology TRADING TACTICS MIDWORD The Tactical Problem Strategy and Tactics for the Long-Term Investor The All-Important Details The Kind of Stocks We Want-The Speculator's Viewpoint The Kind of Stocks We Want-The Long-Term Investor's Viewpoint Selection of Stocks to Chart Selection of Stocks to Chart-Continued Choosing and Managing High-Risk Stocks: Tulip Stocks, Internet Sector, and Speculative Frenzies The Probable Moves of Your Stocks Two Touchy Questions Round Lots or Odd Lots? Stop Orders What Is a Bottom-What's Is a Top? Trendlines in Action Use of Support and Resistance Not All in One Basket Measuring Implications in Technical Chart Patterns Tactical Review of Chart Action A Quick Summation of Tactical Methods Effect of Technical Trading on Market Action Automated Trendline: The Moving Average ""The Same Old Patterns"" Balanced and Diversified Trial and Error How Much Capital to Use in Trading Application of Capital in Practice Portfolio Risk Management Stick to Your Guns APPENDICES GLOSSARY BIBLIOGRAPHY INDEX"
