rank,yearRank,candidateRank,year,title,authors,venue,publicationDate,citationCount,influentialCitationCount,importanceScore,category,methodTags,keywordTags,keyIdea,strengths,limitations,url,semanticScholarUrl,openAccessPdf,githubUrl,doi,arxiv,pubmed,corpusId,fieldsOfStudy,publicationTypes,sourceQueries,queryHitCount,importanceReasons,abstract
797,18,26,2016,Predicting the direction of stock market prices using random forest,"Luckyson Khaidem, Snehanshu Saha, Sudeepa Roy Dey",arXiv.org,2016-04-29,270,13,185.193,"Risk, Volatility, and Forecast Evaluation",forecasting; machine-learning; risk/volatility,stock-prediction; machine-learning; ai-based-trade; risk-volatility,Predicting trends in stock market prices has been an area of interest for researchers for many years due to its complex and dynamic nature.,high citation signal (270); influential citation signal (13),Risk forecasts can fail under regime breaks and extreme events.; Choice of loss function strongly affects model rankings.; Citation counts do not prove suitability for a specific mandate or risk budget.,https://www.semanticscholar.org/paper/08510d874f5f57b75efb58d65c03f348b416fff3,https://www.semanticscholar.org/paper/08510d874f5f57b75efb58d65c03f348b416fff3,,,,1605.00003,,9422111,Business; Computer Science; Mathematics,JournalArticle,machine learning stock market; stock market prediction; stock price prediction; stock returns; volatility forecasting stock market,5,citations=270; influential=13; investment validation signal; AI/ML method signal; open PDF metadata; title trade matches=2; trade term matches=6; query hits=5,"Predicting trends in stock market prices has been an area of interest for researchers for many years due to its complex and dynamic nature. Intrinsic volatility in stock market across the globe makes the task of prediction challenging. Forecasting and diffusion modeling, although effective can't be the panacea to the diverse range of problems encountered in prediction, short-term or otherwise. Market risk, strongly correlated with forecasting errors, needs to be minimized to ensure minimal risk in investment. The authors propose to minimize forecasting error by treating the forecasting problem as a classification problem, a popular suite of algorithms in Machine learning. In this paper, we propose a novel way to minimize the risk of investment in stock market by predicting the returns of a stock using a class of powerful machine learning algorithms known as ensemble learning. Some of the technical indicators such as Relative Strength Index (RSI), stochastic oscillator etc are used as inputs to train our model. The learning model used is an ensemble of multiple decision trees. The algorithm is shown to outperform existing algo- rithms found in the literature. Out of Bag (OOB) error estimates have been found to be encouraging. Key Words: Random Forest Classifier, stock price forecasting, Exponential smoothing, feature extraction, OOB error and convergence."
826,19,28,2016,Institutional Investors and Stock Return Anomalies,"Roger M. Edelen, Ozgur Ince, Gregory Kadlec",,2016-03-01,263,13,163.618,Asset Pricing and Return Predictability,metadata-ranked,stock-prediction,Positions Institutional Investors and Stock Return Anomalies within Asset Pricing and Return Predictability.,high citation signal (263); influential citation signal (13),"Return predictability can disappear after transaction costs, crowding, and multiple-testing correction.; Citation impact can favor well-known anomalies even when live performance later weakens.; Metadata cannot verify whether data-snooping controls were adequate.",https://doi.org/10.2139/SSRN.2506683,https://www.semanticscholar.org/paper/d80f5e82888355aa71ba1eb251a8a73cdd629156,,,10.2139/SSRN.2506683,,,17766573,Business; Economics,,stock returns,1,citations=263; influential=13; open PDF metadata; title trade matches=1; trade term matches=1,
831,20,29,2016,Predicting the Direction of Stock Market Index Movement Using an Optimized Artificial Neural Network Model,"M. Qiu, Yu Song",PLoS ONE,2016-05-19,262,12,174.497,Deep Learning and Financial Time Series,forecasting; deep-learning,stock-prediction; deep-learning; ai-based-trade,"In the business sector, it has always been a difficult task to predict the exact daily price of the stock market index; hence, there is a great deal of research being conducted regarding the prediction of the direction of stock price index movement.",high citation signal (262); influential citation signal (12); open-access PDF metadata,"Deep models can overfit noisy, nonstationary, and low signal-to-noise market data.; Compute-heavy models may be hard to reproduce without code and data access.; Reported gains need robustness checks across regimes and markets.",https://doi.org/10.1371/journal.pone.0155133,https://www.semanticscholar.org/paper/97147a73e57afc0e45dc4294d1154461b6d5919a,https://journals.plos.org/plosone/article/file?id=10.1371/journal.pone.0155133&type=printable,,10.1371/journal.pone.0155133,,27196055,6175215,Business; Computer Science; Economics; Medicine,JournalArticle,neural networks stock market; stock market prediction; stock price prediction,3,citations=262; influential=12; AI/ML method signal; open PDF metadata; title trade matches=2; trade term matches=4; query hits=3,"In the business sector, it has always been a difficult task to predict the exact daily price of the stock market index; hence, there is a great deal of research being conducted regarding the prediction of the direction of stock price index movement. Many factors such as political events, general economic conditions, and traders’ expectations may have an influence on the stock market index. There are numerous research studies that use similar indicators to forecast the direction of the stock market index. In this study, we compare two basic types of input variables to predict the direction of the daily stock market index. The main contribution of this study is the ability to predict the direction of the next day’s price of the Japanese stock market index by using an optimized artificial neural network (ANN) model. To improve the prediction accuracy of the trend of the stock market index in the future, we optimize the ANN model using genetic algorithms (GA). We demonstrate and verify the predictability of stock price direction by using the hybrid GA-ANN model and then compare the performance with prior studies. Empirical results show that the Type 2 input variables can generate a higher forecast accuracy and that it is possible to enhance the performance of the optimized ANN model by selecting input variables appropriately."
839,21,30,2016,"Product market competition, R&D investment, and stock returns",L. Gu,,2016-02-01,260,18,173.642,"General Finance, Surveys, and Trading Systems",metadata-ranked,stock-prediction,"Positions Product market competition, R&D investment, and stock returns within General Finance, Surveys, and Trading Systems.",high citation signal (260); influential citation signal (18),"Surveys and systems can dominate citations while empirical evidence remains mixed across markets.; Broad claims need careful mapping to data, costs, and investment horizons.; Metadata-driven ranking cannot replace expert reading of full papers and backtests.",https://doi.org/10.1016/J.JFINECO.2015.09.008,https://www.semanticscholar.org/paper/e958ff4e6e746b8bd13b3feef6ee8f6ff21717a6,,,10.1016/J.JFINECO.2015.09.008,,,153822246,Economics,,options market stock returns; stock market prediction; stock returns,3,citations=260; influential=18; open PDF metadata; title trade matches=2; trade term matches=2; query hits=3,
931,22,33,2016,"Investor Sentiment, Beta, and the Cost of Equity Capital","Constantinos Antoniou, John A. Doukas, A. Subrahmanyam",Management Sciences,,239,12,174.483,"Sentiment, News, and Alternative Data",sentiment/text,sentiment-altdata; behavioral-finance,"Positions Investor Sentiment, Beta, and the Cost of Equity Capital within Sentiment, News, and Alternative Data.",high citation signal (239); influential citation signal (12); recognized finance/AI venue,Timestamp alignment and look-ahead bias are critical for text and alternative-data studies.; Sentiment signals can decay quickly as information becomes crowded.; Data licensing and coverage bias can limit reproducibility.,https://doi.org/10.1287/mnsc.2014.2101,https://www.semanticscholar.org/paper/6fa99ff55b24e98bc9385dc3ab6f6358bc745272,,,10.1287/mnsc.2014.2101,,,3084591,Computer Science; Economics,JournalArticle,capital markets investment; investment management equity; securities market; securities trading investment,4,citations=239; influential=12; recognized finance/AI venue; open PDF metadata; title trade matches=1; trade term matches=1; query hits=4,
936,23,34,2016,The Economics of High-Frequency Trading: Taking Stock,A. Menkveld,,2016-06-01,238,23,173.975,Market Microstructure and High-Frequency Trading,microstructure,high-frequency,Positions The Economics of High-Frequency Trading: Taking Stock within Market Microstructure and High-Frequency Trading.,high citation signal (238); influential citation signal (23); open-access PDF metadata,"High-frequency results depend heavily on market access, latency, fees, and order-book reconstruction quality.; Public metadata rarely reveals execution assumptions.; Short-horizon predictability can vanish when capacity and competition are considered.",https://doi.org/10.1146/ANNUREV-FINANCIAL-121415-033010,https://www.semanticscholar.org/paper/dac416b965a7a8a0c27ce9b41e8bf21e2038a368,https://www.annualreviews.org/doi/pdf/10.1146/annurev-financial-121415-033010,,10.1146/ANNUREV-FINANCIAL-121415-033010,,,156798276,Economics,Review,high frequency trading stock market; stock market prediction,2,citations=238; influential=23; open PDF metadata; title trade matches=2; trade term matches=2; query hits=2,
948,24,35,2016,Cryptocurrency portfolio management with deep reinforcement learning,"Zhengyao Jiang, Jinjun Liang",Intelligent Systems with Applications,2016-12-05,236,21,183.572,Reinforcement Learning and Algorithmic Trading,portfolio; deep-learning; reinforcement-learning,deep-learning; ai-based-trade; portfolio; reinforcement-trading,Portfolio management is the decision-making process of allocating an amount of fund into different financial investment products.,high citation signal (236); influential citation signal (21); open-access PDF metadata,"Simulated rewards can diverge from executable trading under slippage, latency, and market impact.; Policies can be brittle during regime shifts or stress periods.; Backtest-only evidence needs live or paper-trading validation.",https://doi.org/10.1109/INTELLISYS.2017.8324237,https://www.semanticscholar.org/paper/632225349977400a68825405e18ae3ed927f4f1e,https://arxiv.org/pdf/1612.01277,,10.1109/INTELLISYS.2017.8324237,1612.01277,,4251721,Business; Computer Science; Mathematics,JournalArticle; Conference,reinforcement learning trading,1,citations=236; influential=21; investment validation signal; AI/ML method signal; open PDF metadata; title trade matches=2; trade term matches=6,"Portfolio management is the decision-making process of allocating an amount of fund into different financial investment products. Cryptocurrencies are electronic and decentralized alternatives to government-issued money, with Bitcoin as the best-known example of a cryptocurrency. This paper presents a model-less convolutional neural network with historic prices of a set of financial assets as its input, outputting portfolio weights of the set. The network is trained with 0.7 years' price data from a cryptocurrency exchange. The training is done in a reinforcement manner, maximizing the accumulative return, which is regarded as the reward function of the network. Back test trading experiments with trading period of 30 minutes is conducted in the same market, achieving 10-fold returns in 1.8 month's periods. Some recently published portfolio selection strategies are also used to perform the same back tests, whose results are compared with the neural network. The network is not limited to cryptocurrency, but can be applied to any other financial markets."
962,25,36,2016,Downside and upside risk spillovers between exchange rates and stock prices,"J. Reboredo, M. Rivera-Castro, A. Ugolini",,,234,7,164.223,"Risk, Volatility, and Forecast Evaluation",risk/volatility,risk-volatility,"Positions Downside and upside risk spillovers between exchange rates and stock prices within Risk, Volatility, and Forecast Evaluation.",high citation signal (234),Risk forecasts can fail under regime breaks and extreme events.; Choice of loss function strongly affects model rankings.; Citation counts do not prove suitability for a specific mandate or risk budget.,https://doi.org/10.1016/J.JBANKFIN.2015.10.011,https://www.semanticscholar.org/paper/3be83b5283ddf1af7d09eacc49f16e2964fc20b3,,,10.1016/J.JBANKFIN.2015.10.011,,,153905119,Economics,,risk management portfolio stock; stock returns; value investing stock market,3,citations=234; influential=7; investment validation signal; open PDF metadata; title trade matches=2; trade term matches=2; query hits=3,
984,26,37,2016,Oil price volatility and stock returns in the G7 economies,"Elena Maria Diaz, J. Molero, F. P. Gracia",,2016-02-01,231,4,154.36,"Risk, Volatility, and Forecast Evaluation",risk/volatility,risk-volatility,"Positions Oil price volatility and stock returns in the G7 economies within Risk, Volatility, and Forecast Evaluation.",high citation signal (231); open-access PDF metadata,Risk forecasts can fail under regime breaks and extreme events.; Choice of loss function strongly affects model rankings.; Citation counts do not prove suitability for a specific mandate or risk budget.,https://doi.org/10.1016/J.ENECO.2016.01.002,https://www.semanticscholar.org/paper/7e855e1cb5f83ec38cea6846ed2ea5a3ed45b5cf,http://www.unav.edu/documents/10174/6546776/wp_0116.pdf/157a4462-db60-463c-8c46-1937c49bba75,,10.1016/J.ENECO.2016.01.002,,,155610099,Economics,,stock returns,1,citations=231; influential=4; investment validation signal; open PDF metadata; title trade matches=2; trade term matches=2,
1012,27,38,2016,The heterogeneity dependence between crude oil price changes and industry stock market returns in China: Evidence from a quantile regression approach,"Huiming Zhu, Yawei Guo, Wanhai You, Yaqin Xu",,2016-03-01,225,6,150.495,"General Finance, Surveys, and Trading Systems",metadata-ranked,stock-prediction,"Positions The heterogeneity dependence between crude oil price changes and industry stock market returns in China: Evidence from a quantile regression approach within General Finance, Surveys, and Trading Systems.",high citation signal (225),"Surveys and systems can dominate citations while empirical evidence remains mixed across markets.; Broad claims need careful mapping to data, costs, and investment horizons.; Metadata-driven ranking cannot replace expert reading of full papers and backtests.",https://doi.org/10.1016/J.ENECO.2015.12.027,https://www.semanticscholar.org/paper/08fd9b19b7fcc96a520f697a7b8e5309e942b86b,,,10.1016/J.ENECO.2015.12.027,,,155132137,Economics,,stock returns,1,citations=225; influential=6; open PDF metadata; title trade matches=1; trade term matches=1,
1018,28,39,2016,The History of the Cross Section of Stock Returns,"Juhani T. Linnainmaa, Michael R. Roberts",,2016-11-24,224,9,160.39,Asset Pricing and Return Predictability,metadata-ranked,asset-pricing,Positions The History of the Cross Section of Stock Returns within Asset Pricing and Return Predictability.,high citation signal (224); open-access PDF metadata,"Return predictability can disappear after transaction costs, crowding, and multiple-testing correction.; Citation impact can favor well-known anomalies even when live performance later weakens.; Metadata cannot verify whether data-snooping controls were adequate.",https://doi.org/10.2139/ssrn.2897719,https://www.semanticscholar.org/paper/0211687e53fd58c14addcaa42ced88237f402ba4,http://www.nber.org/papers/w22894.pdf,,10.2139/ssrn.2897719,,,158000569,Business; Economics; History,,asset pricing stock returns; stock returns,2,citations=224; influential=9; open PDF metadata; title trade matches=2; trade term matches=2; query hits=2,
1040,29,41,2016,The Causal Relationship Between Economic Policy Uncertainty and Stock Returns in China and India: Evidence from a Bootstrap Rolling Window Approach,"Xiao-lin Li, M. Balcılar, Rangan Gupta, T. Chang",,2016-03-03,221,6,153.102,Reinforcement Learning and Algorithmic Trading,reinforcement-learning,reinforcement-trading,Positions The Causal Relationship Between Economic Policy Uncertainty and Stock Returns in China and India: Evidence from a Bootstrap Rolling Window Approach within Reinforcement Learning and Algorithmic Trading.,high citation signal (221); open-access PDF metadata,"Simulated rewards can diverge from executable trading under slippage, latency, and market impact.; Policies can be brittle during regime shifts or stress periods.; Backtest-only evidence needs live or paper-trading validation.",https://doi.org/10.1080/1540496X.2014.998564,https://www.semanticscholar.org/paper/f08913108628a3c15f1a96c7894e39e228bd0d63,https://repository.up.ac.za/bitstream/2263/52155/1/Li_Causal_2016.pdf,,10.1080/1540496X.2014.998564,,,56398138,Economics,,stock returns,1,citations=221; influential=6; open PDF metadata; title trade matches=2; trade term matches=2,
1052,30,43,2016,Google Searches and Stock Returns,"Laurens Robin Bijl, Glenn Kringhaug, Péter Molnár, E. Sandvik",,2016-03-30,219,16,165.325,Asset Pricing and Return Predictability,metadata-ranked,asset-pricing,Positions Google Searches and Stock Returns within Asset Pricing and Return Predictability.,high citation signal (219); influential citation signal (16),"Return predictability can disappear after transaction costs, crowding, and multiple-testing correction.; Citation impact can favor well-known anomalies even when live performance later weakens.; Metadata cannot verify whether data-snooping controls were adequate.",https://doi.org/10.1016/J.IRFA.2016.03.015,https://www.semanticscholar.org/paper/a0d66099e03caa14fd59473284cb717cd727278a,,,10.1016/J.IRFA.2016.03.015,,,155615619,Business; Computer Science; Economics,,stock returns,1,citations=219; influential=16; open PDF metadata; title trade matches=2; trade term matches=2,
1055,31,44,2016,Artificial Neural Networks architectures for stock price prediction: comparisons and applications,"L. D. Persio, O. Honchar",,,219,9,170.896,Deep Learning and Financial Time Series,forecasting; deep-learning,stock-prediction,Positions Artificial Neural Networks architectures for stock price prediction: comparisons and applications within Deep Learning and Financial Time Series.,high citation signal (219),"Deep models can overfit noisy, nonstationary, and low signal-to-noise market data.; Compute-heavy models may be hard to reproduce without code and data access.; Reported gains need robustness checks across regimes and markets.",https://www.semanticscholar.org/paper/41487776364a6dddee91f1e2d2b78f46d0b93499,https://www.semanticscholar.org/paper/41487776364a6dddee91f1e2d2b78f46d0b93499,,,,,,7679322,Business; Computer Science,,deep learning stock prediction; financial market prediction; financial time series forecasting; neural networks stock market; stock market prediction; stock price prediction,6,citations=219; influential=9; AI/ML method signal; open PDF metadata; title trade matches=3; trade term matches=3; query hits=6,
1080,32,47,2016,Runs on Money Market Mutual Funds,"Lawrence Schmidt, A. Timmermann, Russ Wermers",,2016-08-30,214,14,160.067,"General Finance, Surveys, and Trading Systems",metadata-ranked,stock-prediction,"Positions Runs on Money Market Mutual Funds within General Finance, Surveys, and Trading Systems.",high citation signal (214); influential citation signal (14); open-access PDF metadata,"Surveys and systems can dominate citations while empirical evidence remains mixed across markets.; Broad claims need careful mapping to data, costs, and investment horizons.; Metadata-driven ranking cannot replace expert reading of full papers and backtests.",https://doi.org/10.2139/SSRN.2024282,https://www.semanticscholar.org/paper/b1ad7621b5ae0e2d14ee08f4a31000a98ef8cc53,http://www2.warwick.ac.uk/fac/soc/wbs/subjects/finance/seminars/money_market_funds_kentucky.pdf,,10.2139/SSRN.2024282,,,16835734,Economics,,financial market prediction,1,citations=214; influential=14; open PDF metadata; title trade matches=1; trade term matches=1,
1109,33,48,2016,Global financial crisis and spillover effects among the U.S. and BRICS stock markets,"Walid Mensi, S. Hammoudeh, D. K. Nguyen, S. Kang",,2016-03-01,211,5,148.93,"General Finance, Surveys, and Trading Systems",metadata-ranked,stock-prediction,"Positions Global financial crisis and spillover effects among the U.S. and BRICS stock markets within General Finance, Surveys, and Trading Systems.",high citation signal (211),"Surveys and systems can dominate citations while empirical evidence remains mixed across markets.; Broad claims need careful mapping to data, costs, and investment horizons.; Metadata-driven ranking cannot replace expert reading of full papers and backtests.",https://doi.org/10.1016/J.IREF.2015.11.005,https://www.semanticscholar.org/paper/091e58622d1d072fe87508c987231008eb8a0e97,,,10.1016/J.IREF.2015.11.005,,,155734180,Business; Economics,,value investing stock market; volatility forecasting stock market,2,citations=211; influential=5; open PDF metadata; title trade matches=1; trade term matches=1; query hits=2,
1116,34,50,2016,Application of artificial neural network for the prediction of stock market returns: The case of the Japanese stock market,"M. Qiu, Yu Song, Fumio Akagi",,2016-04-01,210,3,156.149,Deep Learning and Financial Time Series,forecasting; deep-learning,stock-prediction; deep-learning; ai-based-trade,Positions Application of artificial neural network for the prediction of stock market returns: The case of the Japanese stock market within Deep Learning and Financial Time Series.,high citation signal (210),"Deep models can overfit noisy, nonstationary, and low signal-to-noise market data.; Compute-heavy models may be hard to reproduce without code and data access.; Reported gains need robustness checks across regimes and markets.",https://doi.org/10.1016/J.CHAOS.2016.01.004,https://www.semanticscholar.org/paper/eea239ecb88a0af5fbdbd370fb2c650e97ea3138,,,10.1016/J.CHAOS.2016.01.004,,,123933156,Business; Computer Science; Economics,,financial market prediction; neural networks stock market; stock market prediction; stock return prediction; stock returns,5,citations=210; influential=3; AI/ML method signal; open PDF metadata; title trade matches=3; trade term matches=3; query hits=5,
1121,35,51,2016,Probabilistic forecasting of the solar irradiance with recursive ARMA and GARCH models,"M. David, F. Ramahatana, Pierre-Julien Trombe, P. Lauret",,2016-08-01,209,12,157.546,"Risk, Volatility, and Forecast Evaluation",risk/volatility,risk-volatility,"Positions Probabilistic forecasting of the solar irradiance with recursive ARMA and GARCH models within Risk, Volatility, and Forecast Evaluation.",high citation signal (209); influential citation signal (12); open-access PDF metadata,Risk forecasts can fail under regime breaks and extreme events.; Choice of loss function strongly affects model rankings.; Citation counts do not prove suitability for a specific mandate or risk budget.,https://doi.org/10.1016/J.SOLENER.2016.03.064,https://www.semanticscholar.org/paper/4b737d28934d1b8b46e046769b32faa52da536a8,http://manuscript.elsevier.com/S0038092X16300172/pdf/S0038092X16300172.pdf,,10.1016/J.SOLENER.2016.03.064,,,55693482,Computer Science; Engineering; Environmental Science; Mathematics,,financial time series forecasting,1,citations=209; influential=12; open PDF metadata; title trade matches=1; trade term matches=1,
