rank,yearRank,candidateRank,year,title,authors,venue,publicationDate,citationCount,influentialCitationCount,importanceScore,category,methodTags,keywordTags,keyIdea,strengths,limitations,url,semanticScholarUrl,openAccessPdf,githubUrl,doi,arxiv,pubmed,corpusId,fieldsOfStudy,publicationTypes,sourceQueries,queryHitCount,importanceReasons,abstract
194,22,22,2000,Trading Is Hazardous to Your Wealth : The Common Stock Investment Performance of Individual Investors,"B. Barber, T. Odean",,,712,130,222.781,"General Finance, Surveys, and Trading Systems",metadata-ranked,stock-prediction,"Positions Trading Is Hazardous to Your Wealth : The Common Stock Investment Performance of Individual Investors within General Finance, Surveys, and Trading Systems.",high citation signal (712); influential citation signal (130),"Surveys and systems can dominate citations while empirical evidence remains mixed across markets.; Broad claims need careful mapping to data, costs, and investment horizons.; Metadata-driven ranking cannot replace expert reading of full papers and backtests.",https://www.semanticscholar.org/paper/522bbdd692553c9528b65d824513db6994dbb32e,https://www.semanticscholar.org/paper/522bbdd692553c9528b65d824513db6994dbb32e,,,,,,1801092,Business; Economics,Review,equity portfolio performance; equity returns; financial economics stock market; investment management equity; securities market; securities trading investment; stock returns; value investing stock market,8,citations=712; influential=130; open PDF metadata; title trade matches=1; trade term matches=1; query hits=8,
195,23,23,2000,"Equity, Bonds, and Bank Debt: Capital Structure and Financial Market Equilibrium under Asymmetric Information","P. Bolton, X. Freixas",Journal of Political Economy,2000-03-30,711,57,206.344,"General Finance, Surveys, and Trading Systems",metadata-ranked,stock-prediction,"This paper proposes a model of financial markets and corporate finance, with asymmetric information and no taxes, where equity issues, bank debt, and bond financing coexist in equilibrium.",high citation signal (711); influential citation signal (57); open-access PDF metadata,"Surveys and systems can dominate citations while empirical evidence remains mixed across markets.; Broad claims need careful mapping to data, costs, and investment horizons.; Metadata-driven ranking cannot replace expert reading of full papers and backtests.",https://doi.org/10.1086/262121,https://www.semanticscholar.org/paper/a960343b0bdfc9581e9abe4e16bf3eef34f5df72,https://www.journals.uchicago.edu/doi/pdfplus/10.1086/703847,,10.1086/262121,,,26711086,Economics,,capital markets investment,1,citations=711; influential=57; open PDF metadata; title trade matches=1; trade term matches=2,"This paper proposes a model of financial markets and corporate finance, with asymmetric information and no taxes, where equity issues, bank debt, and bond financing coexist in equilibrium. The relationship banking aspect of financial intermediation is emphasized: firms turn to banks as a source of investment mainly because banks are good at helping them through times of financial distress. This financial flexibility is costly since banks face costs of capital themselves (which they attempt to minimize through securitization). To avoid this intermediation cost, firms may turn to bond or equity financing, but bonds imply an inefficient liquidation cost and equity an informational dilution cost. We show that in equilib‐rium the riskier firms prefer bank loans, the safer ones tap the bond markets, and the ones in between prefer to issue both equity and bonds. This segmentation is broadly consistent with stylized facts."
211,24,24,2000,Investor Sentiment and Stock Returns,"Kenneth L. Fisher, M. Statman",,2000-03-01,668,31,203.648,"Sentiment, News, and Alternative Data",sentiment/text,sentiment-altdata; behavioral-finance,"Positions Investor Sentiment and Stock Returns within Sentiment, News, and Alternative Data.",high citation signal (668); influential citation signal (31),Timestamp alignment and look-ahead bias are critical for text and alternative-data studies.; Sentiment signals can decay quickly as information becomes crowded.; Data licensing and coverage bias can limit reproducibility.,https://doi.org/10.2469/faj.v56.n2.2340,https://www.semanticscholar.org/paper/a35acf95daf2578841dbcee10a6f8e2710821e16,,,10.2469/faj.v56.n2.2340,,,153355342,Business; Economics,,investor sentiment stock returns; stock returns,2,citations=668; influential=31; open PDF metadata; title trade matches=3; trade term matches=3; query hits=2,
215,25,25,2000,Firm Size and Cyclical Variations in Stock Returns,"Gabriel Pérez-Quirós, A. Timmermann",,2000-06-01,656,47,203.926,Asset Pricing and Return Predictability,metadata-ranked,asset-pricing,Positions Firm Size and Cyclical Variations in Stock Returns within Asset Pricing and Return Predictability.,high citation signal (656); influential citation signal (47); open-access PDF metadata,"Return predictability can disappear after transaction costs, crowding, and multiple-testing correction.; Citation impact can favor well-known anomalies even when live performance later weakens.; Metadata cannot verify whether data-snooping controls were adequate.",https://doi.org/10.1111/0022-1082.00246,https://www.semanticscholar.org/paper/821ea9d5bc716bda8c49b1a316829a309f9e6dac,http://eprints.lse.ac.uk/119113/1/dp335.pdf,,10.1111/0022-1082.00246,,,17031699,Economics,,stock returns,1,citations=656; influential=47; open PDF metadata; title trade matches=2; trade term matches=2,
217,26,26,2000,Trading Volume and Cross-Autocorrelations in Stock Returns,"Tarun Chordia, Bhaskaran Swaminathan",,,653,65,213.284,"General Finance, Surveys, and Trading Systems",metadata-ranked,stock-prediction,"Positions Trading Volume and Cross-Autocorrelations in Stock Returns within General Finance, Surveys, and Trading Systems.",high citation signal (653); influential citation signal (65),"Surveys and systems can dominate citations while empirical evidence remains mixed across markets.; Broad claims need careful mapping to data, costs, and investment horizons.; Metadata-driven ranking cannot replace expert reading of full papers and backtests.",https://www.semanticscholar.org/paper/1226761434526332c98927c364c78d3d452b0624,https://www.semanticscholar.org/paper/1226761434526332c98927c364c78d3d452b0624,,,,,,14742065,Economics,,quantitative trading; stock returns,2,citations=653; influential=65; open PDF metadata; title trade matches=3; trade term matches=3; query hits=2,
240,27,27,2000,Theory Of Financial Risk And Derivative Pricing,"J. Bouchaud, M. Potters",,2000-08-28,614,39,201.92,"Risk, Volatility, and Forecast Evaluation",risk/volatility,risk-volatility,"Positions Theory Of Financial Risk And Derivative Pricing within Risk, Volatility, and Forecast Evaluation.",high citation signal (614); influential citation signal (39),Risk forecasts can fail under regime breaks and extreme events.; Choice of loss function strongly affects model rankings.; Citation counts do not prove suitability for a specific mandate or risk budget.,https://doi.org/10.1017/cbo9780511753893,https://www.semanticscholar.org/paper/f0400ba52bf050d36782fe721d394371eba81f83,,,10.1017/cbo9780511753893,,,167088876,Business; Economics; Mathematics,,quantitative trading,1,citations=614; influential=39; investment validation signal; open PDF metadata; title trade matches=1; trade term matches=1,
250,28,28,2000,Stock Market Openings: Experience of Emerging Economies,"E. H. Kim, Vijay Singal",,,599,34,194.507,"General Finance, Surveys, and Trading Systems",metadata-ranked,stock-prediction,"Positions Stock Market Openings: Experience of Emerging Economies within General Finance, Surveys, and Trading Systems.",high citation signal (599); influential citation signal (34); open-access PDF metadata,"Surveys and systems can dominate citations while empirical evidence remains mixed across markets.; Broad claims need careful mapping to data, costs, and investment horizons.; Metadata-driven ranking cannot replace expert reading of full papers and backtests.",https://doi.org/10.1086/209631,https://www.semanticscholar.org/paper/a9612bf3082890c8cae8257144c8fa5ff3e6e3c3,https://vtechworks.lib.vt.edu/bitstream/10919/49136/1/209631.pdf,,10.1086/209631,,,154560435,Economics,,stock returns,1,citations=599; influential=34; open PDF metadata; title trade matches=1; trade term matches=1,
282,29,29,2000,Stock Market Capitalism: Welfare Capitalism: Japan and Germany Versus the Anglo-Saxons,R. Dore,,2000-07-13,550,25,188.472,"General Finance, Surveys, and Trading Systems",metadata-ranked,stock-prediction,"Positions Stock Market Capitalism: Welfare Capitalism: Japan and Germany Versus the Anglo-Saxons within General Finance, Surveys, and Trading Systems.",high citation signal (550); influential citation signal (25),"Surveys and systems can dominate citations while empirical evidence remains mixed across markets.; Broad claims need careful mapping to data, costs, and investment horizons.; Metadata-driven ranking cannot replace expert reading of full papers and backtests.",https://www.semanticscholar.org/paper/d4a147fc780bfbf5706332a695d56e83c667ced2,https://www.semanticscholar.org/paper/d4a147fc780bfbf5706332a695d56e83c667ced2,,,,,,153648307,Business; Economics; Political Science,,stock exchange market efficiency,1,citations=550; influential=25; open PDF metadata; title trade matches=1; trade term matches=1,
323,30,30,2000,Socially Responsible Mutual Funds (corrected),M. Statman,,2000-05-01,510,11,178.989,"General Finance, Surveys, and Trading Systems",metadata-ranked,stock-prediction,"Positions Socially Responsible Mutual Funds (corrected) within General Finance, Surveys, and Trading Systems.",high citation signal (510); influential citation signal (11),"Surveys and systems can dominate citations while empirical evidence remains mixed across markets.; Broad claims need careful mapping to data, costs, and investment horizons.; Metadata-driven ranking cannot replace expert reading of full papers and backtests.",https://doi.org/10.2469/faj.v56.n3.2358,https://www.semanticscholar.org/paper/cf9e0608f59a99cf4e760e7fcb361490c05599e9,,,10.2469/faj.v56.n3.2358,,,154447655,Business; Economics,,equity portfolio performance; equity returns; mutual fund performance stocks,3,citations=510; influential=11; open PDF metadata; title trade matches=1; trade term matches=1; query hits=3,
347,31,31,2000,Asset Pricing with Idiosyncratic Risk and Overlapping Generations,"Kjetil Storesletten, Chris I. Telmer, A. Yaron",,,483,30,195.082,"Risk, Volatility, and Forecast Evaluation",asset-pricing; risk/volatility,risk-volatility; asset-pricing,"Positions Asset Pricing with Idiosyncratic Risk and Overlapping Generations within Risk, Volatility, and Forecast Evaluation.",high citation signal (483); influential citation signal (30); open-access PDF metadata,Risk forecasts can fail under regime breaks and extreme events.; Choice of loss function strongly affects model rankings.; Citation counts do not prove suitability for a specific mandate or risk budget.,https://doi.org/10.2139/ssrn.199058,https://www.semanticscholar.org/paper/2f7ba79b83975609566b527f37f36f250c66bd16,http://bertha.tepper.cmu.edu/files/papers/sty1B.pdf,,10.2139/ssrn.199058,,,1513428,Economics,,asset pricing stock returns; stock returns,2,citations=483; influential=30; investment validation signal; open PDF metadata; title trade matches=1; trade term matches=1; query hits=2,
351,32,32,2000,Stock Repurchases in Canada: Performance and Strategic Trading,"David L. Ikenberry, Josef Lakonishok, T. Vermaelen",,2000-10-01,481,36,190.468,"General Finance, Surveys, and Trading Systems",metadata-ranked,stock-prediction,"Positions Stock Repurchases in Canada: Performance and Strategic Trading within General Finance, Surveys, and Trading Systems.",high citation signal (481); influential citation signal (36); open-access PDF metadata,"Surveys and systems can dominate citations while empirical evidence remains mixed across markets.; Broad claims need careful mapping to data, costs, and investment horizons.; Metadata-driven ranking cannot replace expert reading of full papers and backtests.",https://doi.org/10.1111/0022-1082.00291,https://www.semanticscholar.org/paper/bbb975cc5b85e47be72eef2dc265bac4f9a36ad3,http://papers.nber.org/papers/w7325.pdf,,10.1111/0022-1082.00291,,,154070253,Business; Economics,,stock returns,1,citations=481; influential=36; open PDF metadata; title trade matches=1; trade term matches=1,
353,33,33,2000,Bayesian Dynamic Factor Models and Portfolio Allocation,"O. Aguilar, M. West",,2000-07-01,478,83,209.809,Portfolio Optimization and Asset Allocation,portfolio; asset-pricing,portfolio; asset-pricing,Positions Bayesian Dynamic Factor Models and Portfolio Allocation within Portfolio Optimization and Asset Allocation.,high citation signal (478); influential citation signal (83),"Allocation gains can be dominated by estimation error, turnover, short-sale constraints, and benchmark choice.; Backtests may hide capacity and liquidity limits.; Metadata cannot confirm implementation details such as costs, leverage, or rebalancing rules.",https://doi.org/10.1080/07350015.2000.10524875,https://www.semanticscholar.org/paper/af40b7ac1dc2e5bb990e1e7a74d9071fc9e0fbba,,,10.1080/07350015.2000.10524875,,,15111066,Business; Computer Science; Economics; Mathematics,,financial time series forecasting,1,citations=478; influential=83; investment validation signal; open PDF metadata; title trade matches=2; trade term matches=2,
416,34,34,2000,Identifying Bull and Bear Markets in Stock Returns,"J. Maheu, Thomas H. McCurdy",,2000-01-01,427,25,185.914,Asset Pricing and Return Predictability,metadata-ranked,asset-pricing,Positions Identifying Bull and Bear Markets in Stock Returns within Asset Pricing and Return Predictability.,high citation signal (427); influential citation signal (25),"Return predictability can disappear after transaction costs, crowding, and multiple-testing correction.; Citation impact can favor well-known anomalies even when live performance later weakens.; Metadata cannot verify whether data-snooping controls were adequate.",https://doi.org/10.1080/07350015.2000.10524851,https://www.semanticscholar.org/paper/b6e913c6ff69226124d15ee20ab87d7f99257edb,,,10.1080/07350015.2000.10524851,,,153969987,Economics,,stock returns,1,citations=427; influential=25; open PDF metadata; title trade matches=2; trade term matches=2,
426,35,35,2000,"Does Asset Allocation Policy Explain 40, 90, or 100 Percent of Performance?","R. Ibbotson, P. Kaplan",,2000-01-01,422,28,184.184,Reinforcement Learning and Algorithmic Trading,portfolio; reinforcement-learning,portfolio; reinforcement-trading,"Positions Does Asset Allocation Policy Explain 40, 90, or 100 Percent of Performance? within Reinforcement Learning and Algorithmic Trading.",high citation signal (422); influential citation signal (28),"Simulated rewards can diverge from executable trading under slippage, latency, and market impact.; Policies can be brittle during regime shifts or stress periods.; Backtest-only evidence needs live or paper-trading validation.",https://doi.org/10.2469/faj.v56.n1.2327,https://www.semanticscholar.org/paper/284a61cff79629fd85cda7a8c8514fa8dbff0d30,,,10.2469/faj.v56.n1.2327,,,17750540,Business; Economics,,securities market,1,citations=422; influential=28; open PDF metadata; title trade matches=1; trade term matches=1,
442,36,37,2000,Corporate Disclosure Policy and the Informativeness of Stock Prices,"D. Gelb, Paul Zarowin",,2000-06-01,403,22,182.928,Reinforcement Learning and Algorithmic Trading,reinforcement-learning,reinforcement-trading,Positions Corporate Disclosure Policy and the Informativeness of Stock Prices within Reinforcement Learning and Algorithmic Trading.,high citation signal (403); influential citation signal (22); open-access PDF metadata,"Simulated rewards can diverge from executable trading under slippage, latency, and market impact.; Policies can be brittle during regime shifts or stress periods.; Backtest-only evidence needs live or paper-trading validation.",https://doi.org/10.2139/SSRN.235009,https://www.semanticscholar.org/paper/0f0610fd5dbc0037dd93a163b05d3e03a7e2eee9,http://archive.nyu.edu/bitstream/2451/27591/2/SSRN-id235009.pdf,,10.2139/SSRN.235009,,,14316570,Business; Economics,,stock returns,1,citations=403; influential=22; open PDF metadata; title trade matches=2; trade term matches=2,
449,37,38,2000,Learning About Predictability: The Effects of Parameter Uncertainty on Dynamic Asset Allocation,Yihong Xia,,2000-05-10,399,38,187.102,Portfolio Optimization and Asset Allocation,forecasting; portfolio,stock-prediction; portfolio,Positions Learning About Predictability: The Effects of Parameter Uncertainty on Dynamic Asset Allocation within Portfolio Optimization and Asset Allocation.,high citation signal (399); influential citation signal (38); open-access PDF metadata,"Allocation gains can be dominated by estimation error, turnover, short-sale constraints, and benchmark choice.; Backtests may hide capacity and liquidity limits.; Metadata cannot confirm implementation details such as costs, leverage, or rebalancing rules.",https://doi.org/10.1111/0022-1082.00323,https://www.semanticscholar.org/paper/999053b6abea34dcd30b1501fcb07417c97907ab,https://onlinelibrary.wiley.com/doi/pdfdirect/10.1111/0022-1082.00323,,10.1111/0022-1082.00323,,,5872299,Business; Economics,,stock returns,1,citations=399; influential=38; open PDF metadata; title trade matches=1; trade term matches=1,
494,38,39,2000,Asset Pricing with Distorted Beliefs: Are Equity Returns Too Good To Be True?,"Stephen G. Cecchetti, Pok-sang Lam, Nelson C. Mark",,2000-09-01,371,33,188.585,Asset Pricing and Return Predictability,asset-pricing,asset-pricing,Positions Asset Pricing with Distorted Beliefs: Are Equity Returns Too Good To Be True? within Asset Pricing and Return Predictability.,high citation signal (371); influential citation signal (33); open-access PDF metadata,"Return predictability can disappear after transaction costs, crowding, and multiple-testing correction.; Citation impact can favor well-known anomalies even when live performance later weakens.; Metadata cannot verify whether data-snooping controls were adequate.",https://doi.org/10.1257/AER.90.4.787,https://www.semanticscholar.org/paper/071269a80a6f48cc82b8c3917ce9e154ab39cb6b,http://papers.nber.org/papers/w6354.pdf,,10.1257/AER.90.4.787,,,7302911,Economics,,equity returns,1,citations=371; influential=33; investment validation signal; open PDF metadata; title trade matches=1; trade term matches=1,
524,39,40,2000,"Further Evidence on the Integration of REIT, Bond, and Stock Returns","J. Glascock, Chiuling Lu, Raymond W. So",,2000-03-01,357,33,185.741,Asset Pricing and Return Predictability,metadata-ranked,asset-pricing,"Positions Further Evidence on the Integration of REIT, Bond, and Stock Returns within Asset Pricing and Return Predictability.",high citation signal (357); influential citation signal (33),"Return predictability can disappear after transaction costs, crowding, and multiple-testing correction.; Citation impact can favor well-known anomalies even when live performance later weakens.; Metadata cannot verify whether data-snooping controls were adequate.",https://doi.org/10.1023/A:1007877321475,https://www.semanticscholar.org/paper/1124b2ce526415829ce4b59e22f48682ae49e3fe,,,10.1023/A:1007877321475,,,152587908,Business; Economics,,stock returns,1,citations=357; influential=33; open PDF metadata; title trade matches=2; trade term matches=2,
609,40,41,2000,Profitability of Momentum Stragegies in the International Equity Markets,"Kalok Chan, A. Hameed, W. Tong",Journal of Financial and Quantitative Analysis,2000-06-01,324,15,185.06,Asset Pricing and Return Predictability,metadata-ranked,asset-pricing,Positions Profitability of Momentum Stragegies in the International Equity Markets within Asset Pricing and Return Predictability.,high citation signal (324); influential citation signal (15); recognized finance/AI venue,"Return predictability can disappear after transaction costs, crowding, and multiple-testing correction.; Citation impact can favor well-known anomalies even when live performance later weakens.; Metadata cannot verify whether data-snooping controls were adequate.",https://doi.org/10.2307/2676188,https://www.semanticscholar.org/paper/31ba50f402d91e4f8bc594ebba84ace06b256dbb,,,10.2307/2676188,,,59475548,Business; Economics,,technical analysis stock market; trading strategies stock market,2,citations=324; influential=15; recognized finance/AI venue; open PDF metadata; title trade matches=2; trade term matches=2; query hits=2,
614,41,42,2000,Investment Plans and Stock Returns,O. Lamont,,2000-12-01,322,25,179.722,"General Finance, Surveys, and Trading Systems",metadata-ranked,stock-prediction,"Positions Investment Plans and Stock Returns within General Finance, Surveys, and Trading Systems.",high citation signal (322); influential citation signal (25); open-access PDF metadata,"Surveys and systems can dominate citations while empirical evidence remains mixed across markets.; Broad claims need careful mapping to data, costs, and investment horizons.; Metadata-driven ranking cannot replace expert reading of full papers and backtests.",https://doi.org/10.2139/SSRN.148630,https://www.semanticscholar.org/paper/078eb540ad581e0efa848ff060ace96c69133de7,http://papers.nber.org/papers/w6973.pdf,,10.2139/SSRN.148630,,,18393438,Business; Economics,Review,stock returns,1,citations=322; influential=25; open PDF metadata; title trade matches=2; trade term matches=2,
628,42,43,2000,The Rise of Sector Effects in Major Equity Markets,"Sean P. Baca, Brian L. Garbe, Richard A. Weiss",,2000-09-01,319,26,185.045,"General Finance, Surveys, and Trading Systems",metadata-ranked,stock-prediction,"Positions The Rise of Sector Effects in Major Equity Markets within General Finance, Surveys, and Trading Systems.",high citation signal (319); influential citation signal (26),"Surveys and systems can dominate citations while empirical evidence remains mixed across markets.; Broad claims need careful mapping to data, costs, and investment horizons.; Metadata-driven ranking cannot replace expert reading of full papers and backtests.",https://doi.org/10.2469/faj.v56.n5.2388,https://www.semanticscholar.org/paper/15dfb50018ec602677970eebf3876d7d6903f274,,,10.2469/faj.v56.n5.2388,,,154906998,Business; Economics,,capital markets investment; equity returns; factor investing equity; investment management equity; stock returns,5,citations=319; influential=26; open PDF metadata; title trade matches=2; trade term matches=2; query hits=5,
638,43,44,2000,Stock Market Risk and Return: An Equilibrium Approach,"Robert F. Whitelaw, Robert F. Whitelaw",,2000-07-01,316,11,170.485,"Risk, Volatility, and Forecast Evaluation",risk/volatility,stock-prediction; risk-volatility,"Positions Stock Market Risk and Return: An Equilibrium Approach within Risk, Volatility, and Forecast Evaluation.",high citation signal (316); influential citation signal (11); open-access PDF metadata,Risk forecasts can fail under regime breaks and extreme events.; Choice of loss function strongly affects model rankings.; Citation counts do not prove suitability for a specific mandate or risk budget.,https://doi.org/10.1093/RFS/13.3.521,https://www.semanticscholar.org/paper/bc976ec23dbf3a1d6ae18f0b6897276350e52c1f,http://archive.nyu.edu/bitstream/2451/27069/2/wpa98073.pdf,,10.1093/RFS/13.3.521,,,54988002,Economics,,stock returns,1,citations=316; influential=11; investment validation signal; open PDF metadata; title trade matches=1; trade term matches=1,
