rank,yearRank,candidateRank,year,title,authors,venue,publicationDate,citationCount,influentialCitationCount,importanceScore,category,methodTags,keywordTags,keyIdea,strengths,limitations,url,semanticScholarUrl,openAccessPdf,githubUrl,doi,arxiv,pubmed,corpusId,fieldsOfStudy,publicationTypes,sourceQueries,queryHitCount,importanceReasons,abstract
327,22,22,2003,Spurious Regressions in Financial Economics,"W. Ferson, Sergei Sarkissian, Timothy T. Simin",,2003-08-01,606,34,194.763,"General Finance, Surveys, and Trading Systems",metadata-ranked,stock-prediction,"Positions Spurious Regressions in Financial Economics within General Finance, Surveys, and Trading Systems.",high citation signal (606); influential citation signal (34); open-access PDF metadata,"Surveys and systems can dominate citations while empirical evidence remains mixed across markets.; Broad claims need careful mapping to data, costs, and investment horizons.; Metadata-driven ranking cannot replace expert reading of full papers and backtests.",https://doi.org/10.2139/SSRN.242112,https://www.semanticscholar.org/paper/3ba874adffbf4162a9aafa49d4e533e0fb0fc777,http://papers.nber.org/papers/w9143.pdf,,10.2139/SSRN.242112,,,15721876,Business; Economics,,stock returns,1,citations=606; influential=34; open PDF metadata; title trade matches=1; trade term matches=1,
358,23,23,2003,The Presidential Puzzle: Political Cycles and the Stock Market,"Pedro Santa-clara, Rossen Valkanov",,2003-11-01,560,51,200.571,"General Finance, Surveys, and Trading Systems",metadata-ranked,stock-prediction,"Positions The Presidential Puzzle: Political Cycles and the Stock Market within General Finance, Surveys, and Trading Systems.",high citation signal (560); influential citation signal (51),"Surveys and systems can dominate citations while empirical evidence remains mixed across markets.; Broad claims need careful mapping to data, costs, and investment horizons.; Metadata-driven ranking cannot replace expert reading of full papers and backtests.",https://doi.org/10.1111/1540-6261.00590,https://www.semanticscholar.org/paper/b9bc9d2e16e81d25a58dd803cec9c55e43b0b598,,,10.1111/1540-6261.00590,,,9684018,Economics; Political Science,,risk premium stock returns; stock returns,2,citations=560; influential=51; open PDF metadata; title trade matches=1; trade term matches=1; query hits=2,
385,24,24,2003,Alternative models for stock price dynamics,"Mikhail Chernov, A. R. Gallant, Eric Ghysels, George Tauchen",,2003-09-01,544,40,197.607,"General Finance, Surveys, and Trading Systems",metadata-ranked,stock-prediction,"Positions Alternative models for stock price dynamics within General Finance, Surveys, and Trading Systems.",high citation signal (544); influential citation signal (40); open-access PDF metadata,"Surveys and systems can dominate citations while empirical evidence remains mixed across markets.; Broad claims need careful mapping to data, costs, and investment horizons.; Metadata-driven ranking cannot replace expert reading of full papers and backtests.",https://doi.org/10.1016/S0304-4076(03)00108-8,https://www.semanticscholar.org/paper/fd2694605dbebe5d0041eea25a21b034d1e8a5a3,https://cdr.lib.unc.edu/downloads/ff3657497,,10.1016/S0304-4076(03)00108-8,,,16147780,Business; Economics; Mathematics,,equity factor models; equity returns; stock returns,3,citations=544; influential=40; open PDF metadata; title trade matches=1; trade term matches=1; query hits=3,
388,25,25,2003,The Dynamics of Institutional and Individual Trading,"John M. Griffin, Jeffrey H. Harris, Selim Topaloglu",,2003-12-01,543,30,193.653,"Sentiment, News, and Alternative Data",forecasting; asset-pricing; sentiment/text,stock-prediction; sentiment-altdata,We study the daily and intradaily cross-sectional relation between stock returns and the trading of institutional and individual investors in Nasdaq 100 securities.,high citation signal (543); influential citation signal (30); open-access PDF metadata,Timestamp alignment and look-ahead bias are critical for text and alternative-data studies.; Sentiment signals can decay quickly as information becomes crowded.; Data licensing and coverage bias can limit reproducibility.,https://doi.org/10.1046/J.1540-6261.2003.00606.X,https://www.semanticscholar.org/paper/698e9148114d71342cd130cfede2fec50adc2320,https://figshare.com/articles/online_resource/Dynamics_of_institutional_and_individual_trading_the/23890659/1/files/41888736.pdf,,10.1046/J.1540-6261.2003.00606.X,,,10655375,Economics,,stock returns,1,citations=543; influential=30; open PDF metadata; title trade matches=1; trade term matches=4,"We study the daily and intradaily cross-sectional relation between stock returns and the trading of institutional and individual investors in Nasdaq 100 securities. Based on the previous day's stock return, the top performing decile of securities is 23.9% more likely to be bought in net by institutions (and sold by individuals) than those in the bottom performance decile. Strong contemporaneous daily patterns can largely be explained by net institutional (individual) trading positively (negatively) following past intradaily excess stock returns (or the news associated therein). In comparison, evidence of return predictability and price pressure are economically small. Copyright 2003 by the American Finance Association."
406,26,26,2003,"Is Money Really 'Smart'? New Evidence on the Relation between Mutual Fund Flows, Manager Behavior, and Performance Persistence",Russ Wermers,,2003-05-01,527,30,193.996,"General Finance, Surveys, and Trading Systems",metadata-ranked,stock-prediction,"Positions Is Money Really 'Smart'? New Evidence on the Relation between Mutual Fund Flows, Manager Behavior, and Performance Persistence within General Finance, Surveys, and Trading Systems.",high citation signal (527); influential citation signal (30),"Surveys and systems can dominate citations while empirical evidence remains mixed across markets.; Broad claims need careful mapping to data, costs, and investment horizons.; Metadata-driven ranking cannot replace expert reading of full papers and backtests.",https://doi.org/10.2139/SSRN.414420,https://www.semanticscholar.org/paper/301ea74c23b37fb1bc8360ea21763ee6280b8a2f,,,10.2139/SSRN.414420,,,14416865,Business; Economics,,fund performance stock market; momentum investing stock market; mutual fund performance stocks; stock returns,4,citations=527; influential=30; open PDF metadata; title trade matches=1; trade term matches=1; query hits=4,
413,27,27,2003,Audit Quality and the Pricing of Discretionary Accruals,Gopal V. Krishnan,,2003-03-01,522,39,192.355,Asset Pricing and Return Predictability,metadata-ranked,asset-pricing,Accrual‐based earnings is considered superior to cash flows.,high citation signal (522); influential citation signal (39); open-access PDF metadata,"Return predictability can disappear after transaction costs, crowding, and multiple-testing correction.; Citation impact can favor well-known anomalies even when live performance later weakens.; Metadata cannot verify whether data-snooping controls were adequate.",https://doi.org/10.2308/AUD.2003.22.1.109,https://www.semanticscholar.org/paper/02db5dcdfeb94e250c7bf20abb07e19d66d249ae,https://figshare.com/articles/online_resource/Audit_quality_and_the_pricing_of_discretionary_accruals/23847168/1/files/41841783.pdf,,10.2308/AUD.2003.22.1.109,,,152315511,Business; Economics,,stock returns,1,citations=522; influential=39; open PDF metadata; trade term matches=2,"Accrual‐based earnings is considered superior to cash flows. Accruals allow managers to communicate their private and inside information and thereby improve the ability of earnings to reflect underlying economic value. However, managers could engage in aggressive reporting of accruals that would seriously undermine the informativeness of reported earnings. Since outsiders cannot directly observe earnings, high‐accrual firms face greater agency costs relative to low‐accrual firms. Auditing plays an important role in mitigating these agency costs by constraining opportunistic management of accruals. This study examines whether there is a linkage between audit quality and pricing of discretionary accruals. The findings indicate that the association between stock returns and discretionary accruals is greater for firms audited by Big 6 auditors than for firms audited by non‐Big 6 auditors. Further, discretionary accruals of clients of Big 6 auditors have a greater association with future profitability than dis..."
414,28,28,2003,Application of neural networks to an emerging financial market: forecasting and trading the Taiwan Stock Index,"An-Sing Chen, M. T. Leung, H. Daouk",Computers & Operations Research,2003-05-01,522,20,200.334,"General Finance, Surveys, and Trading Systems",deep-learning,stock-prediction,"Positions Application of neural networks to an emerging financial market: forecasting and trading the Taiwan Stock Index within General Finance, Surveys, and Trading Systems.",high citation signal (522); influential citation signal (20),"Surveys and systems can dominate citations while empirical evidence remains mixed across markets.; Broad claims need careful mapping to data, costs, and investment horizons.; Metadata-driven ranking cannot replace expert reading of full papers and backtests.",https://doi.org/10.1016/S0305-0548(02)00037-0,https://www.semanticscholar.org/paper/10d1f52113df1d52926f7271e2c35076e571bd08,,,10.1016/S0305-0548(02)00037-0,,,3938216,Business; Computer Science; Economics,JournalArticle,neural networks stock market; stock returns; trading strategies stock market,3,citations=522; influential=20; AI/ML method signal; open PDF metadata; title trade matches=4; trade term matches=4; query hits=3,
471,29,29,2003,The predictive power of zero intelligence in financial markets.,"J. Doyne Farmer, P. Patelli, Ilija I. Zovko, Kenneth J. Arrow",Proceedings of the National Academy of Sciences of the United States of America,2003-09-09,474,27,190.244,Asset Pricing and Return Predictability,metadata-ranked,asset-pricing,Standard models in economics stress the role of intelligent agents who maximize utility.,high citation signal (474); influential citation signal (27); open-access PDF metadata,"Return predictability can disappear after transaction costs, crowding, and multiple-testing correction.; Citation impact can favor well-known anomalies even when live performance later weakens.; Metadata cannot verify whether data-snooping controls were adequate.",https://doi.org/10.1073/PNAS.0409157102,https://www.semanticscholar.org/paper/b348aa0d762ebd8a4fe8228e8b4520407932d6ba,https://europepmc.org/articles/pmc548562?pdf=render,,10.1073/PNAS.0409157102,cond-mat/0309233,15687505,1975086,Economics; Medicine; Physics,JournalArticle,financial economics stock market,1,citations=474; influential=27; open PDF metadata; title trade matches=2; trade term matches=3,"Standard models in economics stress the role of intelligent agents who maximize utility. However, there may be situations where constraints imposed by market institutions dominate strategic agent behavior. We use data from the London Stock Exchange to test a simple model in which minimally intelligent agents place orders to trade at random. The model treats the statistical mechanics of order placement, price formation, and the accumulation of revealed supply and demand within the context of the continuous double auction and yields simple laws relating order-arrival rates to statistical properties of the market. We test the validity of these laws in explaining cross-sectional variation for 11 stocks. The model explains 96% of the variance of the gap between the best buying and selling prices (the spread) and 76% of the variance of the price diffusion rate, with only one free parameter. We also study the market impact function, describing the response of quoted prices to the arrival of new orders. The nondimensional coordinates dictated by the model approximately collapse data from different stocks onto a single curve. This work is important from a practical point of view, because it demonstrates the existence of simple laws relating prices to order flows and, in a broader context, suggests there are circumstances where the strategic behavior of agents may be dominated by other considerations."
500,30,30,2003,Small Sample Properties of Forecasts from Autoregressive Models Under Structural Breaks,"M. Pesaran, Allan G. Timmermann",Social Science Research Network,2003-06-01,456,15,176.559,Deep Learning and Financial Time Series,forecasting,stock-prediction,Autoregressive models are used routinely in forecasting and often lead to better performance than more complicated models.,high citation signal (456); influential citation signal (15); open-access PDF metadata,"Deep models can overfit noisy, nonstationary, and low signal-to-noise market data.; Compute-heavy models may be hard to reproduce without code and data access.; Reported gains need robustness checks across regimes and markets.",https://doi.org/10.1016/J.JECONOM.2004.09.007,https://www.semanticscholar.org/paper/d91e0843ae2ae74628b43cfbc83acf195a744bb1,http://www.econ.cam.ac.uk/research-files/repec/cam/pdf/cwpe0331.pdf,,10.1016/J.JECONOM.2004.09.007,,,230373,Computer Science; Economics; Mathematics,,financial time series forecasting,1,citations=456; influential=15; open PDF metadata; trade term matches=2,"Autoregressive models are used routinely in forecasting and often lead to better performance than more complicated models. However, empirical evidence is also suggesting that the autoregressive representations of many macroeconomic and financial time series are likely to be subject to structural breaks. This paper develops a theoretical framework for the analysis of small-sample properties of forecasts from general autoregressive models under a structural break. Our approach is quite general and allows for unit roots both pre- and post-break. We derive finite-sample results for the mean squared forecast error of one-step-ahead forecasts, both conditionally and unconditionally and present numerical results for different types of break specifications. Implications of breaks for the determination of the optimal window size are also discussed."
510,31,31,2003,International Financial Integration,"Philip R. Lane, G. Milesi-Ferretti",Social Science Research Network,2003-01-01,452,21,184.824,Portfolio Optimization and Asset Allocation,portfolio,portfolio,"In recent decades, foreign assets and liabilities in advanced countries have grown rapidly relative to GDP, with the increase in gross cross-holdings far exceeding the size of net positions.",high citation signal (452); influential citation signal (21); open-access PDF metadata,"Allocation gains can be dominated by estimation error, turnover, short-sale constraints, and benchmark choice.; Backtests may hide capacity and liquidity limits.; Metadata cannot confirm implementation details such as costs, leverage, or rebalancing rules.",https://doi.org/10.2139/SSRN.495625,https://www.semanticscholar.org/paper/eba29c0a0b794a091e20df3ccd72cbb615f586cc,https://www.elibrary.imf.org/downloadpdf/journals/001/2003/086/001.2003.issue-086-en.xml,,10.2139/SSRN.495625,,,15992887,Business; Economics,JournalArticle,equity returns,1,citations=452; influential=21; investment validation signal; open PDF metadata; trade term matches=1,"In recent decades, foreign assets and liabilities in advanced countries have grown rapidly relative to GDP, with the increase in gross cross-holdings far exceeding the size of net positions. Moreover, the portfolio equity and foreign direct investment (FDI) categories have grown in importance relative to international debt stocks. In this paper, we describe the broad trends in international financial integration for a sample of industrial countries and seek to explain the cross-country and time-series variation in the size of international balance sheets. We also examine the behavior of the rates of return on foreign assets and liabilities, relating them to “market” returns."
512,32,32,2003,Optimal execution with nonlinear impact functions and trading-enhanced risk,R. Almgren,,2003-01-01,451,92,206.957,Reinforcement Learning and Algorithmic Trading,risk/volatility,reinforcement-trading; risk-volatility,Positions Optimal execution with nonlinear impact functions and trading-enhanced risk within Reinforcement Learning and Algorithmic Trading.,high citation signal (451); influential citation signal (92),"Simulated rewards can diverge from executable trading under slippage, latency, and market impact.; Policies can be brittle during regime shifts or stress periods.; Backtest-only evidence needs live or paper-trading validation.",https://doi.org/10.1080/135048602100056,https://www.semanticscholar.org/paper/f93c86a40e38465762397b66bea99ceaec6fdf94,,,10.1080/135048602100056,,,15809273,Business; Economics; Mathematics,,market microstructure trading,1,citations=451; influential=92; investment validation signal; open PDF metadata; title trade matches=1; trade term matches=1,
577,33,33,2003,"Options, futures & other derivatives",J. Hull,,,415,44,191.968,"General Finance, Surveys, and Trading Systems",metadata-ranked,stock-prediction,"Positions Options, futures & other derivatives within General Finance, Surveys, and Trading Systems.",high citation signal (415); influential citation signal (44),"Surveys and systems can dominate citations while empirical evidence remains mixed across markets.; Broad claims need careful mapping to data, costs, and investment horizons.; Metadata-driven ranking cannot replace expert reading of full papers and backtests.",https://www.semanticscholar.org/paper/8620335e5d40fd131c02abc89198f2b3826ff991,https://www.semanticscholar.org/paper/8620335e5d40fd131c02abc89198f2b3826ff991,,,,,,153678023,Business; Economics; Mathematics,,derivatives stock market; trading strategies stock market,2,citations=415; influential=44; open PDF metadata; title trade matches=1; trade term matches=1; query hits=2,
613,34,34,2003,Ally or Acquire? Case Studies of Compaq and Cisco as Additional Tests of the External Technology Life Cycle Model,"Benjamin N. Grosof, Terrence C. Poon",,2003-08-01,397,18,176.924,"General Finance, Surveys, and Trading Systems",metadata-ranked,stock-prediction,In our first paper we proposed a dynamic theory relating alliances and acquisitions to the evolution of a technology and the market it serves.,high citation signal (397); influential citation signal (18); open-access PDF metadata,"Surveys and systems can dominate citations while empirical evidence remains mixed across markets.; Broad claims need careful mapping to data, costs, and investment horizons.; Metadata-driven ranking cannot replace expert reading of full papers and backtests.",https://doi.org/10.2139/SSRN.441342,https://www.semanticscholar.org/paper/49c1c1e0371f6218b69354fc40d66afa5e2b8127,https://dspace.mit.edu/bitstream/1721.1/3543/2/4421-03.pdf,,10.2139/SSRN.441342,,,267787494,Business; Economics,,equity factor models,1,citations=397; influential=18; open PDF metadata; trade term matches=3,"In our first paper we proposed a dynamic theory relating alliances and acquisitions to the evolution of a technology and the market it serves. Industry structure and critical success factors change as the underlying technology evolves from phase to phase, competitive pressures exerted on a firm vary, and companies respond by adopting changing approaches to inter- firm collaboration. During the fluid phase new technology companies often form marketing alliances with established technology firms and pursue an aggressive licensing strategy to gain market recognition. The proliferation of technology startups provides an opportunity for established technology companies to obtain new technologies or enter niche markets through acquisitions or minority equity investments. Anticipating the emergence of a dominant design, companies can form standards alliances to promote their own proprietary technologies. During the transitional phase, companies with dominant designs gain recognition from the stock market, and soaring stock prices make it possible for them to acquire some of their competitors. During the mature phase, technology is well defined and competition becomes intense. Companies can form technology alliances to cut R&D costs. If a particular technology cannot be developed in-house, companies can acquire it on the open market. Marketing alliances frequently help companies target latent markets and expand into new geographic markets. During the phase of technological discontinuities the market is invaded by new technologies. Incumbents can utilize their resources to acquire the technologies needed for the newly defined marketplace. Attackers can gain market recognition through forming strategic supply alliances with established technology companies, which for the attackers is akin to the fluid phase behavior described above. In that first paper we illustrated these phenomena with a detailed case study of Microsoft, the world's leading software firm, from its origins until 2000. In this paper we further examine this hypothesized technology life cycle model through additional case studies of two high-tech companies during the same time period as the Microsoft analysis (i.e., until the year 2000): Compaq Computer and Cisco Systems. Compaq Computer was then the No.1 personal computer (PC) manufacturer in the world and is now a major portion of HP Corporation, and Cisco Systems was and still is the leading computer networking company. Each of these companies faced unique challenges at each stage of development of its underlying technologies and markets, which in turn affected its choice and extent of use of collaborative strategies. The additional case studies illustrate varying degrees of concurrence with the hypothesized dynamic model, and raise new issues for theory building. Each company's history is synopsized at the end of this paper in accord with the technology life cycle theory"
616,35,35,2003,Consumer Confidence and Stock Returns,"Kenneth L. Fisher, M. Statman",,2003-10-31,395,25,186.204,Asset Pricing and Return Predictability,metadata-ranked,asset-pricing,Positions Consumer Confidence and Stock Returns within Asset Pricing and Return Predictability.,high citation signal (395); influential citation signal (25),"Return predictability can disappear after transaction costs, crowding, and multiple-testing correction.; Citation impact can favor well-known anomalies even when live performance later weakens.; Metadata cannot verify whether data-snooping controls were adequate.",https://doi.org/10.3905/jpm.2003.319925,https://www.semanticscholar.org/paper/4b8a750bf19c36f2b9ba83bb38df04d712a956da,,,10.3905/jpm.2003.319925,,,153535325,Economics,,investor sentiment stock returns; stock returns,2,citations=395; influential=25; open PDF metadata; title trade matches=2; trade term matches=2; query hits=2,
618,36,36,2003,Enterprise Risk Management: From Incentives to Controls,James Lam,,2003-05-16,394,34,190.31,"Risk, Volatility, and Forecast Evaluation",risk/volatility,risk-volatility,"Positions Enterprise Risk Management: From Incentives to Controls within Risk, Volatility, and Forecast Evaluation.",high citation signal (394); influential citation signal (34),Risk forecasts can fail under regime breaks and extreme events.; Choice of loss function strongly affects model rankings.; Citation counts do not prove suitability for a specific mandate or risk budget.,https://www.semanticscholar.org/paper/217614e7bf2d99caa4f75502b2fead07002c9f4a,https://www.semanticscholar.org/paper/217614e7bf2d99caa4f75502b2fead07002c9f4a,,,,,,152543059,Business; Economics,,financial market prediction,1,citations=394; influential=34; investment validation signal; open PDF metadata; title trade matches=1; trade term matches=1,
636,37,37,2003,Value-at-Risk for long and short trading positions,"P. Giot, S. Laurent",,2003-11-01,387,48,194.628,"Risk, Volatility, and Forecast Evaluation",risk/volatility,risk-volatility,"Positions Value-at-Risk for long and short trading positions within Risk, Volatility, and Forecast Evaluation.",high citation signal (387); influential citation signal (48),Risk forecasts can fail under regime breaks and extreme events.; Choice of loss function strongly affects model rankings.; Citation counts do not prove suitability for a specific mandate or risk budget.,https://doi.org/10.1002/JAE.710,https://www.semanticscholar.org/paper/64cdbbf8bc17f68fdb93e925d9c52b1ec489ab0f,,,10.1002/JAE.710,,,14223682,Business; Economics; Mathematics,,stock returns,1,citations=387; influential=48; investment validation signal; open PDF metadata; title trade matches=1; trade term matches=1,
