rank,yearRank,candidateRank,year,title,authors,venue,publicationDate,citationCount,influentialCitationCount,importanceScore,category,methodTags,keywordTags,keyIdea,strengths,limitations,url,semanticScholarUrl,openAccessPdf,githubUrl,doi,arxiv,pubmed,corpusId,fieldsOfStudy,publicationTypes,sourceQueries,queryHitCount,importanceReasons,abstract
1873,73,103,2015,Modelling high-frequency limit order book dynamics with support vector machines,"A. Kercheval, Yuan Zhang",,2015-06-02,137,17,158.865,Market Microstructure and High-Frequency Trading,machine-learning; microstructure,machine-learning; ai-based-trade; high-frequency,Positions Modelling high-frequency limit order book dynamics with support vector machines within Market Microstructure and High-Frequency Trading.,high citation signal (137); influential citation signal (17),"High-frequency results depend heavily on market access, latency, fees, and order-book reconstruction quality.; Public metadata rarely reveals execution assumptions.; Short-horizon predictability can vanish when capacity and competition are considered.",https://doi.org/10.1080/14697688.2015.1032546,https://www.semanticscholar.org/paper/0007e2e93ea0174252b515685f74405f1fc97ef3,,,10.1080/14697688.2015.1032546,,,153110192,Business; Computer Science; Mathematics,,equity market forecasting; financial market prediction,2,citations=137; influential=17; AI/ML method signal; open PDF metadata; title trade matches=1; trade term matches=1; query hits=2,
1887,74,104,2015,Investor sentiment and its nonlinear effect on stock returns—New evidence from the Chinese stock market based on panel quantile regression model,"Z. Ni, Dazhong Wang, Wenjun Xue",,2015-11-01,137,3,142.808,"Sentiment, News, and Alternative Data",sentiment/text,stock-prediction; sentiment-altdata; behavioral-finance,"Positions Investor sentiment and its nonlinear effect on stock returns—New evidence from the Chinese stock market based on panel quantile regression model within Sentiment, News, and Alternative Data.",high citation signal (137),Timestamp alignment and look-ahead bias are critical for text and alternative-data studies.; Sentiment signals can decay quickly as information becomes crowded.; Data licensing and coverage bias can limit reproducibility.,https://doi.org/10.1016/J.ECONMOD.2015.07.007,https://www.semanticscholar.org/paper/ecd54ebf076c9a2a78ed9ecd2be6a7e3723593a3,,,10.1016/J.ECONMOD.2015.07.007,,,15092029,Economics,,investor sentiment stock returns; stock returns,2,citations=137; influential=3; open PDF metadata; title trade matches=4; trade term matches=4; query hits=2,
1893,75,105,2015,The effects of national culture and behavioral pitfalls on investors' decision-making: Herding behavior in international stock markets ☆,"Chih-Hsiang Chang, Shih-Jia Lin",,2015-05-01,136,9,146.476,Behavioral Finance and Investor Decision-Making,metadata-ranked,behavioral-finance,Positions The effects of national culture and behavioral pitfalls on investors' decision-making: Herding behavior in international stock markets ☆ within Behavioral Finance and Investor Decision-Making.,high citation signal (136),Behavioral mechanisms can be market-specific and time-varying.; Sentiment proxies may capture several confounded channels.; Trading implementation requires constraints beyond the behavioral explanation.,https://doi.org/10.1016/J.IREF.2014.12.010,https://www.semanticscholar.org/paper/d741020c19ba1e7b900de99d7f4dbc526f589638,,,10.1016/J.IREF.2014.12.010,,,11527474,Business; Economics; Political Science,,equity returns; stock returns,2,citations=136; influential=9; open PDF metadata; title trade matches=1; trade term matches=1; query hits=2,
1907,76,108,2015,Portfolio Choices with Orthogonal Bandit Learning,"Weiwei Shen, Jun Wang, Yu-Gang Jiang, H. Zha",International Joint Conference on Artificial Intelligence,2015-07-25,135,5,142.163,Portfolio Optimization and Asset Allocation,portfolio,ai-based-trade; portfolio,Positions Portfolio Choices with Orthogonal Bandit Learning within Portfolio Optimization and Asset Allocation.,high citation signal (135),"Allocation gains can be dominated by estimation error, turnover, short-sale constraints, and benchmark choice.; Backtests may hide capacity and liquidity limits.; Metadata cannot confirm implementation details such as costs, leverage, or rebalancing rules.",https://www.semanticscholar.org/paper/fefbb122a2fd92a354647a7185e940cad6abdb60,https://www.semanticscholar.org/paper/fefbb122a2fd92a354647a7185e940cad6abdb60,,,,,,10103358,Business; Computer Science; Mathematics,JournalArticle; Conference,algorithmic trading,1,citations=135; influential=5; investment validation signal; open PDF metadata; title trade matches=1; trade term matches=1,
1923,77,109,2015,"A Comparison between Regression, Artificial Neural Networks and Support Vector Machines for Predicting Stock Market Index","A. Sheta, Sara Ahmed, Hossam Faris",,,134,4,150.448,Machine Learning for Stock Prediction,forecasting; machine-learning; deep-learning,stock-prediction; machine-learning; ai-based-trade,Obtaining accurate prediction of stock index sig-nificantly helps decision maker to take correct actions to develop a better economy.,high citation signal (134); open-access PDF metadata,"Predictive accuracy may not translate into risk-adjusted returns after costs.; Feature leakage, survivorship bias, and nonstationarity are persistent concerns.; Metadata-driven screening cannot audit the exact train/test split.",https://doi.org/10.14569/IJARAI.2015.040710,https://www.semanticscholar.org/paper/59239d5c6c3ef17c0fb860d3809c1d2d3988bd5f,http://thesai.org/Downloads/IJARAI/Volume4No7/Paper_10-A_Comparison_between_Regression_Artificial.pdf,,10.14569/IJARAI.2015.040710,,,8781140,Business; Computer Science; Economics,,financial market prediction; neural networks stock market; stock market prediction; support vector machine stock prediction,4,citations=134; influential=4; AI/ML method signal; open PDF metadata; title trade matches=3; trade term matches=5; query hits=4,"Obtaining accurate prediction of stock index sig-nificantly helps decision maker to take correct actions to develop a better economy. The inability to predict fluctuation of the stock market might cause serious profit loss. The challenge is that we always deal with dynamic market which is influenced by many factors. They include political, financial and reserve occasions. Thus, stable, robust and adaptive approaches which can provide models have the capability to accurately predict stock index are urgently needed. In this paper, we explore the use of Artificial Neural Networks (ANNs) and Support Vector Machines (SVM) to build prediction models for the S&P 500 stock index. We will also show how traditional models such as multiple linear regression (MLR) behave in this case. The developed models will be evaluated and compared based on a number of evaluation criteria."
1925,78,110,2015,European Green Mutual Fund Performance: A Comparative Analysis with their Conventional and Black Peers,"G. Ibikunle, Tom Steffen",Journal of Business Ethics,2015-09-07,134,3,134.324,"General Finance, Surveys, and Trading Systems",metadata-ranked,stock-prediction,"Positions European Green Mutual Fund Performance: A Comparative Analysis with their Conventional and Black Peers within General Finance, Surveys, and Trading Systems.",high citation signal (134),"Surveys and systems can dominate citations while empirical evidence remains mixed across markets.; Broad claims need careful mapping to data, costs, and investment horizons.; Metadata-driven ranking cannot replace expert reading of full papers and backtests.",https://doi.org/10.1007/s10551-015-2850-7,https://www.semanticscholar.org/paper/70292ab283aaed78d2f78c736ff80b4374a0c1e1,,,10.1007/s10551-015-2850-7,,,55395432,Business; Economics; Environmental Science,,mutual fund performance stocks,1,citations=134; influential=3; open PDF metadata; title trade matches=2; trade term matches=2,
1936,79,111,2015,Stock price prediction using linear regression based on sentiment analysis,"Yahya Eru Cakra, Bayu Distiawan Trisedya",International Conference on Advanced Computer Science and Information System,2015-10-01,133,6,143.995,"Sentiment, News, and Alternative Data",forecasting; sentiment/text,stock-prediction; sentiment-altdata,"Positions Stock price prediction using linear regression based on sentiment analysis within Sentiment, News, and Alternative Data.",high citation signal (133),Timestamp alignment and look-ahead bias are critical for text and alternative-data studies.; Sentiment signals can decay quickly as information becomes crowded.; Data licensing and coverage bias can limit reproducibility.,https://doi.org/10.1109/ICACSIS.2015.7415179,https://www.semanticscholar.org/paper/7d25dc1bd0521cb6f104886eae966d621cd54358,,,10.1109/ICACSIS.2015.7415179,,,18389759,Business; Computer Science,Conference,stock market prediction; stock price prediction,2,citations=133; influential=6; open PDF metadata; title trade matches=2; trade term matches=2; query hits=2,
1942,80,112,2015,Maximum and minimum stock price forecasting of Brazilian power distribution companies based on artificial neural networks,"Leonel A. Laboissiere, R. Fernandes, G. G. Lage",Applied Soft Computing,2015-10-01,133,2,151.133,Deep Learning and Financial Time Series,deep-learning,stock-prediction,Positions Maximum and minimum stock price forecasting of Brazilian power distribution companies based on artificial neural networks within Deep Learning and Financial Time Series.,high citation signal (133); recognized finance/AI venue,"Deep models can overfit noisy, nonstationary, and low signal-to-noise market data.; Compute-heavy models may be hard to reproduce without code and data access.; Reported gains need robustness checks across regimes and markets.",https://doi.org/10.1016/j.asoc.2015.06.005,https://www.semanticscholar.org/paper/b54dabaf702f42fb1c5845442f34475b2d277bef,,,10.1016/j.asoc.2015.06.005,,,205706686,Business; Computer Science; Engineering; Mathematics,JournalArticle,neural networks stock market; stock market prediction; stock price prediction; value investing stock market,4,citations=133; influential=2; recognized finance/AI venue; AI/ML method signal; open PDF metadata; title trade matches=3; trade term matches=3; query hits=4,
1969,81,113,2015,"Investor trading behavior, investor sentiment and asset prices","Chunpeng Yang, Liyun Zhou",,2015-11-01,131,2,132.802,"Sentiment, News, and Alternative Data",sentiment/text,sentiment-altdata; behavioral-finance,"Positions Investor trading behavior, investor sentiment and asset prices within Sentiment, News, and Alternative Data.",high citation signal (131),Timestamp alignment and look-ahead bias are critical for text and alternative-data studies.; Sentiment signals can decay quickly as information becomes crowded.; Data licensing and coverage bias can limit reproducibility.,https://doi.org/10.1016/J.NAJEF.2015.08.003,https://www.semanticscholar.org/paper/72918f574755c777c59f0074d2e6b332aab0ee93,,,10.1016/J.NAJEF.2015.08.003,,,154014940,Economics,,asset pricing stock returns; investor sentiment stock returns; stock returns,3,citations=131; influential=2; open PDF metadata; title trade matches=2; trade term matches=2; query hits=3,
1971,82,114,2015,Twitter financial community sentiment and its predictive relationship to stock market movement,"Steve Y. Yang, Sheung Yin Kevin Mo, Anqi Liu",,2015-09-16,131,2,126.802,"Sentiment, News, and Alternative Data",sentiment/text,stock-prediction; sentiment-altdata,"Positions Twitter financial community sentiment and its predictive relationship to stock market movement within Sentiment, News, and Alternative Data.",high citation signal (131); open-access PDF metadata,Timestamp alignment and look-ahead bias are critical for text and alternative-data studies.; Sentiment signals can decay quickly as information becomes crowded.; Data licensing and coverage bias can limit reproducibility.,https://doi.org/10.1080/14697688.2015.1071078,https://www.semanticscholar.org/paper/7d3b2065b9e44abda901ba15a89baa7198fc2857,https://orca.cardiff.ac.uk/109449/1/Twitter_financial_community_sentiment_QFJournal_Final.pdf,,10.1080/14697688.2015.1071078,,,3587437,Business; Computer Science; Economics,,stock returns,1,citations=131; influential=2; open PDF metadata; title trade matches=1; trade term matches=1,
1974,83,115,2015,In Short Supply: Short Sellers and Stock Returns,"M. Beneish, Charles M.C. Lee, D. Nichols",,2015-02-27,130,16,158.919,Asset Pricing and Return Predictability,metadata-ranked,asset-pricing,Positions In Short Supply: Short Sellers and Stock Returns within Asset Pricing and Return Predictability.,high citation signal (130); influential citation signal (16),"Return predictability can disappear after transaction costs, crowding, and multiple-testing correction.; Citation impact can favor well-known anomalies even when live performance later weakens.; Metadata cannot verify whether data-snooping controls were adequate.",https://doi.org/10.1016/J.JACCECO.2015.08.001,https://www.semanticscholar.org/paper/5f07ec6e4b32d956ece4f86a146e461ac372e387,,,10.1016/J.JACCECO.2015.08.001,,,153828829,Business; Economics,,equity returns; financial market prediction; stock market prediction; stock price prediction; stock returns,5,citations=130; influential=16; open PDF metadata; title trade matches=2; trade term matches=2; query hits=5,
2008,84,118,2015,Sentiment Analysis for Indian Stock Market Prediction Using Sensex and Nifty,"Aditya Bhardwaj, Y. Narayan, Vanraj, Pawan, M. Dutta",,,128,5,142.001,"Sentiment, News, and Alternative Data",forecasting; sentiment/text,stock-prediction; ai-based-trade; sentiment-altdata,"Abstract From the last twenty years, the application of Internet based technologies had brought a significant impact on the Indian stock market.",high citation signal (128); open-access PDF metadata,Timestamp alignment and look-ahead bias are critical for text and alternative-data studies.; Sentiment signals can decay quickly as information becomes crowded.; Data licensing and coverage bias can limit reproducibility.,https://doi.org/10.1016/J.PROCS.2015.10.043,https://www.semanticscholar.org/paper/60cb9f7a3e29bc0e9fd9d607b0daa077091eaf51,https://doi.org/10.1016/j.procs.2015.10.043,,10.1016/J.PROCS.2015.10.043,,,61864435,Business; Computer Science,,stock market prediction; stock price prediction,2,citations=128; influential=5; open PDF metadata; title trade matches=2; trade term matches=3; query hits=2,"Abstract From the last twenty years, the application of Internet based technologies had brought a significant impact on the Indian stock market. Use of the Internet has eliminated the barriers of brokers and geographical location because now investors can buy and sell their shares by accessing the stock market status from anywhere at any time. Before investing money, it is very important for investors to predict the stock market. In today's digital world Internet based technologies such as Cloud Computing, Big Data analytics, and Sentiment analysis have changed the way we do business. Sentiment analysis or opinion mining makes use of text mining, natural language processing (NLP), in order to identify and extract the subjective content by analyzing user's opinion, evaluation, sentiments, attitudes and emotions. In this research work importance of sentiment analysis for stock market indicators such as Sensex and Nifty has been done to predict the price of stock. Finally, we draw conclusions and provide suggestions for future work."
2018,85,120,2015,Capital Structure and Stock Returns,"S. Berggren, Alexander Bergqvist, Jianhua Zhang",,,127,10,147.315,Asset Pricing and Return Predictability,metadata-ranked,asset-pricing,Positions Capital Structure and Stock Returns within Asset Pricing and Return Predictability.,high citation signal (127); influential citation signal (10),"Return predictability can disappear after transaction costs, crowding, and multiple-testing correction.; Citation impact can favor well-known anomalies even when live performance later weakens.; Metadata cannot verify whether data-snooping controls were adequate.",https://www.semanticscholar.org/paper/ceb41e0a7c518e1511ba6041f116e060a98ec3a2,https://www.semanticscholar.org/paper/ceb41e0a7c518e1511ba6041f116e060a98ec3a2,,,,,,55139901,Business; Economics,,stock returns,1,citations=127; influential=10; open PDF metadata; title trade matches=2; trade term matches=2,
2028,86,122,2015,"Trading Rules, Competition for Order Flow and Market Fragmentation","Amy Kwan, Ronald W. Masulis, Thomas H. Mcinish",,2015-02-01,126,13,147.519,Market Microstructure and High-Frequency Trading,microstructure,high-frequency,"Positions Trading Rules, Competition for Order Flow and Market Fragmentation within Market Microstructure and High-Frequency Trading.",high citation signal (126); influential citation signal (13),"High-frequency results depend heavily on market access, latency, fees, and order-book reconstruction quality.; Public metadata rarely reveals execution assumptions.; Short-horizon predictability can vanish when capacity and competition are considered.",https://doi.org/10.2139/SSRN.2365603,https://www.semanticscholar.org/paper/3f83e7e0ac666a36f5cb78a11e3a7337b833f903,,,10.2139/SSRN.2365603,,,153543645,Business; Economics,,securities market,1,citations=126; influential=13; open PDF metadata; title trade matches=1; trade term matches=1,
2052,87,126,2015,Does investor sentiment predict the asset volatility? Evidence from emerging stock market India,"Jyoti Kumari, Jitendra Mahakud",,2015-12-01,125,9,152.634,"Sentiment, News, and Alternative Data",sentiment/text; risk/volatility,stock-prediction; sentiment-altdata; risk-volatility; behavioral-finance,"Positions Does investor sentiment predict the asset volatility? Evidence from emerging stock market India within Sentiment, News, and Alternative Data.",high citation signal (125),Timestamp alignment and look-ahead bias are critical for text and alternative-data studies.; Sentiment signals can decay quickly as information becomes crowded.; Data licensing and coverage bias can limit reproducibility.,https://doi.org/10.1016/J.JBEF.2015.10.001,https://www.semanticscholar.org/paper/c08122ff0ace98c5e20b1ee5fb3c102b507fe65f,,,10.1016/J.JBEF.2015.10.001,,,17011618,Economics,,investor sentiment stock returns; stock returns,2,citations=125; influential=9; investment validation signal; open PDF metadata; title trade matches=2; trade term matches=2; query hits=2,
2058,88,127,2015,"Oil Shocks, Policy Uncertainty and Stock Returns in China","Wensheng Kang, Ronald A. Ratti",,2015-10-01,125,6,140.641,Reinforcement Learning and Algorithmic Trading,reinforcement-learning,reinforcement-trading,"Positions Oil Shocks, Policy Uncertainty and Stock Returns in China within Reinforcement Learning and Algorithmic Trading.",high citation signal (125); open-access PDF metadata,"Simulated rewards can diverge from executable trading under slippage, latency, and market impact.; Policies can be brittle during regime shifts or stress periods.; Backtest-only evidence needs live or paper-trading validation.",https://doi.org/10.1111/ECOT.12062,https://www.semanticscholar.org/paper/d6170dca222026f75cd986a497974384a537fdf9,https://onlinelibrary.wiley.com/doi/pdfdirect/10.1111/ecot.12062,,10.1111/ECOT.12062,,,154443166,Economics,,stock returns,1,citations=125; influential=6; open PDF metadata; title trade matches=2; trade term matches=2,
2079,89,128,2015,Investing for Impact,M. Lane,Better Business,2015-01-22,123,8,147.807,"General Finance, Surveys, and Trading Systems",survey/review,stock-prediction,"Impact investing in private markets could be as large as $2.1 trillion in assets under management, but only a quarter of that, $505 billion, is clearly measured for its impact, both for development impact and financial returns.",high citation signal (123),"Surveys and systems can dominate citations while empirical evidence remains mixed across markets.; Broad claims need careful mapping to data, costs, and investment horizons.; Metadata-driven ranking cannot replace expert reading of full papers and backtests.",https://doi.org/10.1002/9781118809815.CH10,https://www.semanticscholar.org/paper/b74960da14a4b9f6005e14af86886c748335a07f,,,10.1002/9781118809815.CH10,,,166347868,Business; Economics,Review,equity returns,1,citations=123; influential=8; survey/benchmark signal; open PDF metadata; title trade matches=1; trade term matches=3,"Impact investing in private markets could be as large as $2.1 trillion in assets under management, but only a quarter of that, $505 billion, is clearly measured for its impact, both for development impact and financial returns. The report also highlights the enormous potential to invest for impact in public equity markets. Today, assets totaling about $10 trillion are actively managed and these strategies could be directed toward achieving impact. The publication includes trends in impact investing, survey results of investor practices"
2080,90,129,2015,Mean-variance model for portfolio optimization problem in the simultaneous presence of random and uncertain returns,Zhongfeng Qin,European Journal of Operational Research,2015-09-01,123,8,145.807,Portfolio Optimization and Asset Allocation,portfolio,portfolio,Positions Mean-variance model for portfolio optimization problem in the simultaneous presence of random and uncertain returns within Portfolio Optimization and Asset Allocation.,high citation signal (123),"Allocation gains can be dominated by estimation error, turnover, short-sale constraints, and benchmark choice.; Backtests may hide capacity and liquidity limits.; Metadata cannot confirm implementation details such as costs, leverage, or rebalancing rules.",https://doi.org/10.1016/j.ejor.2015.03.017,https://www.semanticscholar.org/paper/7e865adf753bee05a5e263adf174df015fb27a0e,,,10.1016/j.ejor.2015.03.017,,,17594103,Business; Computer Science; Economics; Mathematics,JournalArticle,securities market,1,citations=123; influential=8; investment validation signal; open PDF metadata; title trade matches=1; trade term matches=1,
2115,91,131,2015,Linkages and co-movement between international stock market returns: Case of Dow Jones Islamic Dubai Financial Market index,"A. E. Alaoui, Ginanjar Dewandaru, Saiful Azhar Rosly, Mansur Masih",,2015-05-01,121,4,135.221,"General Finance, Surveys, and Trading Systems",metadata-ranked,stock-prediction,"Positions Linkages and co-movement between international stock market returns: Case of Dow Jones Islamic Dubai Financial Market index within General Finance, Surveys, and Trading Systems.",high citation signal (121),"Surveys and systems can dominate citations while empirical evidence remains mixed across markets.; Broad claims need careful mapping to data, costs, and investment horizons.; Metadata-driven ranking cannot replace expert reading of full papers and backtests.",https://doi.org/10.1016/J.INTFIN.2014.12.004,https://www.semanticscholar.org/paper/06a18409cc8f89bafb2855c20c57462f5953b050,,,10.1016/J.INTFIN.2014.12.004,,,154141903,Business; Economics,,stock returns,1,citations=121; influential=4; open PDF metadata; title trade matches=2; trade term matches=2,
2149,92,135,2015,Network centrality and pension fund performance,"Alberto Rossi, David Blake, A. Timmermann, Ian Tonks, Russ Wermers",,2015-12-20,118,8,139.902,"General Finance, Surveys, and Trading Systems",metadata-ranked,stock-prediction,"Positions Network centrality and pension fund performance within General Finance, Surveys, and Trading Systems.",high citation signal (118); open-access PDF metadata,"Surveys and systems can dominate citations while empirical evidence remains mixed across markets.; Broad claims need careful mapping to data, costs, and investment horizons.; Metadata-driven ranking cannot replace expert reading of full papers and backtests.",https://doi.org/10.2139/SSRN.2743187,https://www.semanticscholar.org/paper/40c5aa654bdf10a71b4c8a913057c5ba180b898b,https://www.econstor.eu/bitstream/10419/123714/1/841338175.pdf,,10.2139/SSRN.2743187,,,17488206,Business; Economics,,investment management equity,1,citations=118; influential=8; open PDF metadata; title trade matches=1; trade term matches=1,
2178,93,137,2015,The impact of monetary policy announcements on the stock price of large European banks during the financial crisis,Ornella Ricci,,2015-03-01,115,13,145.526,Reinforcement Learning and Algorithmic Trading,reinforcement-learning,stock-prediction; reinforcement-trading,Positions The impact of monetary policy announcements on the stock price of large European banks during the financial crisis within Reinforcement Learning and Algorithmic Trading.,high citation signal (115); influential citation signal (13),"Simulated rewards can diverge from executable trading under slippage, latency, and market impact.; Policies can be brittle during regime shifts or stress periods.; Backtest-only evidence needs live or paper-trading validation.",https://doi.org/10.1016/J.JBANKFIN.2014.07.001,https://www.semanticscholar.org/paper/55e28a6ee781bad036a3b8193b63d4fe778da71e,,,10.1016/J.JBANKFIN.2014.07.001,,,59354072,Economics,,stock returns,1,citations=115; influential=13; open PDF metadata; title trade matches=1; trade term matches=1,
