rank,yearRank,candidateRank,year,title,authors,venue,publicationDate,citationCount,influentialCitationCount,importanceScore,category,methodTags,keywordTags,keyIdea,strengths,limitations,url,semanticScholarUrl,openAccessPdf,githubUrl,doi,arxiv,pubmed,corpusId,fieldsOfStudy,publicationTypes,sourceQueries,queryHitCount,importanceReasons,abstract
14,1,1,2003,MODELING AND FORECASTING REALIZED VOLATILITY,"Torben G. Andersen, Tim Bollerslev, F. Diebold, Paul Labys",,2003-03-01,3768,305,270.291,"Risk, Volatility, and Forecast Evaluation",risk/volatility,risk-volatility,"Positions MODELING AND FORECASTING REALIZED VOLATILITY within Risk, Volatility, and Forecast Evaluation.","high citation signal (3,768); influential citation signal (305); open-access PDF metadata",Risk forecasts can fail under regime breaks and extreme events.; Choice of loss function strongly affects model rankings.; Citation counts do not prove suitability for a specific mandate or risk budget.,https://doi.org/10.1111/1468-0262.00418,https://www.semanticscholar.org/paper/1b8cd089b4a5f8898b2d180a5ce588d58ea6c758,http://papers.nber.org/papers/w8160.pdf,,10.1111/1468-0262.00418,,,10045723,Business; Computer Science; Economics; Mathematics,,financial time series forecasting,1,citations=3768; influential=305; investment validation signal; open PDF metadata; title trade matches=1; trade term matches=1,
37,2,2,2003,Using Confidence Bounds for Exploitation-Exploration Trade-offs,P. Auer,Journal of machine learning research,2003-03-01,2098,290,255.709,Machine Learning for Stock Prediction,machine-learning,machine-learning,Positions Using Confidence Bounds for Exploitation-Exploration Trade-offs within Machine Learning for Stock Prediction.,"high citation signal (2,098); influential citation signal (290)","Predictive accuracy may not translate into risk-adjusted returns after costs.; Feature leakage, survivorship bias, and nonstationarity are persistent concerns.; Metadata-driven screening cannot audit the exact train/test split.",https://www.semanticscholar.org/paper/103f6fe35033f9327611ddafde74a2b544072980,https://www.semanticscholar.org/paper/103f6fe35033f9327611ddafde74a2b544072980,,,,,,10485293,Computer Science; Mathematics,JournalArticle,algorithmic trading; reinforcement learning trading,2,citations=2098; influential=290; AI/ML method signal; open PDF metadata; trade term matches=1; query hits=2,
54,3,3,2003,Financial time series forecasting using support vector machines,Kyoung-jae Kim,Neurocomputing,2003-09-01,1738,85,256.504,Machine Learning for Stock Prediction,machine-learning,machine-learning; ai-based-trade,Positions Financial time series forecasting using support vector machines within Machine Learning for Stock Prediction.,"high citation signal (1,738); influential citation signal (85); recognized finance/AI venue","Predictive accuracy may not translate into risk-adjusted returns after costs.; Feature leakage, survivorship bias, and nonstationarity are persistent concerns.; Metadata-driven screening cannot audit the exact train/test split.",https://doi.org/10.1016/S0925-2312(03)00372-2,https://www.semanticscholar.org/paper/fdc35d07cdacf0da55ebdf719e464657000f333a,,,10.1016/S0925-2312(03)00372-2,,,12324268,Business; Computer Science,JournalArticle,financial market prediction; financial time series forecasting; neural networks stock market; stock market prediction; stock price prediction; support vector machine stock prediction,6,citations=1738; influential=85; recognized finance/AI venue; AI/ML method signal; open PDF metadata; title trade matches=3; trade term matches=3; query hits=6,
55,4,4,2003,Good Day Sunshine: Stock Returns and the Weather,"David Hirshleifer, Tyler Shumway",,2003-06-01,1732,120,238.208,Asset Pricing and Return Predictability,metadata-ranked,asset-pricing,Positions Good Day Sunshine: Stock Returns and the Weather within Asset Pricing and Return Predictability.,"high citation signal (1,732); influential citation signal (120); open-access PDF metadata","Return predictability can disappear after transaction costs, crowding, and multiple-testing correction.; Citation impact can favor well-known anomalies even when live performance later weakens.; Metadata cannot verify whether data-snooping controls were adequate.",https://doi.org/10.2139/ssrn.265674,https://www.semanticscholar.org/paper/b50d9c2346febfa2143ba95be4b76c83124fb92a,http://www.geocities.ws/lufinance/answers/sunshine.pdf,,10.2139/ssrn.265674,,,12527654,Economics; Psychology,,stock returns,1,citations=1732; influential=120; open PDF metadata; title trade matches=2; trade term matches=2,
59,5,5,2003,Improved estimation of the covariance matrix of stock returns with an application to portfolio selection,"Olivier Ledoit, Michael Wolf",,2003-12-01,1646,220,253.522,Portfolio Optimization and Asset Allocation,portfolio,portfolio,Positions Improved estimation of the covariance matrix of stock returns with an application to portfolio selection within Portfolio Optimization and Asset Allocation.,"high citation signal (1,646); influential citation signal (220)","Allocation gains can be dominated by estimation error, turnover, short-sale constraints, and benchmark choice.; Backtests may hide capacity and liquidity limits.; Metadata cannot confirm implementation details such as costs, leverage, or rebalancing rules.",https://doi.org/10.1016/S0927-5398(03)00007-0,https://www.semanticscholar.org/paper/b53bcfa7ce96fad265131c3d336075d1f8a573f6,,,10.1016/S0927-5398(03)00007-0,,,14422126,Business; Economics; Mathematics,,stock returns,1,citations=1646; influential=220; investment validation signal; open PDF metadata; title trade matches=3; trade term matches=3,
73,6,6,2003,The Rodney L . White Center for Financial Research Forecasting the Term Structure of Government Bond Yields,"F. Diebold, Canlin Li, F. Diebold, Todd Clark, Qiang Dai, Ron Gallant, Mike Gibbons, David A. Marshall, et al.",,,1501,412,249.248,"General Finance, Surveys, and Trading Systems",metadata-ranked,stock-prediction,"Positions The Rodney L . White Center for Financial Research Forecasting the Term Structure of Government Bond Yields within General Finance, Surveys, and Trading Systems.","high citation signal (1,501); influential citation signal (412)","Surveys and systems can dominate citations while empirical evidence remains mixed across markets.; Broad claims need careful mapping to data, costs, and investment horizons.; Metadata-driven ranking cannot replace expert reading of full papers and backtests.",https://www.semanticscholar.org/paper/121455f136b69d033ec3bcda055351657aa5daad,https://www.semanticscholar.org/paper/121455f136b69d033ec3bcda055351657aa5daad,,,,,,7197585,Business; Economics,,financial time series forecasting,1,citations=1501; influential=412; open PDF metadata; title trade matches=1; trade term matches=1,
76,7,7,2003,When Does the Market Matter? Stock Prices and the Investment of Equity-Dependent Firms,"Malcolm P. Baker, Jeremy C. Stein, Jeffrey Wurgler",,2003-08-01,1478,124,237.177,"General Finance, Surveys, and Trading Systems",metadata-ranked,stock-prediction,"Positions When Does the Market Matter? Stock Prices and the Investment of Equity-Dependent Firms within General Finance, Surveys, and Trading Systems.","high citation signal (1,478); influential citation signal (124); open-access PDF metadata","Surveys and systems can dominate citations while empirical evidence remains mixed across markets.; Broad claims need careful mapping to data, costs, and investment horizons.; Metadata-driven ranking cannot replace expert reading of full papers and backtests.",https://doi.org/10.2139/SSRN.295248,https://www.semanticscholar.org/paper/0fc83a8fb27cdf61c4738cac92c38d3e688c576b,http://papers.nber.org/papers/w8750.pdf,,10.2139/SSRN.295248,,,569554,Economics,,stock market prediction; stock price prediction,2,citations=1478; influential=124; open PDF metadata; title trade matches=2; trade term matches=2; query hits=2,
80,8,8,2003,Capital Investments and Stock Returns,"S. Titman, K. Wei, Feixue Xie",Journal of Financial and Quantitative Analysis,2003-09-01,1428,74,237.269,"General Finance, Surveys, and Trading Systems",metadata-ranked,stock-prediction,"Positions Capital Investments and Stock Returns within General Finance, Surveys, and Trading Systems.","high citation signal (1,428); influential citation signal (74); recognized finance/AI venue; open-access PDF metadata","Surveys and systems can dominate citations while empirical evidence remains mixed across markets.; Broad claims need careful mapping to data, costs, and investment horizons.; Metadata-driven ranking cannot replace expert reading of full papers and backtests.",https://doi.org/10.1017/S0022109000003173,https://www.semanticscholar.org/paper/439fda58cbe8108bb41026b40183aa2956c51713,https://doi.org/10.3386/w9951,,10.1017/S0022109000003173,,,14335876,Business; Economics,,stock returns,1,citations=1428; influential=74; recognized finance/AI venue; open PDF metadata; title trade matches=2; trade term matches=2,
91,9,9,2003,Federal Reserve Bank of New York Staff Reports What Explains the Stock Market's Reaction to Federal Reserve Policy? What Explains the Stock Market's Reaction to Federal Reserve Policy?,"B. Bernanke, Kenneth N. Kuttner, Jon Faust, R. Gürkaynak, M. Lettau, Sydney C. Ludvigson, Athanasios Orphanides, Glenn D. Rudebusch, et al.",,,1327,177,237.756,Reinforcement Learning and Algorithmic Trading,reinforcement-learning,stock-prediction; reinforcement-trading,Positions Federal Reserve Bank of New York Staff Reports What Explains the Stock Market's Reaction to Federal Reserve Policy? What Explains the Stock Market's Reaction to Federal Reserve Policy? within Reinforcement Learning and Algorithmic Trading.,"high citation signal (1,327); influential citation signal (177)","Simulated rewards can diverge from executable trading under slippage, latency, and market impact.; Policies can be brittle during regime shifts or stress periods.; Backtest-only evidence needs live or paper-trading validation.",https://www.semanticscholar.org/paper/5c59892589ecf36e706db20691e4c668aac8adb5,https://www.semanticscholar.org/paper/5c59892589ecf36e706db20691e4c668aac8adb5,,,,,,12726106,Economics,,equity market forecasting; stock market prediction; stock price prediction,3,citations=1327; influential=177; open PDF metadata; title trade matches=1; trade term matches=1; query hits=3,
112,10,10,2003,Applied Time Series Modelling and Forecasting,"Richard Harris, Robert Sollis",,,1094,72,218.034,"General Finance, Surveys, and Trading Systems",metadata-ranked,stock-prediction,"Positions Applied Time Series Modelling and Forecasting within General Finance, Surveys, and Trading Systems.","high citation signal (1,094); influential citation signal (72)","Surveys and systems can dominate citations while empirical evidence remains mixed across markets.; Broad claims need careful mapping to data, costs, and investment horizons.; Metadata-driven ranking cannot replace expert reading of full papers and backtests.",https://www.semanticscholar.org/paper/6b3d29c69ec8d5391d19e92d17d96a40195b5103,https://www.semanticscholar.org/paper/6b3d29c69ec8d5391d19e92d17d96a40195b5103,,,,,,150883011,Economics; Mathematics,Review,financial time series forecasting,1,citations=1094; influential=72; open PDF metadata; title trade matches=1; trade term matches=1,
132,11,11,2003,Support vector machine with adaptive parameters in financial time series forecasting,"Lijuan Cao, F. Tay",IEEE Trans. Neural Networks,2003-11-01,1014,52,222.882,Machine Learning for Stock Prediction,machine-learning; deep-learning,machine-learning; ai-based-trade,Positions Support vector machine with adaptive parameters in financial time series forecasting within Machine Learning for Stock Prediction.,"high citation signal (1,014); influential citation signal (52); open-access PDF metadata","Predictive accuracy may not translate into risk-adjusted returns after costs.; Feature leakage, survivorship bias, and nonstationarity are persistent concerns.; Metadata-driven screening cannot audit the exact train/test split.",https://doi.org/10.1109/TNN.2003.820556,https://www.semanticscholar.org/paper/a244c47a1d4a8c2894b22807df8c7eec16cc110a,http://www.dabi.temple.edu/~vucetic/cis525spring2004/cao.pdf,,10.1109/TNN.2003.820556,,18244595,18315563,Business; Computer Science; Medicine,JournalArticle,financial time series forecasting,1,citations=1014; influential=52; AI/ML method signal; open PDF metadata; title trade matches=3; trade term matches=4,
144,12,12,2003,Winter Blues: A SAD Stock Market Cycle,"M. Kamstra, Lisa A. Kramer, Maurice D. Levi",,2003-10-01,964,71,215.06,"General Finance, Surveys, and Trading Systems",metadata-ranked,stock-prediction,"Positions Winter Blues: A SAD Stock Market Cycle within General Finance, Surveys, and Trading Systems.",high citation signal (964); influential citation signal (71); open-access PDF metadata,"Surveys and systems can dominate citations while empirical evidence remains mixed across markets.; Broad claims need careful mapping to data, costs, and investment horizons.; Metadata-driven ranking cannot replace expert reading of full papers and backtests.",https://doi.org/10.2139/SSRN.208622,https://www.semanticscholar.org/paper/49095722c183e50757f8f69639f2e75a91752858,https://www.econstor.eu/bitstream/10419/100871/1/wp2002-13.pdf,,10.2139/SSRN.208622,,,154300861,Economics; Psychology,,stock returns,1,citations=964; influential=71; open PDF metadata; title trade matches=1; trade term matches=1,
146,13,13,2003,Dotcom Mania: The Rise and Fall of Internet Stock Prices,"E. Ofek, Matthew Richardson",,2003-06-01,959,49,212.841,"General Finance, Surveys, and Trading Systems",metadata-ranked,stock-prediction,"Positions Dotcom Mania: The Rise and Fall of Internet Stock Prices within General Finance, Surveys, and Trading Systems.",high citation signal (959); influential citation signal (49); open-access PDF metadata,"Surveys and systems can dominate citations while empirical evidence remains mixed across markets.; Broad claims need careful mapping to data, costs, and investment horizons.; Metadata-driven ranking cannot replace expert reading of full papers and backtests.",https://doi.org/10.1111/1540-6261.00560,https://www.semanticscholar.org/paper/3b71cea87e1e43c36f47ae7fc93b21b1d1d9c81e,http://papers.nber.org/papers/w8630.pdf,,10.1111/1540-6261.00560,,,235276599,Economics,,value investing stock market,1,citations=959; influential=49; open PDF metadata; title trade matches=2; trade term matches=2,
171,14,14,2003,Stock Price Reaction to News and No-news: Drift and Reversal After Headlines,Wesley S. Chan,,2003-11-01,887,110,221.291,"Sentiment, News, and Alternative Data",sentiment/text,stock-prediction; sentiment-altdata,"Positions Stock Price Reaction to News and No-news: Drift and Reversal After Headlines within Sentiment, News, and Alternative Data.",high citation signal (887); influential citation signal (110),Timestamp alignment and look-ahead bias are critical for text and alternative-data studies.; Sentiment signals can decay quickly as information becomes crowded.; Data licensing and coverage bias can limit reproducibility.,https://doi.org/10.1016/S0304-405X(03)00146-6,https://www.semanticscholar.org/paper/41b5fba72564aa33f4bce51e0f7484c3ba482f4b,,,10.1016/S0304-405X(03)00146-6,,,263353526,Economics,,earnings announcements stock returns; stock returns,2,citations=887; influential=110; open PDF metadata; title trade matches=1; trade term matches=1; query hits=2,
173,15,15,2003,Delta-Hedged Gains and the Negative Market Volatility Risk Premium,"G. Bakshi, Nikunj Kapadia",,2003-04-01,880,155,231.881,"Risk, Volatility, and Forecast Evaluation",risk/volatility,risk-volatility,"Positions Delta-Hedged Gains and the Negative Market Volatility Risk Premium within Risk, Volatility, and Forecast Evaluation.",high citation signal (880); influential citation signal (155),Risk forecasts can fail under regime breaks and extreme events.; Choice of loss function strongly affects model rankings.; Citation counts do not prove suitability for a specific mandate or risk budget.,https://doi.org/10.2139/SSRN.267106,https://www.semanticscholar.org/paper/c7abf9008a69a45b0501f30f3c2a46c78098ad09,,,10.2139/SSRN.267106,,,16157311,Economics,,options market stock returns; risk premium stock returns; stock returns,3,citations=880; influential=155; investment validation signal; open PDF metadata; title trade matches=1; trade term matches=1; query hits=3,
204,16,16,2003,Measuring The Reaction of Monetary Policy to the Stock Market,"R. Rigobon, Brian P. Sack",,2003-05-01,821,62,209.662,Reinforcement Learning and Algorithmic Trading,reinforcement-learning,stock-prediction; reinforcement-trading,Positions Measuring The Reaction of Monetary Policy to the Stock Market within Reinforcement Learning and Algorithmic Trading.,high citation signal (821); influential citation signal (62); open-access PDF metadata,"Simulated rewards can diverge from executable trading under slippage, latency, and market impact.; Policies can be brittle during regime shifts or stress periods.; Backtest-only evidence needs live or paper-trading validation.",https://doi.org/10.1162/003355303321675473,https://www.semanticscholar.org/paper/7b318dc938df8bff614f56c89cb71ea0bdf54ddd,http://papers.nber.org/papers/w8350.pdf,,10.1162/003355303321675473,,,16515980,Economics,,stock returns,1,citations=821; influential=62; open PDF metadata; title trade matches=1; trade term matches=1,
234,17,17,2003,The economic cost of publicly announced information security breaches: empirical evidence from the stock market,"Katherine Campbell, Lawrence A. Gordon, Martin P. Loeb, Lei Zhou",Journal of computing and security,2003-04-01,767,72,210.23,"General Finance, Surveys, and Trading Systems",metadata-ranked,stock-prediction,"Positions The economic cost of publicly announced information security breaches: empirical evidence from the stock market within General Finance, Surveys, and Trading Systems.",high citation signal (767); influential citation signal (72),"Surveys and systems can dominate citations while empirical evidence remains mixed across markets.; Broad claims need careful mapping to data, costs, and investment horizons.; Metadata-driven ranking cannot replace expert reading of full papers and backtests.",https://doi.org/10.3233/JCS-2003-11308,https://www.semanticscholar.org/paper/44bbffcb013753851e24d8fd19fa787e19be094f,,,10.3233/JCS-2003-11308,,,416447,Business; Computer Science; Economics,JournalArticle,securities market,1,citations=767; influential=72; open PDF metadata; title trade matches=1; trade term matches=1,
236,18,18,2003,"Political Relationships, Global Financing and Corporate Transparency","C. Leuz, Felix Oberholzer-Gee",,2003-08-01,764,38,200.367,"General Finance, Surveys, and Trading Systems",metadata-ranked,stock-prediction,This study examines the financing choices of firms operating in a weak institutional environment.,high citation signal (764); influential citation signal (38); open-access PDF metadata,"Surveys and systems can dominate citations while empirical evidence remains mixed across markets.; Broad claims need careful mapping to data, costs, and investment horizons.; Metadata-driven ranking cannot replace expert reading of full papers and backtests.",https://doi.org/10.2139/ssrn.720741,https://www.semanticscholar.org/paper/841415a194eaf7345b4742eb3f57911e4ffd7a91,https://www.econstor.eu/bitstream/10419/214279/1/2003-03.pdf,,10.2139/ssrn.720741,,,153539283,Business; Political Science,,securities market,1,citations=764; influential=38; open PDF metadata; trade term matches=2,"This study examines the financing choices of firms operating in a weak institutional environment. We argue that in relationship-based systems, global financing and political connections are substitutes: Well-connected firms are less likely to access foreign capital markets because (state-owned) domestic banks provide capital at low cost. Moreover, the additional scrutiny that comes with foreign securities might be at odds with close political ties at home. Using data from Indonesia, we provide strong support for this hypothesis. Firms with close political ties to former President Soeharto are significantly less likely than non-connected firms to have publicly traded foreign securities. We also examine how returns before and during the Asian financial crisis differ between firms with and without foreign securities. The former performed significantly better during the crisis, and their performance advantage increases considerably once we control for a firm?s closeness to the Soeharto regime. We show that simple return regressions in earlier work are downward biased if domestic opportunities such as political connections are ignored."
290,19,19,2003,Financial Valuation and Risk Management Working Paper No . 92 Corporate Governance and Expected Stock Returns : Evidence from Germany,"W. Drobetz, A. Schillhofer, H. Zimmermann",,,643,38,208.579,"Risk, Volatility, and Forecast Evaluation",risk/volatility,risk-volatility,"Positions Financial Valuation and Risk Management Working Paper No . 92 Corporate Governance and Expected Stock Returns : Evidence from Germany within Risk, Volatility, and Forecast Evaluation.",high citation signal (643); influential citation signal (38),Risk forecasts can fail under regime breaks and extreme events.; Choice of loss function strongly affects model rankings.; Citation counts do not prove suitability for a specific mandate or risk budget.,https://www.semanticscholar.org/paper/0c256f935a3baf5e1aa11e8ee96042dd42321ca5,https://www.semanticscholar.org/paper/0c256f935a3baf5e1aa11e8ee96042dd42321ca5,,,,,,10211170,Business; Economics,,stock returns,1,citations=643; influential=38; investment validation signal; open PDF metadata; title trade matches=3; trade term matches=3,
315,20,20,2003,"Hot Markets, Investor Sentiment, and IPO Pricing","Alexander P. Ljungqvist, Vikram K. Nanda, Rajdeep Singh",,,617,48,202.868,"Sentiment, News, and Alternative Data",sentiment/text,sentiment-altdata; behavioral-finance,"Positions Hot Markets, Investor Sentiment, and IPO Pricing within Sentiment, News, and Alternative Data.",high citation signal (617); influential citation signal (48); open-access PDF metadata,Timestamp alignment and look-ahead bias are critical for text and alternative-data studies.; Sentiment signals can decay quickly as information becomes crowded.; Data licensing and coverage bias can limit reproducibility.,https://doi.org/10.2139/ssrn.282293,https://www.semanticscholar.org/paper/b80a697564c531779af1e22a13eff9c8f3eb2301,http://archive.nyu.edu/bitstream/2451/26536/2/FIN-01-007.pdf,,10.2139/ssrn.282293,,,16847059,Business; Economics,,stock market prediction; stock price prediction; value investing stock market,3,citations=617; influential=48; open PDF metadata; title trade matches=1; trade term matches=1; query hits=3,
316,21,21,2003,"Economic, Demographic, and Institutional Determinants of Life Insurance Consumption across countries","T. Beck, Ian Webb",,2003-01-01,616,110,211.281,"General Finance, Surveys, and Trading Systems",metadata-ranked,stock-prediction,"Life insurance has become an increasingly important part of the financial sector over the past 40 years, providing a range of financial services for consumers and becoming a major source of investment in the capital market.",high citation signal (616); influential citation signal (110); open-access PDF metadata,"Surveys and systems can dominate citations while empirical evidence remains mixed across markets.; Broad claims need careful mapping to data, costs, and investment horizons.; Metadata-driven ranking cannot replace expert reading of full papers and backtests.",https://doi.org/10.1093/WBER/LHG011,https://www.semanticscholar.org/paper/6f630d10e512e7d9e3bf5869448cbc018cf925b2,https://openknowledge.worldbank.org/bitstreams/d928b4b2-d24d-520c-8d7b-58859b9ed975/download,,10.1093/WBER/LHG011,,,18925105,Economics,Book,capital markets investment; securities market,2,citations=616; influential=110; open PDF metadata; trade term matches=1; query hits=2,"Life insurance has become an increasingly important part of the financial sector over the past 40 years, providing a range of financial services for consumers and becoming a major source of investment in the capital market. But what drives the large variation in life insurance consumption across countries remains unclear. Using a panel with data aggregated at different frequencies for 68 economies in 1961-2000, this article finds that economic indicators such as inflation, income per capita, and banking sector development and religious and institutional indicators are the most robust predictors of the use of life insurance. Education, life expectancy, the young dependency ratio, and the size of the social security system appear to have no robust association with life insurance consumption. The results highlight the importance of price stability and banking sector development in fully realizing the savings and investment functions of life insurance in an economy."
