rank,yearRank,candidateRank,year,title,authors,venue,publicationDate,citationCount,influentialCitationCount,importanceScore,category,methodTags,keywordTags,keyIdea,strengths,limitations,url,semanticScholarUrl,openAccessPdf,githubUrl,doi,arxiv,pubmed,corpusId,fieldsOfStudy,publicationTypes,sourceQueries,queryHitCount,importanceReasons,abstract
932,45,45,2006,Revenue surprises and stock returns,"Narasimhan Jegadeesh, J. Livnat",,2006-04-01,296,30,183.338,Asset Pricing and Return Predictability,metadata-ranked,asset-pricing,Positions Revenue surprises and stock returns within Asset Pricing and Return Predictability.,high citation signal (296); influential citation signal (30),"Return predictability can disappear after transaction costs, crowding, and multiple-testing correction.; Citation impact can favor well-known anomalies even when live performance later weakens.; Metadata cannot verify whether data-snooping controls were adequate.",https://doi.org/10.1016/J.JACCECO.2005.10.003,https://www.semanticscholar.org/paper/f55c95f77de1e6dda5c46e9407a7acbec37679f0,,,10.1016/J.JACCECO.2005.10.003,,,35384451,Business; Economics,,analyst forecasts stock returns; earnings announcements stock returns; stock returns,3,citations=296; influential=30; open PDF metadata; title trade matches=2; trade term matches=2; query hits=3,
994,46,46,2006,The Pecking Order of Cross-Border Investment,"Christian Daude, Marcel Fratzscher",Social Science Research Network,,282,23,175.693,Portfolio Optimization and Asset Allocation,portfolio,portfolio,Is there a pecking order of cross-border investment in that countries become financially integrated primarily through some types of investment rather than others?,high citation signal (282); influential citation signal (23); open-access PDF metadata,"Allocation gains can be dominated by estimation error, turnover, short-sale constraints, and benchmark choice.; Backtests may hide capacity and liquidity limits.; Metadata cannot confirm implementation details such as costs, leverage, or rebalancing rules.",https://doi.org/10.1016/J.JINTECO.2007.05.010,https://www.semanticscholar.org/paper/7f0547065bbfea5cb5cc3504816b6b742af0d2c3,https://www.econstor.eu/bitstream/10419/153024/1/ecbwp0590.pdf,,10.1016/J.JINTECO.2007.05.010,,,15659060,Business; Economics,,securities trading investment,1,citations=282; influential=23; investment validation signal; open PDF metadata; trade term matches=1,"Is there a pecking order of cross-border investment in that countries become financially integrated primarily through some types of investment rather than others? Using a novel database of bilateral capital stocks for all types of investment - FDI, portfolio equity securities, debt securities as well as loans - for a broad set of 77 countries, we show that such a pecking order indeed exists. Motivated by the theoretical work on the capital structure of firms, the paper focuses on two key determinants of this pecking order: information frictions and the quality of host country institutions. Overall, we find that in particular FDI, and to some extent also loans, are substantially more sensitive to information frictions than investment in portfolio equity and debt securities. We also show that the share as well as the size of FDI that a country receive are largely insensitive to institutional factors in host countries, while portfolio investment is by far the most sensitive to the quality of institutions. This provides new evidence in favor of some hypotheses but contradicts others put forward in the theoretical literature on trade in financial assets. JEL Classification: F34, G11, F21"
1021,47,47,2006,Do Stock Market Investors Understand the Risk Sentiment of Corporate Annual Reports,Feng Li,,2006-04-21,277,34,186.583,"Sentiment, News, and Alternative Data",sentiment/text; risk/volatility,stock-prediction; sentiment-altdata; risk-volatility,"Positions Do Stock Market Investors Understand the Risk Sentiment of Corporate Annual Reports within Sentiment, News, and Alternative Data.",high citation signal (277); influential citation signal (34); open-access PDF metadata,Timestamp alignment and look-ahead bias are critical for text and alternative-data studies.; Sentiment signals can decay quickly as information becomes crowded.; Data licensing and coverage bias can limit reproducibility.,https://doi.org/10.2139/SSRN.898181,https://www.semanticscholar.org/paper/620e727246680d3da32b6e035a90c70e076b51aa,http://www.cis.upenn.edu/~mkearns/finread/sentiment.pdf,,10.2139/SSRN.898181,,,16273912,Business; Economics,,investor sentiment stock returns; market efficiency stock returns; momentum investing stock market; stock returns,4,citations=277; influential=34; investment validation signal; open PDF metadata; title trade matches=1; trade term matches=1; query hits=4,
1024,48,48,2006,Public Policy and the Creation of Active Venture Capital Markets,"M. Rin, Giovanna Nicodano, A. Sembenelli",Social Science Research Network,2006-09-01,277,13,168.754,Reinforcement Learning and Algorithmic Trading,reinforcement-learning,reinforcement-trading,"We study how public policy can contribute to increase the share of early stage and high-tech venture capital investments, thus helping the development of active venture capital markets.",high citation signal (277); influential citation signal (13); open-access PDF metadata,"Simulated rewards can diverge from executable trading under slippage, latency, and market impact.; Policies can be brittle during regime shifts or stress periods.; Backtest-only evidence needs live or paper-trading validation.",https://doi.org/10.1016/J.JPUBECO.2005.09.013,https://www.semanticscholar.org/paper/423b7245bc482fc8003526939b1366688b241efd,https://research.tilburguniversity.edu/files/771176/DaRin-Nicodano-Sembenelli.pdf,,10.1016/J.JPUBECO.2005.09.013,,,91183753,Business; Economics,,capital markets investment,1,citations=277; influential=13; open PDF metadata; title trade matches=2; trade term matches=3,"We study how public policy can contribute to increase the share of early stage and high-tech venture capital investments, thus helping the development of active venture capital markets. A simple extension of the seminal model by Holmstrom and Tirole (1997) provides a theoretical base for our analysis. We then explore a unique panel of data for 14 European countries between 1988 and 2001. We have several novel findings. First, the opening of stock markets targeted at entrepreneurial companies positively affects the shares of early stage and high-tech venture capital investments; reductions in capital gains tax rates have a similar, albeit weaker, effect. Second, a reduction in labor regulation creases the share of high-tech investments. Finally, we find no evidence of a shortage of supply of venture capital funds, and no evidence of an effect of increased public R&D spending on the share of high-tech or early stage venture capital investments. JEL Classification: G10, G24, H20, O30"
1030,49,49,2006,Forecasting Stock Index Movement: A Comparison of Support Vector Machines and Random Forest,"Manish Kumar, T. M.",,2006-01-24,276,12,179.638,Machine Learning for Stock Prediction,machine-learning,machine-learning,Positions Forecasting Stock Index Movement: A Comparison of Support Vector Machines and Random Forest within Machine Learning for Stock Prediction.,high citation signal (276); influential citation signal (12),"Predictive accuracy may not translate into risk-adjusted returns after costs.; Feature leakage, survivorship bias, and nonstationarity are persistent concerns.; Metadata-driven screening cannot audit the exact train/test split.",https://doi.org/10.2139/SSRN.876544,https://www.semanticscholar.org/paper/c0e43f03e69df1b94ad913341a270933af9658e1,,,10.2139/SSRN.876544,,,155745378,Business; Computer Science; Economics; Mathematics,,financial market prediction; financial time series forecasting; machine learning stock market; neural networks stock market; stock market prediction; stock price prediction; support vector machine stock prediction,7,citations=276; influential=12; AI/ML method signal; open PDF metadata; title trade matches=3; trade term matches=3; query hits=7,
1073,50,50,2006,"Stock Returns, Implied Volatility Innovations, and the Asymmetric Volatility Phenomenon","Patrick J. Dennis, Stewart Mayhew, Chris Stivers",Journal of Financial and Quantitative Analysis,2006-06-01,271,13,182.274,"Risk, Volatility, and Forecast Evaluation",risk/volatility,risk-volatility,"Positions Stock Returns, Implied Volatility Innovations, and the Asymmetric Volatility Phenomenon within Risk, Volatility, and Forecast Evaluation.",high citation signal (271); influential citation signal (13); recognized finance/AI venue,Risk forecasts can fail under regime breaks and extreme events.; Choice of loss function strongly affects model rankings.; Citation counts do not prove suitability for a specific mandate or risk budget.,https://doi.org/10.1017/S0022109000002118,https://www.semanticscholar.org/paper/18f109aaafcd13909bd250600a5809421eee87a1,,,10.1017/S0022109000002118,,,33895902,Economics,,stock returns,1,citations=271; influential=13; recognized finance/AI venue; investment validation signal; open PDF metadata; title trade matches=2; trade term matches=2,
1100,51,51,2006,A Consumption-Based Explanation of Expected Stock Returns,"Moto Yogo, Moto Yogo",,2006-04-01,266,32,180.871,Asset Pricing and Return Predictability,metadata-ranked,asset-pricing,Positions A Consumption-Based Explanation of Expected Stock Returns within Asset Pricing and Return Predictability.,high citation signal (266); influential citation signal (32); open-access PDF metadata,"Return predictability can disappear after transaction costs, crowding, and multiple-testing correction.; Citation impact can favor well-known anomalies even when live performance later weakens.; Metadata cannot verify whether data-snooping controls were adequate.",https://doi.org/10.1111/J.1540-6261.2006.00848.X,https://www.semanticscholar.org/paper/e3de034d8e4261781e1374f00b3afa9eb8c10739,https://repository.upenn.edu/bitstreams/36be46dd-2ffb-422b-8520-d3fd77a9c477/download,,10.1111/J.1540-6261.2006.00848.X,,,285656650,Economics,,equity returns; stock returns,2,citations=266; influential=32; open PDF metadata; title trade matches=2; trade term matches=2; query hits=2,
1103,52,52,2006,Forecasting the volatility of stock price index,T. Roh,Expert systems with applications,2006-08-14,266,8,179.681,"Risk, Volatility, and Forecast Evaluation",risk/volatility,stock-prediction; risk-volatility,"Positions Forecasting the volatility of stock price index within Risk, Volatility, and Forecast Evaluation.",high citation signal (266); recognized finance/AI venue,Risk forecasts can fail under regime breaks and extreme events.; Choice of loss function strongly affects model rankings.; Citation counts do not prove suitability for a specific mandate or risk budget.,https://doi.org/10.1016/j.eswa.2006.08.001,https://www.semanticscholar.org/paper/32bb543d946963b6f4a8023459f32cb3d96cb320,,,10.1016/j.eswa.2006.08.001,,,36199078,Business; Computer Science; Economics; Mathematics,JournalArticle,financial time series forecasting; neural networks stock market; risk management portfolio stock; volatility forecasting stock market,4,citations=266; influential=8; recognized finance/AI venue; investment validation signal; open PDF metadata; title trade matches=2; trade term matches=2; query hits=4,
1195,53,53,2006,Supply Chain Management Best Practices,D. Blanchard,,2006-12-05,251,12,164.557,"Risk, Volatility, and Forecast Evaluation",risk/volatility,risk-volatility,Preface To The Second Edition Acknowledgments Part I Introduction To Supply Chain Management.,high citation signal (251); influential citation signal (12); open-access PDF metadata,Risk forecasts can fail under regime breaks and extreme events.; Choice of loss function strongly affects model rankings.; Citation counts do not prove suitability for a specific mandate or risk budget.,https://doi.org/10.1002/9781119738275,https://www.semanticscholar.org/paper/454f2b0adfb6aff5e07770ab68c0de26fed2202b,https://pq-static-content.proquest.com/collateral/media2/documents/ebookcentral-dda.pdf,,10.1002/9781119738275,,,108674888,Business; Engineering,,securities trading investment,1,citations=251; influential=12; investment validation signal; open PDF metadata; trade term matches=1,"Preface To The Second Edition Acknowledgments Part I Introduction To Supply Chain Management. CHAPTER 1 If Supply Chain is the Answer, Then What's the Question? Flashpoints. You Knew This Job Was Dangerous When You Took It. The Big Picture. The Supply Chain's Back Story. Roadblocks On The Supply Chain Path. Separating The Good From The Best. CHAPTER 2 Anatomy of a Supply Chain. Flashpoints. Aerospace: Changing The Game, For Better Or Worse. Automotive: Building Customer Loyalty For The Long Term. Chemicals: Finding The Right Supply Chain Formula. Consumer Packaged Goods: The Moment Of Truth. Food And Beverage: Cutting Out The Middleman. High-Tech/Electronics: Zero Latency. Pharmaceuticals: Fighting Counterfeiters With RFID. Retail: Customer Centricity. CHAPTER 3 Supply Chain Metrics: Measuring Up to High Standards. Flashpoints. How To Prevent A Supply Chain Heart Attack. What Makes A Supply Chain Leader? Measure Satisfaction. Everybody's Talking About Benchmarking. Do The Right Things. Supply Chain Checkup. Time For A Turnaround. Learn The SCOR. SCM For Dummies. Follow The Roadmap. Make It All Meaningful. Part II Traditional Core Processes Of Supply Chain Management. CHAPTER 4 Planning and Forecasting: Headed for the Future. Flashpoints. A Bias Against Good Plans. From Soup To S&OP. No Time Like The Real Time. The Truth Plays Out. End-To-End Integration. The First Shall Be First. Analyze This. A Happy Ending. CHAPTER 5 Procurement: Go Right to the Source. Flashpoints. Giving Procurement Its Due. Managing The Changes. Keep Your Friends Close And Your Suppliers Closer. Looking Backward To See Forward. Working For Every Penny. Ensuring A Healthy Supply Chain. The War On Complexity. It Seemed Like A Good Idea At The Time. An Online Car Wreck. A Rating Service For Buyers And Sellers. CHAPTER 6 Manufacturing: Supply Chain on the Make. Flashpoints. A Direct Line To Supply Chain Success. Better Decisions For The Customer. Tying It All Together. Digital Supply Chains. Collaborating On Product Designs. Nearly Perfect. The Future Of Manufacturing. CHAPTER 7 Transportation: Logistics a la Mode. Flashpoints. Riding The Roads. Regulations And Deregulation. Fuel For Thought. A Capacity For Change. Know Thyself, And Thy Carrier, Too. How To Achieve Sustainable Savings. Collaboration Is A Two-Way Street. A Carrier By Any Other Name. Automate To Consolidate. Get It There On Time. CHAPTER 8 Distribution and Warehousing: Going with the Flow. Flashpoints. Virtual Inventory. Cross-Docking, Compliance, And Collaboration. Handle With Care. Where The Rubber Meets The Load. Can You Hear Me Now? Wireless In The Warehouse. Turn, Turn, Turn. Half-Full Or Half-Empty? How To Better Manage Your Warehouse. CHAPTER 9 Site Selection: Location, Location, Location. Flashpoints. Striking The Proper Balance. A Site For Sore Eyes. Finding The Right Place. A Look At Gillette's Distribution Network. Cost Versus Service. Match Your Network To Your Business Strategy. How Much Is Too Much? Weighing The Intangibles. Quality Over Quantity. A Quick Guide To Site Selection. CHAPTER 10 Globalization: It's a Not-So-Small World. Flashpoints. Playing By Somebody Else's Rules. Develop A Global Vision. Friendly Nations. Low Cost Sometimes Means Poor Service . Living In A Somewhat Flat World. Keeping An Eye On China. Take A Look For Yourself. Finding The Next Global Hot Spot. The Need For Supply Chain Visibility. Closer To Home. CHAPTER 11 Customer Service: Keeping the Customer Satisfied. Flashpoints. The Perfect Order. The High Cost Of Imperfection. One Good Return Deserves Another. Supply Chain In Reverse. Managing The Relationship. Money In The Bank. Supply Chain At Your Service. A Culture Of Customer Satisfaction. Part III Supply Chain Strategies. CHAPTER 12 3PLs: When You'd Rather Not Do It Yourself. Flashpoints. A Shift To The Supply Chain Side. Letting Somebody Else Do It. Supply Chain Essentials And Nonessentials. Finding Your Core Competency. Square Pegs And Round Holes. Think Strategically. The Financial Impact Of Outsourcing. Staying In Touch. Going Beyond The 3PL Model. Outpacing The Competition. CHAPTER 13 Collaboration: Extending the Enterprise. Flashpoints. Mutually Beneficial Relationships. Winning Small Victories. Respecting Your Partners. A Better Way To Sell Mouthwash. A Nine-Step Program For CPFR. Great Expectations, So-So Results. More Reliability And Better Service. Challenges In Supplier Management. How To Get The Most Out of a Relationship. CHAPTER 14 Security: Seeking Shelter from Supply Chain Storms. Flashpoints. It'll Never Happen Here . Customs-Trade Partnership Against Terrorism. Getting Countries To Talk To Each Other. Sometimes Low-Tech Is As Good As High-Tech. Taking Responsibility For Your Supply Chain. Securing The Supply Chain. 10+2. Taking Steps Toward Effective Compliance. Supply Chains at Risk. An Investment Worth Making. CHAPTER 15 RFID: A Game of Tags. Flashpoints. The ABCs Of RFID Proactive Replenishment. In Search of Payback. Tagging till the Cows Come Home. Taking RFID Seriously. Work the Bugs Out. A Matter of Privacy. No Need to be Passive. CHAPTER 16 Green Supply Chains: It's Not Easy Going Green. Flashpoints. The Elephant In The Room. Justifying The Cost. Look For The Green Label. The Carbon Footprint of a Banana. Sustainability Throughout the Supply Chain. Good to Green. How Big Blue Went Green. Eco-Friendly Strategies. Low-Hanging Fruit. CHAPTER 17 Continuous Improvement: Lean on Me. Flashpoints. From Push to Pull. The Toyota Way. Don't Settle for Occasional Improvement. Lean Principles. Lean, Mean Flying Machine. The Value of Teamwork. Leaning In the Right Direction. CHAPTER 18 The Supply Chain Profession: What Keeps You Up at Night? Flashpoints. Talent Search. Hiring Problem Solvers. Training the Next Generation. Optimizing the Workforce. What Keeps You Up at Night? Gray Matters. The Secret to Supply Chain Success. Notes. About The Author. Index."
1213,54,54,2006,Diagnosing Discrimination: Stock Returns and CEO Gender,J. Wolfers,Social Science Research Network,,248,20,173.007,"General Finance, Surveys, and Trading Systems",metadata-ranked,stock-prediction,"A vast labor literature has found evidence of a %u201Cglass ceiling%u201D, whereby women are under-represented among senior management.",high citation signal (248); influential citation signal (20); open-access PDF metadata,"Surveys and systems can dominate citations while empirical evidence remains mixed across markets.; Broad claims need careful mapping to data, costs, and investment horizons.; Metadata-driven ranking cannot replace expert reading of full papers and backtests.",https://doi.org/10.1162/JEEA.2006.4.2-3.531,https://www.semanticscholar.org/paper/a0c35e5c624d50aa60c4a7b0ce6e8ff89747feb5,http://papers.nber.org/papers/w11989.pdf,,10.1162/JEEA.2006.4.2-3.531,,,16077011,Business; Economics,,stock returns,1,citations=248; influential=20; open PDF metadata; title trade matches=2; trade term matches=4,"A vast labor literature has found evidence of a %u201Cglass ceiling%u201D, whereby women are under-represented among senior management. A key question remains the extent to which this reflects unobserved differences in productivity, preferences, prejudice, or systematically biased beliefs about the ability of female managers. Disentangling these theories would require data on productivity, on the preferences of those who interact with managers, and on perceptions of productivity. Financial markets provide continuous measures of the market%u2019s perception of the value of firms, taking account of the beliefs of market participants about the ability of men and women in senior management. As such, financial data hold the promise of potentially providing insight into the presence of mistake-based discrimination. Specifically if female-headed firms were systematically under-estimated, this would suggest that female-headed firms would outperform expectations, yielding excess returns. Examining data on S&P 1500 firms over the period 1992-2004 I find no systematic differences in returns to holding stock in female-headed firms, although this result reflects the weak statistical power of our test, rather than a strong inference that financial markets either do or do not under-estimate female CEOs."
1267,55,55,2006,Correlation based networks of equity returns sampled at different time horizons,"M. Tumminello, T. Matteo, T. Aste, R. Mantegna",,2006-05-30,240,4,155.198,Portfolio Optimization and Asset Allocation,portfolio,portfolio,Abstract.We investigate the planar maximally filtered graphs of the portfolio of the 300 most capitalized stocks traded at the New York Stock Exchange during the time period 2001–2003.,high citation signal (240),"Allocation gains can be dominated by estimation error, turnover, short-sale constraints, and benchmark choice.; Backtests may hide capacity and liquidity limits.; Metadata cannot confirm implementation details such as costs, leverage, or rebalancing rules.",https://doi.org/10.1140/epjb/e2006-00414-4,https://www.semanticscholar.org/paper/3754265177676a1cd4d6ea2ca940c8187780f356,,,10.1140/epjb/e2006-00414-4,physics/0605251,,18534532,Business; Economics; Mathematics; Physics,,equity returns; quantitative trading; stock returns,3,citations=240; influential=4; investment validation signal; open PDF metadata; trade term matches=3; query hits=3,"Abstract.We investigate the planar maximally filtered graphs of the portfolio of the 300 most capitalized stocks traded at the New York Stock Exchange during the time period 2001–2003. Topological properties such as the average length of shortest paths, the betweenness and the degree are computed on different planar maximally filtered graphs generated by sampling the returns at different time horizons ranging from 5 min up to one trading day. This analysis confirms that the selected stocks compose a hierarchical system progressively structuring as the sampling time horizon increases. Finally, a cluster formation, associated to economic sectors, is quantitatively investigated."
1310,56,56,2006,Evolution of international stock and bond market integration: Influence of the European Monetary Union,"Suk-Joong Kim, Fariborz Moshirian, E. Wu",,2006-05-01,234,14,167.024,Reinforcement Learning and Algorithmic Trading,reinforcement-learning; risk/volatility,reinforcement-trading; risk-volatility,This chapter examines the dynamic relationship between daily stock and government bond returns of selected countries over the past decade to infer the state and progress of inter-financial market integration.,high citation signal (234); influential citation signal (14); open-access PDF metadata,"Simulated rewards can diverge from executable trading under slippage, latency, and market impact.; Policies can be brittle during regime shifts or stress periods.; Backtest-only evidence needs live or paper-trading validation.",https://doi.org/10.1016/J.JBANKFIN.2005.05.007,https://www.semanticscholar.org/paper/cd84142ca3bcddb98651b8f5e2776f052371737d,https://opus.lib.uts.edu.au/bitstream/10453/15844/1/2010001106.pdf,,10.1016/J.JBANKFIN.2005.05.007,,,42842102,Economics,,investor sentiment stock returns; stock returns,2,citations=234; influential=14; investment validation signal; open PDF metadata; trade term matches=1; query hits=2,"This chapter examines the dynamic relationship between daily stock and government bond returns of selected countries over the past decade to infer the state and progress of inter-financial market integration. We proceed to empirically investigate the influence of the European Monetary Union (EMU) on time-variations in inter-stock-bond market integration/ segmentation dynamics using a two-step procedure. First, we document the downward trends in time-varying conditional correlations between stock and bond market returns in European countries, Japan and the US. Second, we investigate the causality and determinants of this interdependent relationship, in particular, whether the various macroeconomic convergence criteria associated with the EMU have played a significant role. We find that real economic integration and the reduction in currency risk have generally had the desired effect on financial integration but monetary policy integration may have created uncertain investor sentiments on the economic future of the European monetary union, thereby stimulating a flight to quality phenomenon."
1317,57,57,2006,Multi-Objective Machine Learning,Yaochu Jin,Studies in Computational Intelligence,,233,9,160.253,Machine Learning for Stock Prediction,machine-learning,machine-learning,Positions Multi-Objective Machine Learning within Machine Learning for Stock Prediction.,high citation signal (233),"Predictive accuracy may not translate into risk-adjusted returns after costs.; Feature leakage, survivorship bias, and nonstationarity are persistent concerns.; Metadata-driven screening cannot audit the exact train/test split.",https://doi.org/10.1007/3-540-33019-4,https://www.semanticscholar.org/paper/8d1b6888aa08b0a590c9e5d1c563d5e646f0505e,,,10.1007/3-540-33019-4,,,37896067,Computer Science; Mathematics,,algorithmic trading,1,citations=233; influential=9; AI/ML method signal; open PDF metadata; title trade matches=1; trade term matches=1,
